adult,belongs_to_collection,budget,genres,homepage,id,imdb_id,original_language,original_title,overview,popularity,poster_path,production_companies,production_countries,release_date,revenue,runtime,spoken_languages,status,tagline,title,video,vote_average,vote_count
False,"{'id': 107725, 'name': 'Creepshow Collection', 'poster_path': '/wvoSFYgc36Zz2j8eDvysKDW1FZ.jpg', 'backdrop_path': '/yGxQgs3qBfmKk7VKT8VfyLKkA1I.jpg'}",3500000,"[{'id': 27, 'name': 'Horror'}]",,16288,tt0092796,en,Creepshow 2,"EC Comics-inspired weirdness returns with three tales. In the first, a wooden statue of a Native American comes to life...to exact vengeance on the murderer of his elderly owners. In the second, four teens are stranded on a raft on a lake with a blob that is hungry. And in the third, a hit and run woman is terrorized by the hitchhiker she accidentally killed...or did she really kill him?",9.330087,/qxJWtBb89RaSRgLuz1d6ZuFTfVG.jpg,"[{'name': 'New World Pictures', 'id': 1950}, {'name': 'Laurel Entertainment Inc.', 'id': 14180}]","[{'iso_3166_1': 'US', 'name': 'United States of America'}]",1987-05-01,14000000,92.0,"[{'iso_639_1': 'en', 'name': 'English'}]",Released,"When the curtain goes up, the terror begins.",Creepshow 2,False,5.9,133
False,,25000000,"[{'id': 80, 'name': 'Crime'}, {'id': 18, 'name': 'Drama'}, {'id': 53, 'name': 'Thriller'}]",,37094,tt0106856,en,Falling Down,"\"On the day of his daughter's birthday, William \"\"D-Fens\"\" Foster is trying to get to the home of his estranged ex-wife to see his daughter. His car breaks down",so he leaves his car in a traffic jam in Los Angeles and decides to walk. He goes to a convenience store and tries to get some change for a phone call,but the Korean owner does not oblige,tipping Foster over the edge. The unstable Foster,so frustrated with the various flaws he sees in society,"begins to psychotically and violently lash out against them.\"",10.175138,/jBHJWSUvvOIZkXG067vwVRWvohB.jpg,"[{'name': 'Regency Enterprises', 'id': 508}, {'name': 'Alcor Films', 'id': 644}, {'name': 'Canal+', 'id': 5358}, {'name': 'Warner Bros.', 'id': 6194}]","[{'iso_3166_1': 'US', 'name': 'United States of America'}]",1993-02-26,40903593,113.0,"[{'iso_639_1': 'en', 'name': 'English'}, {'iso_639_1': 'es', 'name': 'Español'}, {'iso_639_1': 'ko', 'name': '한국어/조선말'}]",Released
False,"{'id': 48037, 'name': 'Meatballs Collection', 'poster_path': '/jofx9VG0EqStZhdA8hXerNDn5bq.jpg', 'backdrop_path': None}",0,"[{'id': 35, 'name': 'Comedy'}]",,40773,tt0104837,en,Meatballs 4,"Ricky is the hottest water-ski instructor around and he has just be rehired by his former employer/camp to whip up attendance. But the camp is in serious financial trouble and the owner of a rival, more popular, camp wants to buy them out. Therefore they will have to engage in a mean, winner-takes-all competition that will settle the row once and for all.",0.921189,/2BdGVzFkZPQG9r1wOAq3Gkct3YM.jpg,[],[],1992-03-06,0,84.0,"[{'iso_639_1': 'en', 'name': 'English'}]",Released,"There's only one thing wilder, crazier and sexier then last summer - this summer.",Meatballs 4,False,3.3,4
False,"{'id': 34055, 'name': 'Pokémon Collection', 'poster_path': '/j5te0YNZAMXDBnsqTUDKIBEt8iu.jpg', 'backdrop_path': '/iGoYKA0TFfgSoZpG2u5viTJMGfK.jpg'}",30000000,"[{'id': 16, 'name': 'Animation'}]",,10228,tt0190641,ja,劇場版ポケットモンスター ミュウツーの逆襲,"The adventure explodes into action with the debut of Mewtwo, a bio-engineered Pokemon created from the DNA of Mew, the rarest of all Pokemon. Determined to prove its superiority, Mewtwo lures Ash, Pikachu and others into a Pokemon match like none before. Mewtwo vs. Mew. Super-clones vs. Pokemon. It's the ultimate showdown ... with the very future of the world at stake!",7.556826,/aalTziefHGUVLg44iyWS8B7ee5u.jpg,"\"[{'name': 'TV Tokyo', 'id': 3034}, {'name': '4 Kids Entertainment', 'id': 3035}, {'name': 'Shogakukan Production', 'id': 5261}, {'name': 'Media Factory', 'id': 7967}, {'name': 'Nintendo', 'id': 12288}, {'name': 'Creatures', 'id': 12307}, {'name': 'Tomy', 'id': 13070}, {'name': 'Oriental Light and Magic (OLM)', 'id': 66289}, {'name': 'GAME FREAK', 'id': 76467}, {'name': \"\"Pikachu Project '98\"\"",'id': 76468},{'name': 'JR Kikaku',"'id': 76469}]\"","[{'iso_3166_1': 'JP', 'name': 'Japan'}, {'iso_3166_1': 'US', 'name': 'United States of America'}]",1998-07-18,163644662,75.0,"[{'iso_639_1': 'ja', 'name': '日本語'}]",Released,The Pokémon Match of All Time is Here.,Pokémon: The First Movie: Mewtwo Strikes Back
False,,25485000,"[{'id': 36, 'name': 'History'}, {'id': 28, 'name': 'Action'}, {'id': 18, 'name': 'Drama'}, {'id': 12, 'name': 'Adventure'}, {'id': 10752, 'name': 'War'}]",,11165,tt0066473,en,Tora! Tora! Tora!,"\"In the summer of 1941, the United States and Japan seem on the brink of war after constant embargos and failed diplomacy come to no end. \"\"Tora! Tora! Tora!\"\"",named after the code words use by the lead Japanese pilot to indicate they had surprised the Americans,covers the days leading up to the attack on Pearl Harbor,"which plunged America into the Second World War.\"",7.262326,/njNKZEgVVTk7Q0Fir99fuvEMCf7.jpg,"[{'name': 'Twentieth Century Fox Film Corporation', 'id': 306}]","[{'iso_3166_1': 'JP', 'name': 'Japan'}, {'iso_3166_1': 'US', 'name': 'United States of America'}]",1970-01-26,29548291,144.0,"[{'iso_639_1': 'en', 'name': 'English'}, {'iso_639_1': 'ja', 'name': '日本語'}]",Released,The incredible attack on Pearl Harbor.,Tora! Tora! Tora!
False,,0,"[{'id': 35, 'name': 'Comedy'}, {'id': 878, 'name': 'Science Fiction'}]",http://www.banzai-institute.com/,11379,tt0086856,en,The Adventures of Buckaroo Banzai Across the 8th Dimension,"Adventurer/surgeon/rock musician Buckaroo Banzai and his band of men, the Hong Kong Cavaliers, take on evil alien invaders from the 8th dimension.",7.778445,/zaIvuZWPtmyQvsYMeLtox4vTlD2.jpg,"[{'name': 'Sherwood Productions', 'id': 8791}]","[{'iso_3166_1': 'US', 'name': 'United States of America'}]",1984-08-15,0,103.0,"[{'iso_639_1': 'en', 'name': 'English'}]",Released,Beings from Another Dimension have invaded your world.,The Adventures of Buckaroo Banzai Across the 8th Dimension,False,6.3,103
False,"{'id': 95051, 'name': 'The Up Series', 'poster_path': '/nLIBjyGeV2TMiv82MmKq5zX9DhG.jpg', 'backdrop_path': None}",0,"[{'id': 99, 'name': 'Documentary'}, {'id': 10769, 'name': 'Foreign'}]",,20565,tt0164312,en,42 Up,Director Michael Apted revisits the same group of British-born adults after a 7 year wait. The subjects are interviewed as to the changes that have occurred in their lives during the last seven years.,0.697268,/aC1VEsiImpL1SwLnm7cKK6ro8qR.jpg,[],"[{'iso_3166_1': 'GB', 'name': 'United Kingdom'}]",1998-07-28,0,139.0,"[{'iso_639_1': 'en', 'name': 'English'}]",Released,,42 Up,False,6.6,9
False,,0,"[{'id': 12, 'name': 'Adventure'}, {'id': 35, 'name': 'Comedy'}, {'id': 14, 'name': 'Fantasy'}, {'id': 878, 'name': 'Science Fiction'}]",,90762,tt0179196,mk,Zbogum na dvaesetiot vek,"In the year 2019, after global destruction and descent into savagery, the immortal Kuzman tried to discover his destiny in order to learn how to die. As he enters the whirling circles of time, we discover the blasphemy of our century, and how it is to close its circle",0.352075,/8bfNDwNCh694nKfvHhMxrF6mGBx.jpg,"[{'name': 'Mirco & Slavco - First Partizan Production', 'id': 93591}]","[{'iso_3166_1': 'MK', 'name': 'Macedonia'}]",1998-11-17,0,83.0,"[{'iso_639_1': 'en', 'name': 'English'}, {'iso_639_1': 'mk', 'name': ''}]",Released,The future is as screwed up as the past.,"Goodbye, 20th Century",False,7.5,2
False,,0,"[{'id': 14, 'name': 'Fantasy'}, {'id': 35, 'name': 'Comedy'}, {'id': 18, 'name': 'Drama'}]",,9647,tt0096061,en,Scrooged,"\"In this modern take on Charles Dickens' \"\"A Christmas Carol","\"\" Frank Cross (Bill Murray) is a wildly successful television executive whose cold ambition and curmudgeonly nature has driven away the love of his life",Claire Phillips (Karen Allen). But after firing a staff member,Eliot Loudermilk (Bobcat Goldthwait),on Christmas Eve,"Frank is visited by a series of ghosts who give him a chance to re-evaluate his actions and right the wrongs of his past.\"",11.465634,/9gUQPVt0QZYKUBrGGtknfrsRQ1c.jpg,"[{'name': 'Paramount Pictures', 'id': 4}]","[{'iso_3166_1': 'US', 'name': 'United States of America'}]",1988-11-22,60328000,101.0,"[{'iso_639_1': 'en', 'name': 'English'}]",Released
False,,4000000,"[{'id': 18, 'name': 'Drama'}]",,24276,tt0093509,en,Matewan,"\"Filmed in the coal country of West Virginia, \"\"Matewan\"\" celebrates labor organizing in the context of a 1920s work stoppage. Union organizer",Joe Kenehan,"a scab named \"\"Few Clothes\"\" Johnson and a sympathetic mayor and police chief heroically fight the power represented by a coal company and Matewan's vested interests so that justice and workers' rights need not take a back seat to squalid working conditions","exploitation and the bottom line.\"",3.350126,/kFFYseXqiKrAqs4JJyqlayO6hHS.jpg,[],"[{'iso_3166_1': 'US', 'name': 'United States of America'}]",1987-08-28,1680358,132.0,"[{'iso_639_1': 'en', 'name': 'English'}, {'iso_639_1': 'it', 'name': 'Italiano'}]",Released,It takes more than guns to kill a man.,Matewan
False,,0,"[{'id': 36, 'name': 'History'}, {'id': 18, 'name': 'Drama'}, {'id': 28, 'name': 'Action'}]",,44662,tt0055850,ja,忠臣蔵 花の巻・雪の巻,"The story tells of a group of samurai who were left leaderless (becoming ronin) after their daimyo (feudal lord) was forced to commit seppuku (ritual suicide) for assaulting a court official named Kira Yoshinaka, whose title was Kōzuke no suke. The ronin avenged their master's honor after patiently waiting and planning for over a year to kill Kira. In turn, the ronin were themselves forced to commit seppuku for committing the crime of murder.",5.127806,/xbpdmOswgTMeHSnHLohjO7D78aY.jpg,"[{'name': 'Toho Company', 'id': 882}]","[{'iso_3166_1': 'JP', 'name': 'Japan'}]",1962-11-03,0,207.0,"[{'iso_639_1': 'ja', 'name': '日本語'}]",Released,,47 Samurai,False,7.1,20
False,,0,"[{'id': 35, 'name': 'Comedy'}, {'id': 10749, 'name': 'Romance'}]",,20334,tt0033045,en,The Shop Around the Corner,"Two employees at a gift shop can barely stand one another, without realising that they are falling in love through the post as each other's anonymous pen pal.",7.144236,/avHj8x3T21dYIGrnx55I57PxdEo.jpg,"\"[{'name': \"\"Loew's\"\"",'id': 1460},{'name': 'Metro-Goldwyn-Mayer (MGM)',"'id': 8411}]\"","[{'iso_3166_1': 'US', 'name': 'United States of America'}]",1940-01-11,0,99.0,"[{'iso_639_1': 'en', 'name': 'English'}]",Released,"Quiet, Unassuming, Perfect",The Shop Around the Corner
False,,0,"[{'id': 18, 'name': 'Drama'}]",,11005,tt0099077,en,Awakenings,"\"Dr. Malcolm Sayer, a shy research physician, uses an experimental drug to \"\"awaken\"\" the catatonic victims of a rare disease. Leonard is the first patient to receive the controversial treatment. His awakening",filled with awe and enthusiasm,proves a rebirth for Sayer too,"as the exuberant patient reveals life's simple but unutterably sweet pleasures to the introverted doctor.\"",13.201595,/6vkJhhd9h9QxMGHYQjVY1fY5XSI.jpg,"[{'name': 'Parkes/Lasker productions', 'id': 67713}]","[{'iso_3166_1': 'US', 'name': 'United States of America'}]",1990-12-19,52096475,120.0,"[{'iso_639_1': 'en', 'name': 'English'}]",Released,There is no such thing as a simple miracle.,Awakenings
False,"{'id': 10194, 'name': 'Toy Story Collection', 'poster_path': '/7G9915LfUQ2lVfwMEEhDsn3kT4B.jpg', 'backdrop_path': '/9FBwqcd9IRruEDUrTdcaafOMKUq.jpg'}",90000000,"[{'id': 16, 'name': 'Animation'}, {'id': 35, 'name': 'Comedy'}, {'id': 10751, 'name': 'Family'}]",http://toystory.disney.com/toy-story-2,863,tt0120363,en,Toy Story 2,"Andy heads off to Cowboy Camp, leaving his toys to their own devices. Things shift into high gear when an obsessive toy collector named Al McWhiggen, owner of Al's Toy Barn kidnaps Woody. Andy's toys mount a daring rescue mission, Buzz Lightyear meets his match and Woody has to decide where he and his heart truly belong.",17.547693,/3CmK3XurcLeUyMifCR28ibzupbB.jpg,"[{'name': 'Pixar Animation Studios', 'id': 3}]","[{'iso_3166_1': 'US', 'name': 'United States of America'}]",1999-10-30,497366869,92.0,"[{'iso_639_1': 'en', 'name': 'English'}]",Released,The toys are back!,Toy Story 2,False,7.3,3914
False,,0,"[{'id': 28, 'name': 'Action'}, {'id': 12, 'name': 'Adventure'}]",,76083,tt0024645,en,Tarzan the Fearless,"\"Mary Brooks' father, who has been studying ancient tribes, falls into the hands of \"\"the people of Zar","god of the Emerald Fingers.\"\" Tarzan helps Mary locate her father",rescues everyone from the High Priest of Zar,"and takes Mary to his cave.\"",0.756556,/eEqlUQ1UwyKkcFf6Yu6uOvXA0zp.jpg,"[{'name': 'Sol Lesser Productions', 'id': 4213}]","[{'iso_3166_1': 'US', 'name': 'United States of America'}]",1933-08-11,0,85.0,"[{'iso_639_1': 'en', 'name': 'English'}]",Released,,Tarzan the Fearless
False,,0,"[{'id': 18, 'name': 'Drama'}, {'id': 35, 'name': 'Comedy'}]",,32628,tt0014538,en,Three Ages,"\"\"\"The Three Ages","\"\" Buster Keaton's first feature-length film after a number of comedy shorts","is his parody of Griffith's \"\"Intolerance.\"\" Keaton tells three parallel stories about the perils of romance",one set in the Stone Age,one during the Roman Empire,"and one during the 20th century.\"",1.539713,/1xWJWo7FeL6KWvHHiXAnNiqUuUp.jpg,"[{'name': 'Buster Keaton Productions', 'id': 12190}]","[{'iso_3166_1': 'US', 'name': 'United States of America'}]",1923-09-24,0,63.0,"[{'iso_639_1': 'xx', 'name': 'No Language'}]",Released
False,,0,"[{'id': 99, 'name': 'Documentary'}, {'id': 10402, 'name': 'Music'}]",,18161,tt0096328,en,U2: Rattle and Hum,"A concert movie on an unprecedented scale, Rattle And Hum captures U2 - on and off the stage - during their triumphant Joshua Tree tour. From the giant technicolour stadium celebrations to the black-and-white intensity of the indoor shows, this is U2 at their best. Follow the group across America, exploring new influences, playing with the legendary B.B. King from Dublin to Graceland.",2.143483,/bFgdLWRpvS1rKxR5GADEyvgLm56.jpg,"[{'name': 'Paramount Pictures', 'id': 4}]","[{'iso_3166_1': 'US', 'name': 'United States of America'}]",1988-11-04,0,98.0,"[{'iso_639_1': 'en', 'name': 'English'}]",Released,,U2: Rattle and Hum,False,6.3,28
False,"{'id': 321063, 'name': 'The Sinbad Collection', 'poster_path': '/t1vJrS8oSN9JpiLdVRhadMXy52X.jpg', 'backdrop_path': None}",650000,"[{'id': 28, 'name': 'Action'}, {'id': 12, 'name': 'Adventure'}, {'id': 10751, 'name': 'Family'}, {'id': 14, 'name': 'Fantasy'}]",,15515,tt0051337,en,The 7th Voyage of Sinbad,"When a princess is shrunken by an evil wizard, Sinbad must undertake a quest to an island of monsters to cure her and prevent a war.",11.118379,/mzEFF9YRN13HLz6Cq7jMYR8aHVb.jpg,"[{'name': 'Columbia Pictures Corporation', 'id': 441}, {'name': 'Morningside Productions', 'id': 5040}]","[{'iso_3166_1': 'US', 'name': 'United States of America'}]",1958-12-05,0,88.0,"[{'iso_639_1': 'en', 'name': 'English'}]",Released,8th Wonder of the Screen!,The 7th Voyage of Sinbad,False,6.8,52
False,"{'id': 55427, 'name': 'Fantasia Collection', 'poster_path': '/qHpXVQVhSOXwFNFCfKfdTnuyrXl.jpg', 'backdrop_path': '/7YanwpylLB3yzhwzf11W1tYpcQF.jpg'}",80000000,"[{'id': 16, 'name': 'Animation'}, {'id': 10751, 'name': 'Family'}, {'id': 10402, 'name': 'Music'}]",http://movies.disney.com/fantasia-2000,49948,tt0120910,en,Fantasia 2000,"Blending lively music and brilliant animation, this sequel to the original 'Fantasia' restores 'The Sorcerer's Apprentice' and adds seven new shorts.",14.972573,/5rwAtUaKEK48CPUijVfVU0IPKPZ.jpg,"[{'name': 'Walt Disney Pictures', 'id': 2}]","[{'iso_3166_1': 'US', 'name': 'United States of America'}]",1999-12-17,90874570,74.0,"[{'iso_639_1': 'en', 'name': 'English'}]",Released,,Fantasia 2000,False,7.0,300
False,,0,"[{'id': 35, 'name': 'Comedy'}, {'id': 18, 'name': 'Drama'}, {'id': 10402, 'name': 'Music'}]",,46435,tt0151568,en,Topsy-Turvy,"\"After their production \"\"Princess Ida\"\" meets with less-than-stunning reviews",the relationship between Gilbert and Sullivan is strained to breaking. Their friends and associates attempt to get the two to work together again,"which opens the way to \"\"The Mikado","\"\" one of the duo's greatest successes.\"",5.902126,/mUDH3XjYO3AU1alLpWGtkXfU0LK.jpg,"[{'name': 'Newmarket Capital Group', 'id': 506}, {'name': 'Goldwyn Films', 'id': 720}, {'name': 'The Greenlight Fund', 'id': 821}, {'name': 'Thin Man Films', 'id': 10100}]","[{'iso_3166_1': 'GB', 'name': 'United Kingdom'}, {'iso_3166_1': 'US', 'name': 'United States of America'}]",1999-09-03,0,160.0,"[{'iso_639_1': 'en', 'name': 'English'}, {'iso_639_1': 'fr', 'name': 'Français'}, {'iso_639_1': 'de', 'name': 'Deutsch'}, {'iso_639_1': 'it', 'name': 'Italiano'}, {'iso_639_1': 'ja', 'name': '日本語'}]",Released,Gilbert & Sullivan & So Much More,Topsy-Turvy
False,,55000000,"[{'id': 18, 'name': 'Drama'}]",,9563,tt0146838,en,Any Given Sunday,A star quarterback gets knocked out of the game and an unknown third stringer is called in to replace him. The unknown gives a stunning performance and forces the aging coach to reevaluate his game plans and life. A new co-owner/president adds to the pressure of winning. The new owner must prove her self in a male dominated world.,10.571434,/ofxxBtOoNRQD9yuiVIEo8sbsqkK.jpg,"\"[{'name': \"\"Donners' Company\"\"",'id': 431},{'name': 'Ixtlan','id': 4198},{'name': 'Warner Bros.',"'id': 6194}]\"","[{'iso_3166_1': 'US', 'name': 'United States of America'}]",1999-12-16,100230832,163.0,"[{'iso_639_1': 'en', 'name': 'English'}]",Released
False,,40000000,"[{'id': 18, 'name': 'Drama'}]",,3558,tt0172493,en,"Girl, Interrupted","\"Set in the changing world of the late 1960's, Susanna Kaysen's prescribed \"\"short rest\"\" from a psychiatrist she had met only once becomes a strange",unknown journey into Alice's Wonderland,where she struggles with the thin line between normal and crazy. Susanna soon realizes how hard it is to get out once she has been committed,"and she ultimately has to choose between the world of people who belong inside or the difficult world of reality outside.\"",8.285062,/vp46lgVDiFdT4Hw5WIISOPwnMaH.jpg,"[{'name': 'Columbia Pictures Corporation', 'id': 441}, {'name': '3 Arts Entertainment', 'id': 787}, {'name': 'Global Entertainment Productions GmbH & Company Medien KG', 'id': 9269}, {'name': 'Red Wagon Entertainment', 'id': 14440}]","[{'iso_3166_1': 'DE', 'name': 'Germany'}, {'iso_3166_1': 'US', 'name': 'United States of America'}]",1999-12-21,0,127.0,"[{'iso_639_1': 'en', 'name': 'English'}]",Released,"The crazy thing is, you're not crazy.","Girl, Interrupted"
False,,1661530,"[{'id': 35, 'name': 'Comedy'}, {'id': 18, 'name': 'Drama'}, {'id': 10752, 'name': 'War'}]",,632,tt0046359,en,Stalag 17,"It's a dreary Christmas 1944 for the American POWs in Stalag 17. For the men in Barracks 4, all sergeants, have to deal with a grave problem - there seems to be a security leak. The Germans always seem to be forewarned about escapes and in the most recent attempt the two men, Manfredi and Johnson, walked straight into a trap and were killed. For some in Barracks 4, especially the loud-mouthed Duke, the leaker is obvious: J.J. Sefton, a wheeler-dealer who doesn't hesitate to trade with the guards and who has acquired goods and privileges that no other prisoner seems to have. Sefton denies giving the Germans any information and makes it quite clear that he has no intention of ever trying to escape. He plans to ride out the war in what little comfort he can arrange, but it doesn't extend to spying for the Germans.",9.47371,/vyXFk2b6X4cEBJvKMBoi3fdlFgC.jpg,"[{'name': 'Paramount Pictures', 'id': 4}]","[{'iso_3166_1': 'US', 'name': 'United States of America'}]",1953-05-29,0,120.0,"[{'iso_639_1': 'en', 'name': 'English'}, {'iso_639_1': 'de', 'name': 'Deutsch'}, {'iso_639_1': 'ru', 'name': 'Pусский'}]",Released,"THE STAR-SPANGLED, LAUGH-LOADED SALUTE TO OUR P.W. HEROS!",Stalag 17,False,7.6,143
False,,0,"[{'id': 35, 'name': 'Comedy'}, {'id': 10402, 'name': 'Music'}, {'id': 10749, 'name': 'Romance'}]",,33734,tt0050815,en,Pal Joey,"\"Frank Sinatra, at the zenith of his cocky, world-on-a-string popularity, glides through the film with breezy nonchalance, romancing showgirl Kim Novak (Columbia Pictures' new sex symbol) and wealthy widow Rita Hayworth (Columbia Pictures' former sex symbol). The film also benefits from location shooting in San Francisco, caught in the moonlight-and-supper-club glow of the late '50s. Sinatra does beautifully with the Rodgers and Hart classics \"\"I Didn't Know What Time It Was\"\" and \"\"I Could Write a Book","\"\" and his performance of \"\"The Lady Is a Tramp\"\" (evocatively shot by director George Sidney) is flat-out genius. Sinatra's ease with hep-cat lingo nearly outdoes Bing Crosby at his best","and included in the DVD is a trailer in which Sinatra instructs the audience in \"\"Joey's Jargon","\"\" a collection of hip slang words such as \"\"gasser\"\" and \"\"mouse.\"\" If not one of Sinatra's very best movies","Pal Joey is nevertheless a classy vehicle that fits like a glove\"",2.774084,/3dwcWwTEvbygxDQtGJw4k9NevPH.jpg,"[{'name': 'Essex Productions', 'id': 14154}]","[{'iso_3166_1': 'US', 'name': 'United States of America'}]",1957-10-25,0,111.0,"[{'iso_639_1': 'en', 'name': 'English'}]",Released,"From Your Pal, Columbia!"
False,,0,"[{'id': 35, 'name': 'Comedy'}]",,9644,tt0107659,en,National Lampoon's Loaded Weapon 1,"\"An LA detective is murdered because she has microfilm with the recipe to make cocaine cookies. A \"\"Lethal Weapon\"\" style cop team tries to find and stop the fiends before they can dope the nation by distributing their wares via the \"\"Wilderness Girls\"\" cookie drive.\"",11.511683,/5EXdCZX8istfo6XCOgLsG0eiIsl.jpg,"[{'name': 'New Line Cinema', 'id': 12}]","[{'iso_3166_1': 'US', 'name': 'United States of America'}]",1993-02-04,0,84.0,"[{'iso_639_1': 'en', 'name': 'English'}]",Released,See it before they make the sequel!,National Lampoon's Loaded Weapon 1,False,5.7,161
False,,36000000,"[{'id': 18, 'name': 'Drama'}, {'id': 35, 'name': 'Comedy'}]",,75531,tt0141399,de,Isn't She Great,"\"An unsuccessful over-the-top actress becomes a successful over-the-top authoress in this biography of Jacqueline Susann, the famed writer of \"\"The Valley Of The Dolls\"\" and other trashy novels. Facing a failing career",Susann meets a successful promoter who becomes her husband. After several failures to place her in commercials and a TV quiz show,he hits upon the idea for her to become a writer. In the pre-60's,her books were looked upon as trash and non-printable. But then the sexual revolution hit and an audience was born for her books. The story shows the hidden behind the scenes story of Susan's life,"including her autistic son and her continuing bout with cancer that she hid up to her death\"",0.907927,/gIEa3CRtNVul0JgTaHMvWrY65Ju.jpg,"[{'name': 'Universal Pictures', 'id': 33}, {'name': 'Mutual Film Company', 'id': 762}, {'name': 'Toho Company', 'id': 882}, {'name': 'British Broadcasting Corporation (BBC)', 'id': 3324}, {'name': 'Marubeni', 'id': 4650}, {'name': 'Tele München Fernseh Produktionsgesellschaft (TMG)', 'id': 7237}, {'name': 'Lobell/Bergman Productions', 'id': 10513}]","[{'iso_3166_1': 'US', 'name': 'United States of America'}]",2000-01-28,3003296,95.0,"[{'iso_639_1': 'en', 'name': 'English'}]",Released,Talent Isn't Everything...
False,"{'id': 103573, 'name': 'Sister Act Collection', 'poster_path': '/m9xbNgB8MrrGOCvc4vjOtSWdqh9.jpg', 'backdrop_path': '/5zLMzYgpx2TNmISTk1MnRyRWY9M.jpg'}",38000000,"[{'id': 10402, 'name': 'Music'}, {'id': 35, 'name': 'Comedy'}]",,6279,tt0108147,en,Sister Act 2: Back in the Habit,"Deloris Van Cartier is again asked to don the nun's habit to help a run-down Catholic school, presided over by Mother Superior. And if trying to reach out to a class full of uninterested students wasn't bad enough, the sisters discover that the school is due to be closed by the unscrupulous local authority chief Mr. Crisp.",12.986842,/tLbvfUYw8Pr7DMI5TGL5DX1bx5S.jpg,"[{'name': 'Touchstone Pictures', 'id': 9195}]","[{'iso_3166_1': 'US', 'name': 'United States of America'}]",1993-12-09,57319029,107.0,"[{'iso_639_1': 'en', 'name': 'English'}]",Released,,Sister Act 2: Back in the Habit,False,5.9,384
False,"\"{'id': 8979, 'name': \"\"Wayne's World Collection\"\"",'poster_path': '/pSzpPW6pYtqJq038okmxBBE5zmN.jpg',"'backdrop_path': '/o0FVB2mVYTIjTuu89tW98QGzZzi.jpg'}\"",0,"[{'id': 10402, 'name': 'Music'}, {'id': 35, 'name': 'Comedy'}]",,8873,tt0108525,en,Wayne's World 2,"\"A message from Jim Morrison in a dream prompts cable access TV stars Wayne and Garth to put on a rock concert, \"\"Waynestock","\"\" with Aerosmith as headliners. But amid the preparations",Wayne frets that a record producer is putting the moves on his girlfriend,Cassandra,"while Garth handles the advances of mega-babe Honey Hornee.\"",10.931683,/pBs9DuzWhqWX7vPjzB6AvAXKXzM.jpg,"[{'name': 'Paramount Pictures', 'id': 4}]","[{'iso_3166_1': 'US', 'name': 'United States of America'}]",1993-12-10,47965000,95.0,"[{'iso_639_1': 'cn', 'name': '广州话 / 廣州話'}, {'iso_639_1': 'en', 'name': 'English'}]"
