adult,belongs_to_collection,budget,genres,homepage,id,imdb_id,original_language,original_title,overview,popularity,poster_path,production_companies,production_countries,release_date,revenue,runtime,spoken_languages,status,tagline,title,video,vote_average,vote_count
False,,0,"[{'id': 12, 'name': 'Adventure'}, {'id': 28, 'name': 'Action'}, {'id': 18, 'name': 'Drama'}]",,101125,tt0106578,en,Class of '61,"Three West Point 1861 generation cadets and friends go on opposite sides after the breakout of The Civil War, with tragic consequences. A subplot involves Lucius, a Shelby Peyton's slave, who kills a slave trader and goes on the run.",0.273414,/pbZkMsxiaikQJsyhZE0wHwJvQpA.jpg,[],[],1993-04-12,0,95.0,"[{'iso_639_1': 'de', 'name': 'Deutsch'}, {'iso_639_1': 'en', 'name': 'English'}]",Released,,Class of '61,False,0.0,0
False,"{'id': 256296, 'name': 'Silent Night, Deadly Night Collection', 'poster_path': '/4FqLNnITkZza1QKyTd5nprion1y.jpg', 'backdrop_path': '/wZM7UP8tdoZLHUgV4Lj5ixSqKSB.jpg'}",0,"[{'id': 27, 'name': 'Horror'}, {'id': 878, 'name': 'Science Fiction'}]",,70984,tt0105410,en,"Silent Night, Deadly Night 5: The Toy Maker","A young boy sees his father killed by a toy that was anonymously delivered to his house. After that, he is too traumatized to speak, and his mother must deal with both him and the loss of her husband. Meanwhile, a toy maker named Joe Peto builds some suspicious-looking toys, and a mysterious man creeps around both the toy store and the boy's house...but who is responsible for the killer toys?",1.240357,/6UfPS7KbcBury0T2MXWivonzD9F.jpg,"[{'name': 'Still Silent Films Inc.', 'id': 43977}]","[{'iso_3166_1': 'US', 'name': 'United States of America'}]",1991-11-06,0,90.0,"[{'iso_639_1': 'en', 'name': 'English'}]",Released,He's Home... But He's Not Alone.,"Silent Night, Deadly Night 5: The Toy Maker",False,5.1,11
False,,0,"[{'id': 53, 'name': 'Thriller'}, {'id': 18, 'name': 'Drama'}]",,96921,tt0099072,fr,Aux yeux du monde,"\"Bruno's girlfriend, who lives in another town, doesn't believe he loves her. Therefore, he decides to prove his love by doing something \"\"crazy\"\" and ends up hijacking a school bus full of children at gunpoint to go see her\"",0.117314,/6ATI8yvPEMIM9sQ1yP4ISXudAzP.jpg,"\"[{'name': \"\"La Générale d'Images\"\"",'id': 1180},{'name': 'Les Productions Lazennec','id': 5869},{'name': 'France 3 Cinema',"'id': 16804}]\"","[{'iso_3166_1': 'FR', 'name': 'France'}]",1991-04-03,0,95.0,"[{'iso_639_1': 'fr', 'name': 'Français'}]",Released
False,,0,"[{'id': 35, 'name': 'Comedy'}, {'id': 14, 'name': 'Fantasy'}]",,173732,tt0201450,pt,Bang Bang,"\"This endearingly crazy 1971 Brazilian film defies classification: its Portuguese title (Bangue bangue) refers to films we'd probably call \"\"shoot-'em-ups","\"\" director Andrea Tonacci called it a \"\"Maoist detective comedy","\"\" yet American audiences would probably consider it an experimental film. The anonymous urban protagonist experiences a series of absurd situations--including a crazy cab ride",an encounter with a wacky criminal gang,and lots of gunplay--but they're stripped of any story that might explain them and infused with a unique anarchic energy,eventually suggesting our true animal nature. As with Godard,it's partly an homage to genre filmmaking (there's singing and dancing,a little sex,and lots of violence),"but what really powers the film is Tonacci's inventive camera.\"",0.000578,/946p57CEWnVSJC1mBuqixHTWuAD.jpg,"[{'name': 'Total Filmes', 'id': 93193}]","[{'iso_3166_1': 'BR', 'name': 'Brazil'}]",1971-01-01
False,,0,"[{'id': 18, 'name': 'Drama'}]",,152986,tt0025161,en,Gambling Lady,"\"A businesslike syndicate runs all the gambling joints in town; least profitable is honest Mike Lee's. Under pressure to allow cheating, Mike \"\"walks out","\"\" leaving tough-minded daughter Lady Lee to earn a living the only way she knows. She soon becomes a success gambling among the rich",but,falling out with the syndicate,"she considers the marriage proposal of blueblood Garry Madison. Can such a match work despite snobbery and old associations?\"",1.200342,/t66pGj2SXQBOQJ0N492zmgpXWUX.jpg,"[{'name': 'Warner Bros.', 'id': 6194}]","[{'iso_3166_1': 'US', 'name': 'United States of America'}]",1934-03-31,0,66.0,"[{'iso_639_1': 'en', 'name': 'English'}]",Released,
False,,0,"[{'id': 18, 'name': 'Drama'}, {'id': 35, 'name': 'Comedy'}]",,17825,tt0386695,fr,Les 11 Commandements,"After an evening of drinking, six men find themselves in front of The God of the Joke. Distressed to find that people aren't laughing anymore, He gives the six friends a mission: to save the world with the Eleven Commandments of the Joke. The men enthusiastically take on their task. They undertake various tests aimed at pushing the limits of stupidity.",4.774788,/hOW0wFKfAgZ5iBQ2oYXGvhsnR18.jpg,"[{'name': 'M6 Films', 'id': 1115}]","[{'iso_3166_1': 'FR', 'name': 'France'}]",2004-02-04,0,85.0,"[{'iso_639_1': 'fr', 'name': 'Français'}]",Released,,The 11 Commandments,False,5.3,93
False,"{'id': 384920, 'name': 'No Retreat, No Surrender Collection', 'poster_path': '/9vaAOb1OE3d4ELmAlF7bDuS6EEw.jpg', 'backdrop_path': None}",0,"[{'id': 28, 'name': 'Action'}, {'id': 12, 'name': 'Adventure'}]",,42012,tt0097991,fr,"No Retreat, No Surrender 2: Raging Thunder","In this sequel, Scott Wylde, an American kickboxer, must go to Cambodia to rescue his Vietnamese girlfriend from Russian and Vietnamese troops.",0.699608,/iNKter0SRMEt6AE2Kbg8kPAipND.jpg,"[{'name': 'Seasonal Film Corporation', 'id': 13433}, {'name': 'Shapiro-Glickenhaus Entertainment', 'id': 16636}]","[{'iso_3166_1': 'HK', 'name': 'Hong Kong'}, {'iso_3166_1': 'US', 'name': 'United States of America'}]",1988-01-28,108154,104.0,"[{'iso_639_1': 'en', 'name': 'English'}, {'iso_639_1': 'th', 'name': 'ภาษาไทย'}]",Released,"It's not a rematch, it's war!","No Retreat, No Surrender 2: Raging Thunder",False,5.2,10
False,,0,"[{'id': 35, 'name': 'Comedy'}]",,209686,tt2077677,en,3 Simoa,"A caper comedy about two friends, Simo and Lasse, who try to earn their living as burglars. But now there's also Baby Simo.",0.018845,/tWqJ3sQ5k7w322uN8QTeQjcp6yZ.jpg,[],[],2012-09-13,0,90.0,"[{'iso_639_1': 'fi', 'name': 'suomi'}]",Released,,3 Simoa,False,0.0,0
False,"{'id': 135483, 'name': 'Taken Collection', 'poster_path': '/4PNFiSaJWvWhkdOw0KF9Vf7v3gC.jpg', 'backdrop_path': '/hO1R1TI429PjkOjby4dTPBrWFwn.jpg'}",48000000,"[{'id': 53, 'name': 'Thriller'}, {'id': 28, 'name': 'Action'}]",http://www.taken3movie.com/,260346,tt2446042,en,Taken 3,"Ex-government operative Bryan Mills finds his life is shattered when he's falsely accused of a murder that hits close to home. As he's pursued by a savvy police inspector, Mills employs his particular set of skills to track the real killer and exact his unique brand of justice.",18.081483,/ikDwR3i2bczqnRf1urJTy77YTFf.jpg,"[{'name': 'Twentieth Century Fox Film Corporation', 'id': 306}, {'name': 'M6 Films', 'id': 1115}, {'name': 'Canal+', 'id': 5358}, {'name': 'Grive Productions', 'id': 6877}, {'name': 'EuropaCorp', 'id': 6896}, {'name': 'Ciné+', 'id': 10611}, {'name': 'M6', 'id': 11261}, {'name': 'TSG Entertainment', 'id': 22213}, {'name': 'Taken 3', 'id': 87854}]","[{'iso_3166_1': 'FR', 'name': 'France'}, {'iso_3166_1': 'US', 'name': 'United States of America'}]",2014-12-16,325771424,109.0,"[{'iso_639_1': 'en', 'name': 'English'}]",Released,It Ends Here,Taken 3,False,6.1,2225
False,"{'id': 279715, 'name': 'Beck Collection', 'poster_path': '/8Kzrc2bsGt0RUyTN6vHvh4yu0QO.jpg', 'backdrop_path': None}",0,"[{'id': 53, 'name': 'Thriller'}, {'id': 80, 'name': 'Crime'}, {'id': 9648, 'name': 'Mystery'}]",,315360,tt4186386,sv,Beck 27 - Rum 302,"The body of a young woman is found in a Stockholm hotel room. It appears that she has been strangled after a night partying with two young men, but the room was paid for using the credit card of a mugging victim whose alibi doesn't add up. Martin and Gunvald investigate under the supervision of their new boss Klas Freden.",0.566619,/prKgcMWs39E2sM8UlQWxSHemQmI.jpg,"[{'name': 'Nordisk Film', 'id': 235}, {'name': 'TV4 Sweden AB', 'id': 8267}, {'name': 'TV2 Norge', 'id': 11682}]","[{'iso_3166_1': 'SE', 'name': 'Sweden'}]",2015-01-01,0,95.0,"[{'iso_639_1': 'sv', 'name': 'svenska'}]",Released,,Beck 27 - Rum 302,False,6.4,7
False,,0,"[{'id': 18, 'name': 'Drama'}]",,193348,tt0059670,pl,Salto,"A man jumps off a moving train and goes to a small town to face its inhabitants, who seem familiar, but odd.",0.364454,/bRf9eNySvzJM5Dw7jdk12dLpr68.jpg,"\"[{'name': 'ZRF \"\"Kadr\"\"'",'id': 32782},{'name': 'Polish State Film Studio',"'id': 81063}]\"","[{'iso_3166_1': 'PL', 'name': 'Poland'}]",1965-06-10,0,104.0,"[{'iso_639_1': 'pl', 'name': 'Polski'}]",Released,,Jump
False,"{'id': 315560, 'name': 'The Woman in Black Collection', 'poster_path': '/aWMxfo5LEWkL5o4xpQcLVsbcmNp.jpg', 'backdrop_path': '/pw8JrqNceLQ82KWZpHg5VghWTqn.jpg'}",1000000,"[{'id': 53, 'name': 'Thriller'}, {'id': 27, 'name': 'Horror'}, {'id': 18, 'name': 'Drama'}]",,288158,tt2339741,en,The Woman in Black 2: Angel of Death,"40 years after the first haunting at Eel Marsh House, a group of children evacuated from WWII London arrive, awakening the house's darkest inhabitant.",6.942139,/kzWRtyMtazWA22LJXA64KKZ3slY.jpg,"[{'name': 'Vertigo Entertainment', 'id': 829}, {'name': 'Hammer Film Productions', 'id': 1314}, {'name': 'Alliance Films', 'id': 2514}, {'name': 'Talisman Productions', 'id': 8989}, {'name': 'Exclusive Media Group', 'id': 11448}, {'name': 'Da Vinci Media Ventures', 'id': 40107}]","[{'iso_3166_1': 'GB', 'name': 'United Kingdom'}, {'iso_3166_1': 'US', 'name': 'United States of America'}, {'iso_3166_1': 'CA', 'name': 'Canada'}]",2014-12-30,26501323,90.0,"[{'iso_639_1': 'en', 'name': 'English'}]",Released,She Never Left,The Woman in Black 2: Angel of Death,False,5.0,389
False,,0,"[{'id': 16, 'name': 'Animation'}, {'id': 10402, 'name': 'Music'}]",,43477,tt0067749,en,Shinbone Alley,"\"Join the fun and laugh along with the \"\"misadventures\"\" of Archy the cockroach",a poet in his former life now having to jump on his typewriter keys to peck out his poems. Archie adores the huge-eyed,blonde,hip-swaying Mehitabel the Cat,and along with a colorful cast of characters,they embark on an animated,"musical treat the whole family will love!\"",3.8e-05,/o3z4Cxa2YAFyY8Y7Nuw7QVgtNPu.jpg,[],[],1970-06-26,0,85.0,"[{'iso_639_1': 'en', 'name': 'English'}]"
False,"{'id': 205029, 'name': 'The Reef Collection', 'poster_path': '/ly1JJzxHvMDWQBvFTI7MPZS8eAB.jpg', 'backdrop_path': '/1PO4lCAjzBgLtKrMCynVXldC0e7.jpg'}",0,"[{'id': 16, 'name': 'Animation'}, {'id': 10751, 'name': 'Family'}]",http://www.imdb.com/title/tt1978567/,132601,tt1978567,en,The Reef 2: High Tide,"Trained in the skills of sea power, Pi the fish can fight a shark, sink a squid or batter any random predator that ever threatens his friends and neighbors on the reef. Unfortunately, being the only hero in town can take its toll, especially when a group of sharks declares that the end of the reef is soon at hand.",1.675072,/gJmDfwdoxLIG1kKfZ7EZRsAliIy.jpg,"[{'name': 'Wonderworld Studios', 'id': 3980}, {'name': 'Animation Picture Company', 'id': 15196}]","[{'iso_3166_1': 'US', 'name': 'United States of America'}, {'iso_3166_1': 'KR', 'name': 'South Korea'}]",2012-10-30,0,80.0,"[{'iso_639_1': 'en', 'name': 'English'}]",Released,High Tide: An All New Adventure,The Reef 2: High Tide,False,2.3,6
False,,0,"[{'id': 53, 'name': 'Thriller'}]",,96546,tt0047336,it,La Paura,"\"Irene Wagner (Bergman), the wife of the prominent German scientist Professor Albert Wagner (Wieman), had been having an affair with Erich Baumann (Kreuger). She does not disclose this to her husband, hoping to preserve his innocence and their \"\"perfect marriage\"\". This fills her with anxiety and guilt. However",Johann Schultze (Mannhardt),Erich's jealous ex-girlfriend,learns about the affair and begins to blackmail Irene,turning Irene's psychological torture into a harsh reality. When Irene finds out that the extortion plot is truly an experiment in fear,"she is driven into a homicidal/suicidal rage. The story is told in flashback by Irene after her death.\"",0.843535,/feuYOf6j965ULOkeN6vk0zuRagM.jpg,"[{'name': 'Minerva Film SpA', 'id': 153}]","[{'iso_3166_1': 'DE', 'name': 'Germany'}, {'iso_3166_1': 'IT', 'name': 'Italy'}]",1954-11-05,0,83.0,"[{'iso_639_1': 'de', 'name': 'Deutsch'}, {'iso_639_1': 'it', 'name': 'Italiano'}]",Released
False,,0,"[{'id': 35, 'name': 'Comedy'}]",,67756,tt0044140,fr,Topaze,"\"Albert Topaze, sincere schoolteacher addicted to \"\"rote\"\" morality",works at a private school run by supremely money-grubbing M. Muche,whose daughter,also a teacher,makes cynical use of the knowledge that Topaze loves her. Alas,"Topaze's naive honesty brings him unjust dismissal...and makes him fair game for the \"\"aunt\"\" of his private pupil",really the mistress of crooked politician Regis,"who needs an honest-seeming \"\"front man.\"\" Can artful Suzy Courtois keep Topaze on the string? With steadily escalating disillusion comes moral crisis...\"",0.6505,/vC2VPObTnTCF6PrJ46b7BUpiig8.jpg,"[{'name': 'Les Films Marcel Pagnol', 'id': 19160}]","[{'iso_3166_1': 'FR', 'name': 'France'}]",1951-01-25,0,136.0
False,,0,"[{'id': 36, 'name': 'History'}, {'id': 18, 'name': 'Drama'}]",,50107,tt0024144,en,The House on 56th Street,"A beautiful chorine marries a handsome rich socialite, but her idyllic life ends when she visits a dying old beau and is charged when he commits suicide.",0.136997,/wEfua5ZohfxiWp2Z4kkgHZRa4b1.jpg,"[{'name': 'Warner Bros.', 'id': 6194}]","[{'iso_3166_1': 'US', 'name': 'United States of America'}]",1933-12-23,0,68.0,"[{'iso_639_1': 'en', 'name': 'English'}]",Released,,The House on 56th Street,False,8.0,1
False,"{'id': 100693, 'name': '101 Dalmatians (Animated) Collection', 'poster_path': '/cn2TfGiLL4yLJqyNCBSppUdF51W.jpg', 'backdrop_path': '/rcnZbAGQsb3Hp0qPgnRalTyMJlQ.jpg'}",0,"[{'id': 16, 'name': 'Animation'}, {'id': 10751, 'name': 'Family'}]",,13654,tt0324941,en,101 Dalmatians II: Patch's London Adventure,"Being one of 101 takes its toll on Patch, who doesn't feel unique. When he's accidentally left behind on moving day, he meets his idol, Thunderbolt, who enlists him on a publicity campaign.",10.398905,/ht4h6I7WwaZa1E8xzb1jE94mDvS.jpg,"[{'name': 'Walt Disney Pictures', 'id': 2}, {'name': 'Walt Disney Television Animation', 'id': 3475}]","[{'iso_3166_1': 'US', 'name': 'United States of America'}]",2003-01-21,0,70.0,"[{'iso_639_1': 'en', 'name': 'English'}]",Released,A New Hero Unleashed.,101 Dalmatians II: Patch's London Adventure,False,5.7,231
False,,13000000,"[{'id': 99, 'name': 'Documentary'}, {'id': 10402, 'name': 'Music'}, {'id': 10751, 'name': 'Family'}]",http://www.justinbieberneversaynever.com/,54518,tt1702443,en,Justin Bieber: Never Say Never,"\"Tells the story of Justin Bieber, the kid from Canada with the hair, the smile and the voice: It chronicles his unprecedented rise to fame, all the way from busking in the streets of Stratford, Canada to putting videos on YouTube to selling out Madison Square Garden in New York as the headline act during the My World Tour from 2010. It features Usher, Scooter Braun, Ludacris, Sean Kingston, Antonio \"\"L.A.\"\" Reid",Boyz II Men,Miley Cyrus,Jaden Smith,Justin's family members and parts of his crew and huge fanbase in a mix of interviews and guest performances. It was released in 3D in theaters all around the world and is the highest grossing concert movie of all time,"beating the previous record held by Michael Jackson's This Is It from 2009.\"",5.892524,/1f7DaSujt536oVcLT2SlOoNcwma.jpg,"[{'name': 'Insurge Pictures', 'id': 7377}, {'name': 'Magical Elves Productions', 'id': 7378}, {'name': 'Scooter Braun Films', 'id': 7379}]","[{'iso_3166_1': 'US', 'name': 'United States of America'}]",2011-02-11,98441954,105.0,"[{'iso_639_1': 'en', 'name': 'English'}]",Released
False,"{'id': 206559, 'name': 'StreetDance Collection', 'poster_path': '/d0xdu3kaMbQ8FnJkfWI2tfpMATC.jpg', 'backdrop_path': '/mkqD8O0CJxaZf6V0ps2DyZee4HP.jpg'}",0,"[{'id': 18, 'name': 'Drama'}, {'id': 10749, 'name': 'Romance'}]",,85373,tt1718903,en,StreetDance 2,"After suffering humiliation by the crew Invincible, street dancer Ash  looks to gather the best dancers from around the world for a rematch.",5.728471,/5EVriguQ8N0s4DGCPPhYingOeLd.jpg,"[{'name': 'Vertigo Entertainment', 'id': 829}]","[{'iso_3166_1': 'US', 'name': 'United States of America'}]",2012-03-30,0,85.0,"[{'iso_639_1': 'en', 'name': 'English'}, {'iso_639_1': 'fr', 'name': 'Français'}]",Released,,StreetDance 2,False,5.3,110
False,,0,"[{'id': 35, 'name': 'Comedy'}]",,244688,tt3138104,en,The Hungover Games,"\"It's a movie about Hungover guys that get lost in a death match game: Each year, drunk people are selected to participate in torturous games the morning after a big night out. There's no sunglasses, no water, and no headache medicine. \"\"The Hungover Games","\"\" a film that manages to merge the premises of both \"\"The Hunger Games\"\" and \"\"The Hangover\"\" ... and throw in references to \"\"Ted","\"\" \"\"Django Unchained","\"\" \"\"The Lord of the Rings","\"\" \"\"Carrie","\"\" \"\"The Real Housewives of Beverly Hills\"\" and whatever else crossed the writers' fevered brains during the probably very drunken \"\"development process.\"\"\"",6.125484,/oSAV5nd7CNYXKGbUjfceaoVBETo.jpg,"[{'name': 'Silver Nitrate Pictures', 'id': 3641}, {'name': 'Sense and Sensibility Ventures', 'id': 20807}]","[{'iso_3166_1': 'US', 'name': 'United States of America'}]",2014-02-01,0,86.0,"[{'iso_639_1': 'en', 'name': 'English'}]",Released
False,,10,"[{'id': 27, 'name': 'Horror'}, {'id': 53, 'name': 'Thriller'}]",,78383,tt1913166,en,Nurse 3-D,"Abby Russell, a beautiful, dedicated nurse with a sinister side, has a secret life in which she targets and punishes dishonest men.",5.192042,/yuWH3471FAVjlqZWhsPeh4IKsNf.jpg,"[{'name': 'Lions Gate', 'id': 6644}, {'name': 'Lions Gate Entertainments', 'id': 7035}]","[{'iso_3166_1': 'US', 'name': 'United States of America'}]",2013-09-28,10000000,99.0,"[{'iso_639_1': 'en', 'name': 'English'}]",Released,Your pain is her pleasure.,Nurse 3-D,False,4.9,120
False,"{'id': 52985, 'name': 'Wrong Turn Collection', 'poster_path': '/dtfQY5ZxvdHNG4HqNDy0ifwk1q6.jpg', 'backdrop_path': '/32IsLLCoj3mIkZbLfCKSXZVqd3k.jpg'}",0,"[{'id': 27, 'name': 'Horror'}, {'id': 53, 'name': 'Thriller'}]",,125509,tt2375779,en,Wrong Turn 5: Bloodlines,"A small West Virginia town is hosting the legendary Mountain Man Festival on Halloween, where throngs of costumed party goers gather for a wild night of music and mischief. But an inbred family of hillbilly cannibals kill the fun when they trick and treat themselves to a group of visiting college students.",10.556938,/olnVrUyoL2ntBBuipvXBecCbTBX.jpg,"[{'name': 'Summit Entertainment', 'id': 491}, {'name': '20th Century Fox Home Entertainment', 'id': 3635}, {'name': 'Constantin Film Produktion', 'id': 5755}]","[{'iso_3166_1': 'US', 'name': 'United States of America'}]",2012-10-23,0,91.0,"[{'iso_639_1': 'en', 'name': 'English'}]",Released,The inbred hillbillies are back!,Wrong Turn 5: Bloodlines,False,4.7,225
False,"{'id': 389867, 'name': 'Shark.Attack', 'poster_path': None, 'backdrop_path': None}",0,"[{'id': 27, 'name': 'Horror'}]",,18015,tt0313597,fr,Shark Attack 3: Megalodon,When two researchers discover a colossal shark's tooth off the Mexican coast their worst fears surface - the most menacing beast to ever rule the waters is still alive and mercilessly feeding on anything that crosses its path. Now they must hunt the fierce killer and destroy it... before there is no one left to stop it,1.093584,/fH0CYKmqxZJlmNEP9jzxmUdHGg8.jpg,"[{'name': 'Nu Image Films', 'id': 925}, {'name': 'Martien Holdings A.V.V.', 'id': 9077}]","[{'iso_3166_1': 'IL', 'name': 'Israel'}, {'iso_3166_1': 'ZA', 'name': 'South Africa'}, {'iso_3166_1': 'US', 'name': 'United States of America'}]",2002-11-26,0,99.0,"[{'iso_639_1': 'en', 'name': 'English'}]",Released,Terror has surfaced...,Shark Attack 3: Megalodon,False,4.2,21
False,"{'id': 107469, 'name': 'Save The Last Dance Collection', 'poster_path': '/jAByXoHn29RlCjIrOa3k1jl60DB.jpg', 'backdrop_path': None}",0,"[{'id': 18, 'name': 'Drama'}, {'id': 10751, 'name': 'Family'}, {'id': 10749, 'name': 'Romance'}]",,9817,tt0486656,en,Save the Last Dance 2,"Sara joins Julliard in New York to fulfill her and her mother's dream of becoming the Prima ballerina of the school. She befriends her roommates, Zoe and Miles, who teach hip-hop classes. She has ballet classes with the rigid and famous Monique Delacroix that she idolizes - Monique requires full commitment, discipline and hard work from her students. When Miles, who is a composer, invites Sara to help him compose the music for the dance choreography Sara's passion for hip-hop is sparked and she also falls in love with Miles. When she is assigned to perform Giselle in an important event, she feels divided between the technique of the ballet and the creative work offered by Miles.",3.981958,/hpFFc0ERTNbeLGEfZdpjLDn83Cq.jpg,[],"[{'iso_3166_1': 'US', 'name': 'United States of America'}]",2006-10-10,0,90.0,"[{'iso_639_1': 'en', 'name': 'English'}]",Released,The best move... is following your heart.,Save the Last Dance 2,False,5.2,85
False,,0,"[{'id': 27, 'name': 'Horror'}, {'id': 53, 'name': 'Thriller'}]",,10055,tt0451187,en,Room 6,The school teacher Amy has been proposed by her boyfriend Nick early in the morning and she promises her answer later in the afternoon...,1.126642,/xh6LEDeAFs6gbkCkvqn4Nsq3jZ7.jpg,"[{'name': 'Mindfire Entertainment', 'id': 8068}, {'name': 'CFQ Films', 'id': 52209}, {'name': 'Haunted Hospital Productions Inc.', 'id': 52210}]","[{'iso_3166_1': 'US', 'name': 'United States of America'}]",2006-01-01,0,94.0,"[{'iso_639_1': 'en', 'name': 'English'}, {'iso_639_1': 'de', 'name': 'Deutsch'}, {'iso_639_1': 'ru', 'name': 'Pусский'}]",Released,,Room 6,False,4.3,15
False,,3500000,"[{'id': 18, 'name': 'Drama'}, {'id': 28, 'name': 'Action'}]",,98582,tt1924277,es,Grupo 7,"Angel, a young intelligent and kind, aims to be a police inspector. Rafael  instead  is an expeditious, forceful and arrogant policeman. Meanwhile, Miguel and Mateo are part of Group 7, a group of rogue cops ready to do anything to achieve their goals.",2.977321,/j6YLnLaX1jPCw62ICVI5GdkXDkB.jpg,"[{'name': 'TVE', 'id': 103}, {'name': 'La Zanfoñia Producciones', 'id': 257}, {'name': 'Canal Sur Televisión', 'id': 6878}, {'name': 'Atípica Films', 'id': 7342}]","[{'iso_3166_1': 'ES', 'name': 'Spain'}]",2012-04-03,0,95.0,"[{'iso_639_1': 'fr', 'name': 'Français'}, {'iso_639_1': 'de', 'name': 'Deutsch'}, {'iso_639_1': 'es', 'name': 'Español'}]",Released,,Unit 7,False,5.8,43
False,"{'id': 135489, 'name': 'Wishmaster Collection', 'poster_path': '/7nOdiSiu1b5AuNlXNuq73nLq6i6.jpg', 'backdrop_path': '/yCTkIUEOwc7HAGAoZGK85MK8dAd.jpg'}",0,"[{'id': 53, 'name': 'Thriller'}, {'id': 27, 'name': 'Horror'}]",,28635,tt0254871,en,Wishmaster 3: Beyond the Gates of Hell,"The evil Djinn is back at again, this time wreaking havoc on the students of Illinois' Baxter University. His victim is a beautiful, innocent and studious teenage girl named Diana Collins who accidentally opened up the Djinn's tomb and released him.",8.893041,/dXLw1oRPwhDIspGQ3XB4SUCPBg6.jpg,"[{'name': 'Overseas FilmGroup', 'id': 888}, {'name': 'GFT Entertainment', 'id': 1069}, {'name': 'Artisan Entertainment', 'id': 2188}, {'name': 'Blue Rider Pictures', 'id': 2623}, {'name': 'Paquin Entertainment Group', 'id': 24076}, {'name': 'Pendle View (WM) Limited', 'id': 24077}]","[{'iso_3166_1': 'CA', 'name': 'Canada'}, {'iso_3166_1': 'US', 'name': 'United States of America'}]",2001-10-23,0,89.0,"[{'iso_639_1': 'en', 'name': 'English'}]",Released,"Three wishes, one nightmare.",Wishmaster 3: Beyond the Gates of Hell,False,3.8,38
False,"{'id': 19285, 'name': 'Leprechaun Collection (Original Series)', 'poster_path': '/kdnaM7K8T8oXwWk2QdiWEs8Zg2w.jpg', 'backdrop_path': '/pRjYboGyfjO5PkY7Rdg21s4FhoI.jpg'}",0,"[{'id': 27, 'name': 'Horror'}, {'id': 35, 'name': 'Comedy'}]",,19288,tt0339294,en,Leprechaun: Back 2 tha Hood,"When Emily Woodrow and her friends happen on a treasure chest full of gold coins, they fail to to heed the warnings of a wise old psychic who had foretold that they would encounter trouble with a very nasty and protective Leprechaun.",2.551286,/dIyJ9mA3mPW1WEme5tUjaadHrYb.jpg,"[{'name': 'Lions Gate Enterntainment', 'id': 63092}]","[{'iso_3166_1': 'US', 'name': 'United States of America'}]",2003-12-30,0,90.0,"[{'iso_639_1': 'en', 'name': 'English'}]",Released,Evil has a whole new rap!,Leprechaun: Back 2 tha Hood,False,4.9,26
False,"{'id': 117952, 'name': 'The Dentist Collection', 'poster_path': '/pMkTKSKpfeB8hzsFShh6YJSkINb.jpg', 'backdrop_path': '/8cHguvhqp09immQuZboAfhrgA0h.jpg'}",0,"[{'id': 27, 'name': 'Horror'}, {'id': 9648, 'name': 'Mystery'}]",,37526,tt0161492,en,The Dentist 2: Brace Yourself,"Dr. Caine, the murdering dentist from the original movie, has escaped from the mental hospital where he has been since being caught. Hoping to resume a normal life, he makes his way to a quiet Midwestern town under a false name and takes on the responsibilities of the town dentist Things are starting to look up for Caine, until the day when he catches his new love in the arms of someone else. Just as in the first movie, this sends him back over the edge and into another homicidal rampage, with his unfortunate patients bearing the brunt of his hostility.",1.127098,/eE6Zgya8lDxZzHTvc60aUfNnwLm.jpg,"[{'name': 'Trimark Pictures', 'id': 4063}]","[{'iso_3166_1': 'US', 'name': 'United States of America'}]",1998-12-11,0,100.0,"[{'iso_639_1': 'de', 'name': 'Deutsch'}, {'iso_639_1': 'en', 'name': 'English'}]",Released,Brace Yourself!,The Dentist 2: Brace Yourself,False,4.3,20
