adult,belongs_to_collection,budget,genres,homepage,id,imdb_id,original_language,original_title,overview,popularity,poster_path,production_companies,production_countries,release_date,revenue,runtime,spoken_languages,status,tagline,title,video,vote_average,vote_count
False,,16000000,"[{'id': 35, 'name': 'Comedy'}, {'id': 18, 'name': 'Drama'}, {'id': 10749, 'name': 'Romance'}]",,31357,tt0114885,en,Waiting to Exhale,"\"Cheated on, mistreated and stepped on, the women are holding their breath, waiting for the elusive \"\"good man\"\" to break a string of less-than-stellar lovers. Friends and confidants Vannah",Bernie,Glo and Robin talk it all out,"determined to find a better way to breathe.\"",3.859495,/16XOMpEaLWkrcPqSQqhTmeJuqQl.jpg,"[{'name': 'Twentieth Century Fox Film Corporation', 'id': 306}]","[{'iso_3166_1': 'US', 'name': 'United States of America'}]",1995-12-22,81452156,127.0,"[{'iso_639_1': 'en', 'name': 'English'}]",Released,Friends are the people who let you be yourself... and never let you forget it.,Waiting to Exhale
False,"{'id': 91698, 'name': 'Chili Palmer Collection', 'poster_path': '/ae3smJDdWrMJ77tDpYOrpo4frKq.jpg', 'backdrop_path': '/uWaANGQeoSs5vSP1CWtlkDrkqei.jpg'}",30250000,"[{'id': 35, 'name': 'Comedy'}, {'id': 53, 'name': 'Thriller'}, {'id': 80, 'name': 'Crime'}]",,8012,tt0113161,en,Get Shorty,"\"Chili Palmer is a Miami mobster who gets sent by his boss, the psychopathic \"\"Bones\"\" Barboni",to collect a bad debt from Harry Zimm,a Hollywood producer who specializes in cheesy horror films. When Chili meets Harry's leading lady,the romantic sparks fly. After pitching his own life story as a movie idea,"Chili learns that being a mobster and being a Hollywood producer really aren't all that different.\"",12.669608,/vWtDUUgQAsVyvRW4mE75LBgVm2e.jpg,"[{'name': 'Jersey Films', 'id': 216}, {'name': 'Metro-Goldwyn-Mayer (MGM)', 'id': 8411}]","[{'iso_3166_1': 'US', 'name': 'United States of America'}]",1995-10-20,115101622,105.0,"[{'iso_639_1': 'en', 'name': 'English'}]",Released,"The mob is tough, but it’s nothing like show business."
False,,10000000,"[{'id': 28, 'name': 'Action'}, {'id': 80, 'name': 'Crime'}, {'id': 18, 'name': 'Drama'}, {'id': 36, 'name': 'History'}]",,11443,tt0112819,en,Dead Presidents,"\"Depicts a heist of old bills, retired from circulation and destined by the government to be \"\"money to burn\"\". However",more broadly,it addresses the issues of Black Americans' involvement in the Vietnam War and their subsequent disillusionment with progress in social issues and civil rights back home in the United States,"during the 1960s.\"",9.87957,/2dLyvXVvJXUR9otoqERkYpao1bB.jpg,"[{'name': 'Caravan Pictures', 'id': 175}, {'name': 'Underworld Entertainment', 'id': 476}, {'name': 'Hollywood Pictures', 'id': 915}]","[{'iso_3166_1': 'US', 'name': 'United States of America'}]",1995-10-06,0,119.0,"[{'iso_639_1': 'en', 'name': 'English'}]",Released,"In this daring heist, the only color that counts is green",Dead Presidents
False,,33000000,"[{'id': 80, 'name': 'Crime'}, {'id': 9648, 'name': 'Mystery'}, {'id': 53, 'name': 'Thriller'}]",http://www.sevenmovie.com/,807,tt0114369,en,Se7en,"\"Two homicide detectives are on a desperate hunt for a serial killer whose crimes are based on the \"\"seven deadly sins\"\" in this dark and haunting film that takes viewers from the tortured remains of one victim to the next. The seasoned Det. Sommerset researches each sin in an effort to get inside the killer's mind",while his novice partner,Mills,"scoffs at his efforts to unravel the case.\"",18.45743,/8zw8IL4zEPjkh8Aysdcd0FwGMb0.jpg,"[{'name': 'New Line Cinema', 'id': 12}, {'name': 'Juno Pix', 'id': 4286}, {'name': 'Cecchi Gori Pictures', 'id': 65394}]","[{'iso_3166_1': 'US', 'name': 'United States of America'}]",1995-09-22,327311859,127.0,"[{'iso_639_1': 'en', 'name': 'English'}]",Released,Seven deadly sins. Seven ways to die.,Se7en
False,"{'id': 124935, 'name': 'The Lawnmower Man Collection', 'poster_path': '/slBKrKBbL1g3KURphhAYIyOOH0G.jpg', 'backdrop_path': '/id05z92s8Pwc2wbR9YAKngGqOyP.jpg'}",0,"[{'id': 28, 'name': 'Action'}, {'id': 878, 'name': 'Science Fiction'}]",,11525,tt0116839,en,Lawnmower Man 2: Beyond Cyberspace,"Jobe is resuscitated by Jonathan Walker. He wants Jobe to create a special computer chip that would connect all the computers in the world into one network, which Walker would control and use. But what Walker doesn't realize is a group of teenage hackers are on to him and out to stop his plan.",2.49535,/i0hBsWBLw64XRehFzCL44PaCs1y.jpg,"[{'name': 'New Line Cinema', 'id': 12}]","[{'iso_3166_1': 'US', 'name': 'United States of America'}]",1996-01-12,2409225,92.0,"[{'iso_639_1': 'en', 'name': 'English'}, {'iso_639_1': 'hu', 'name': 'Magyar'}]",Released,"God made him simple. Science made him a god. Now, he wants revenge.",Lawnmower Man 2: Beyond Cyberspace,False,2.8,32
False,,44000000,"[{'id': 18, 'name': 'Drama'}, {'id': 53, 'name': 'Thriller'}]",,9623,tt0116731,en,The Juror,"\"With his gangster boss on trial for murder, a mob thug known as \"\"the Teacher\"\" tells Annie Laird she must talk her fellow jurors into a not-guilty verdict",implying that he'll kill her son Oliver if she fails. She manages to do this,but,when it becomes clear that the mobsters might want to silence her for good,she sends Oliver abroad and tries to gather evidence of the plot against her,"setting up a final showdown.\"",6.010579,/7aXOB0DyZPxNOYbaQ2oiNn64jm3.jpg,"[{'name': 'Columbia Pictures Corporation', 'id': 441}]","[{'iso_3166_1': 'US', 'name': 'United States of America'}]",1996-02-02,0,118.0,"[{'iso_639_1': 'en', 'name': 'English'}]",Released
False,,0,[],,188588,tt0113612,en,Last Summer in the Hamptons,"\"Filmed entirely on location in East Hampton, Long Island, \"\"Last Summer in the Hamptons\"\" concerns a large theatrical family spending the last weekend of their summer together at the decades-old family retreat which economic circumstances have forced them to put on the market. Victoria Foyt plays a young Hollywood actress whose visit wreaks havoc on the stellar group of family and friends - led by matriarch Viveca Lindfors and made up of an extraordinary mix of prominent New York actors",directors,and playwrights. In the course of a very unusual weekend,comic as well as serious situations arise,"and the family's secrets - of which there are many - begin to unravel.\"",0.531159,/pfgpkDNcwSi1x4jVzeLqvxTwX5a.jpg,[],[],1995-11-22,0,108.0,[],Released,
False,,0,"[{'id': 35, 'name': 'Comedy'}, {'id': 18, 'name': 'Drama'}, {'id': 10749, 'name': 'Romance'}]",,9283,tt0115639,en,Beautiful Girls,"\"During a snowy winter in the small fictional town of Knight\"\"s Ridge",Massachusetts,a group of lifelong buddies hang out,drink and struggle to connect with the women who affect their decisions,"dreams and desires.\"",4.670562,/8leYqrAL6EubYjOCZuO6ELPdLYe.jpg,"[{'name': 'Miramax Films', 'id': 14}, {'name': 'Woods Entertainment', 'id': 979}]","[{'iso_3166_1': 'US', 'name': 'United States of America'}]",1996-02-09,0,112.0,"[{'iso_639_1': 'en', 'name': 'English'}]",Released,"Good times never seemed so good,"
False,,52000000,"[{'id': 18, 'name': 'Drama'}]",,568,tt0112384,en,Apollo 13,"The true story of technical troubles that scuttle the Apollo 13 lunar mission in 1971, risking the lives of astronaut Jim Lovell and his crew, with the failed journey turning into a thrilling saga of heroism. Drifting more than 200,000 miles from Earth, the astronauts work furiously with the ground crew to avert tragedy.",18.761467,/6JQ9z3V9x4vlU2GSZx2yNO0PvuX.jpg,"[{'name': 'Imagine Entertainment', 'id': 23}, {'name': 'Universal Pictures', 'id': 33}]","[{'iso_3166_1': 'US', 'name': 'United States of America'}]",1995-06-30,355237933,140.0,"[{'iso_639_1': 'en', 'name': 'English'}]",Released,"Houston, we have a problem.",Apollo 13,False,7.3,1637
False,"{'id': 9328, 'name': 'Free Willy Collection', 'poster_path': '/3M2Q9ZDTyFBfi3ohz2gizFmnoL0.jpg', 'backdrop_path': '/aef15QAJ8Kxbh8W5zXqJb1f9Vhw.jpg'}",0,"[{'id': 12, 'name': 'Adventure'}]",,9073,tt0113114,en,Free Willy 2 - The Adventure Home,Jesse becomes reunited with Willy three years after the whale's jump to freedom as the teenager tries to rescue the killer whale and other orcas from an oil spill.,7.575098,/yLyyjm4m3fSvbazyFv4RtUnb2uQ.jpg,"[{'name': 'Regency Enterprises', 'id': 508}, {'name': 'Alcor Films', 'id': 644}, {'name': 'Canal+', 'id': 5358}, {'name': 'Donner/Shuler-Donner Productions', 'id': 5739}, {'name': 'Warner Bros.', 'id': 6194}]","[{'iso_3166_1': 'FR', 'name': 'France'}, {'iso_3166_1': 'US', 'name': 'United States of America'}]",1995-07-19,0,95.0,"[{'iso_639_1': 'en', 'name': 'English'}, {'iso_639_1': 'id', 'name': 'Bahasa indonesia'}, {'iso_639_1': 'ms', 'name': 'Bahasa melayu'}]",Released,The adventure is back. The fun is back. Willy's back. And this time he's brought his whole family to meet an old friend ... and take on a new challenge.,Free Willy 2 - The Adventure Home,False,5.5,130
False,,0,"[{'id': 18, 'name': 'Drama'}]",,32646,tt0114323,en,Safe,"\"Carol, a typical upper middle-class housewife, begins to complain of vague symptoms of illness. She \"\"doesn't feel right","\"\" has unexplained headaches",congestion,a dry cough,nosebleeds,vomiting,and trouble breathing. Her family doctor treats her concerns dismissively and suggests a psychiatrist. Eventually,"an allergist tells her that she has Environmental Illness.\"",8.180047,/ihX2udk636JMAAaWDIMj6n5ejhb.jpg,"[{'name': 'Killer Films', 'id': 1422}, {'name': 'American Playhouse', 'id': 3906}, {'name': 'Kardana Films', 'id': 38692}, {'name': 'Chemical Films', 'id': 39861}]","[{'iso_3166_1': 'GB', 'name': 'United Kingdom'}, {'iso_3166_1': 'US', 'name': 'United States of America'}]",1995-06-23,0,119.0
False,,0,"[{'id': 18, 'name': 'Drama'}]",,139408,tt0114534,en,The Stars Fell on Henrietta,"The setting is early America during the oil boom. An elderly, down on his luck 'oil man', Mr. Cox finds himself in the town of Henrietta. Using unconventional methods, he convinces himself and local Don Day that there is oil on Day's land. The financially strapped Day puts everything into finding oil...but at what cost?",0.913522,/5mkH38tcztyLy6CeAWHD1FC8ozC.jpg,"\"[{'name': 'Malpaso Productions', 'id': 171}, {'name': \"\"Butcher's Run Films\"\"",'id': 3864},{'name': 'Warner Bros.',"'id': 6194}]\"","[{'iso_3166_1': 'US', 'name': 'United States of America'}]",1995-09-15,0,109.0,"[{'iso_639_1': 'hu', 'name': 'Magyar'}, {'iso_639_1': 'en', 'name': 'English'}]",Released,,The Stars Fell on Henrietta
False,,0,"[{'id': 18, 'name': 'Drama'}, {'id': 14, 'name': 'Fantasy'}]",,47939,tt0114663,en,Three Wishes,"\"While Jane Holman (Mastrantonio) is driving with her two sons, she accidentally runs into a drifter, Jack McCloud (Swayze), who breaks his leg. Being responsible,  Jane invites Jack, and his dog, to stay at her home until his leg has healed.  Jack struggles to adapt their lifestyle, and finds himself loved by the family. He starts teaching baseball to Tom, who misses his father, who was lost in the Korean war. Jack and Tom develop a strong bond of friendship. Meanwhile, Gunny believes that there is more to Jack and Betty Jane than meets the eye...  We learn that Jack, is Jack McCloud, a Star White Socks baseball player in 1941, who dropped out of the league, after his first season, and; \"\"was never heard from again\"\" ...  A wonderful story.  We witness magic between a boy's imagination",and Jack's dog,and are never sure if we are witnessing imagination or magic by the dog.  A story of friendship,family,"and learning that life isn't always as cut and dried as we often believe.\"",11.002046,/ub79b63JJV4oeHwomSy5OS5fVsr.jpg,"[{'name': 'Savoy Pictures', 'id': 11308}]","[{'iso_3166_1': 'US', 'name': 'United States of America'}]",1995-10-27,7025496,115.0,"[{'iso_639_1': 'en', 'name': 'English'}]",Released,"If you really believe, magic will find you"
False,"{'id': 112399, 'name': 'Under Siege Collection', 'poster_path': '/5hkZdonGNmoqatnadpDnIgEbrho.jpg', 'backdrop_path': '/4Ysa3x4wDwolRpUXBCrig7szGon.jpg'}",60000000,"[{'id': 28, 'name': 'Action'}, {'id': 53, 'name': 'Thriller'}]",,3512,tt0114781,en,Under Siege 2: Dark Territory,"A passenger train has been hijacked by an electronics expert and turned into an untraceable command center for a weapons satellite. He has planned to blow up Washington DC and only one man can stop him, former Navy SEAL Casey Ryback.",7.490247,/6Z1p71nkm45cYuIZWOx5JSCYc0o.jpg,"[{'name': 'Regency Enterprises', 'id': 508}, {'name': 'Warner Bros.', 'id': 6194}, {'name': 'Seagal/Nasso Productions', 'id': 17825}, {'name': 'Victor Company of Japan (JVC)', 'id': 21480}, {'name': 'Cutting Edge Films', 'id': 63906}]","[{'iso_3166_1': 'US', 'name': 'United States of America'}]",1995-07-13,104324083,100.0,"[{'iso_639_1': 'en', 'name': 'English'}]",Released,Last time he rocked the boat. This time the sky's the limit.,Under Siege 2: Dark Territory,False,5.6,217
False,,0,"[{'id': 99, 'name': 'Documentary'}]",,77350,tt0114805,en,Unzipped,"\"Using a variety of cinematographic techniques, the world of high- profile fashion designer Issac Mizrahi is portrayed as being driven by excitement and creativity, despite the concomitant chaos and cacophony. Mizrahi's frenzied genius and rollercoaster emotions paint a humorous and personal portrait of a brilliant designer. Famous \"\"SuperModels\"\"",actors,and actresses populate Issac's rarified world,"but Douglas Keeve's cameras capture the stress and turbulence beneath the placid coolness of glamour. Written by Tad Dibbern\"",0.786023,/5fY5iN8mUBLdd4fmcXwdTqAZ9Sx.jpg,[],"[{'iso_3166_1': 'US', 'name': 'United States of America'}]",1995-08-11,0,73.0,"[{'iso_639_1': 'en', 'name': 'English'}]",Released,,Unzipped
False,,18000000,"[{'id': 35, 'name': 'Comedy'}, {'id': 18, 'name': 'Drama'}, {'id': 36, 'name': 'History'}]",,522,tt0109707,en,Ed Wood,"\"The mostly true story of the legendary \"\"worst director of all time\"\"",who,with the help of his strange friends,"filmed countless B-movies without ever becoming famous or successful.\"",11.720358,/9qBe2sUDyY2dFH1iHq0SZb1G4QG.jpg,"[{'name': 'Touchstone Pictures', 'id': 9195}]","[{'iso_3166_1': 'US', 'name': 'United States of America'}]",1994-09-27,5887457,127.0,"[{'iso_639_1': 'en', 'name': 'English'}]",Released,"When it came to making bad movies, Ed Wood was the best.",Ed Wood
False,,0,"[{'id': 35, 'name': 'Comedy'}, {'id': 80, 'name': 'Crime'}]",,18713,tt0110189,en,The Jerky Boys,"\"When two unemployed telephone pranksters decide to use their vocal \"\"talents\"\" to impersonate a Chicago mob boss and curry favor with organized crime in New York","the trouble begins. It isn't long before Johnny and Kamal (the \"\"Jerky Boys\"\" of crank call fame) are wanted by the local mafia",the police,"and their neighbor.\"",0.748846,/lXu3oa1mQzI2sDsFcKuyJYLziLK.jpg,"[{'name': 'Caravan Pictures', 'id': 175}, {'name': 'Touchstone Pictures', 'id': 9195}]","[{'iso_3166_1': 'US', 'name': 'United States of America'}]",1995-02-03,0,82.0,"[{'iso_639_1': 'en', 'name': 'English'}]",Released,,The Jerky Boys
False,,0,"[{'id': 18, 'name': 'Drama'}]",,49980,tt0110296,en,Ladybird Ladybird,"\"This Ken Loach docu-drama relates the story of a British woman's fight with Social Services over the care of her children. Maggie has a history of bouncing from one abusive relationship to another. She has four children, of four different fathers, who came to the attention of Social Services when they were injured in a fire. Subsequently, Maggie was found to be an \"\"unfit mother\"\" and her children were removed from her care. She finally meets the man of her dreams",a Paraguayan expatriate,and they start a family together. Unfortunately,Social Services seems unwilling to accept that her life has changed and rends them from their new children. She and Jorge together,and separately,fight Social Services,Immigration,"and other government bureaucrats in a desperate battle to make their family whole again.\"",0.84508,/9YgIxxPsWMwoIFrBgNxHgGn0y29.jpg,"[{'name': 'Channel Four Films', 'id': 181}, {'name': 'Parallax Pictures', 'id': 983}]","[{'iso_3166_1': 'GB', 'name': 'United Kingdom'}]",1994-02-18,0,101.0
False,,45000000,"[{'id': 18, 'name': 'Drama'}, {'id': 27, 'name': 'Horror'}, {'id': 878, 'name': 'Science Fiction'}, {'id': 10749, 'name': 'Romance'}]",,3036,tt0109836,en,Frankenstein,"\"Based on Mary Shelley's novel, \"\"Frankenstein\"\" tells the story of Victor Frankenstein",a promising young doctor who,devastated by the death of his mother during childbirth,becomes obsessed with bringing the dead back to life. His experiments lead to the creation of a monster,"which Frankenstein has put together with the remains of corpses. It's not long before Frankenstein regrets his actions.\"",14.287753,/uG0YLHdiBuWBv99MLwthucsvKLZ.jpg,"[{'name': 'American Zoetrope', 'id': 70}, {'name': 'TriStar Pictures', 'id': 559}]","[{'iso_3166_1': 'GB', 'name': 'United Kingdom'}, {'iso_3166_1': 'JP', 'name': 'Japan'}, {'iso_3166_1': 'US', 'name': 'United States of America'}]",1994-11-04,112006296,123.0,"[{'iso_639_1': 'en', 'name': 'English'}]",Released,Be Warned.  It's Alive
False,,0,"[{'id': 14, 'name': 'Fantasy'}, {'id': 18, 'name': 'Drama'}, {'id': 10751, 'name': 'Family'}]",,10510,tt0110527,en,Miracle on 34th Street,"A little girl discovers dreams can come true if you really believe. Six-year-old Susan Walker has doubts about childhood's most enduring miracle - Santa Claus. Her mother told her the 'secret' about Santa a long time ago. But after meeting a special department store Santa who's convinced he's the real thing, Susan is given the most precious gift of all something to believe in.",5.831622,/iuI31j8DM4TOxJTZeumG0S4npPU.jpg,"[{'name': 'Twentieth Century Fox Film Corporation', 'id': 306}]","[{'iso_3166_1': 'US', 'name': 'United States of America'}]",1994-11-18,46264384,114.0,"[{'iso_639_1': 'en', 'name': 'English'}]",Released,"If you really believe, anything can happen.",Miracle on 34th Street,False,6.4,199
False,"{'id': 286948, 'name': 'Nemesis Collection', 'poster_path': '/nKAGlTL97Sp1zIy3f6rGEqjyjGG.jpg', 'backdrop_path': None}",0,"[{'id': 878, 'name': 'Science Fiction'}, {'id': 28, 'name': 'Action'}, {'id': 53, 'name': 'Thriller'}]",,63105,tt0113948,en,Nemesis 2 - Nebula,"It has been 73 years since Alex failed and the Humans lost the Cyborg Wars. Since then, the Humans have been enslaved. Scientists have developed a new DNA strain, which could signal the end of the Cyborgs, and they inject it into a volunteer. When the Cyborgs learn of the woman and the baby they list both for termination.",1.466491,/mY7SX6aBDumSweQMTCdfrIbMLAa.jpg,"[{'name': 'Filmwerks', 'id': 7954}, {'name': 'Imperial Entertainment', 'id': 21437}]","[{'iso_3166_1': 'US', 'name': 'United States of America'}]",1995-09-26,0,83.0,"[{'iso_639_1': 'en', 'name': 'English'}]",Released,The Future Just Got Darker,Nemesis 2 - Nebula,False,4.6,10
False,,0,"[{'id': 35, 'name': 'Comedy'}, {'id': 18, 'name': 'Drama'}, {'id': 10749, 'name': 'Romance'}]",,9058,tt0110737,en,Only You,"\"A childhood incident has convinced Faith Corvatch that her true love is a guy named \"\"Damon Bradley","\"\" but she has yet to meet him. Preparing to settle down and marry a foot doctor",Faith impulsively flies to Venice when it seems that she may be able to finally encounter the man of her dreams. Instead,"she meets the charming Peter Wright. But can they fall in love if she still believes that she is intended to be with someone else?\"",4.936761,/eaHH1hnbZ9wIUHjYKlqJUwpTBan.jpg,"[{'name': 'TriStar Pictures', 'id': 559}]","[{'iso_3166_1': 'US', 'name': 'United States of America'}]",1994-09-17,0,115.0,"[{'iso_639_1': 'en', 'name': 'English'}]",Released,A love story written in the stars.,Only You
False,,16000000,"[{'id': 53, 'name': 'Thriller'}, {'id': 80, 'name': 'Crime'}, {'id': 18, 'name': 'Drama'}]",,101,tt0110413,fr,Léon,"\"Leon, the top hit man in New York, has earned a rep as an effective \"\"cleaner\"\". But when his next-door neighbors are wiped out by a loose-cannon DEA agent",he becomes the unwilling custodian of 12-year-old Mathilda. Before long,Mathilda's thoughts turn to revenge,"and she considers following in Leon's footsteps.\"",20.477329,/gE8S02QUOhVnAmYu4tcrBlMTujz.jpg,"[{'name': 'Columbia Pictures', 'id': 5}, {'name': 'Gaumont', 'id': 9}]","[{'iso_3166_1': 'FR', 'name': 'France'}, {'iso_3166_1': 'US', 'name': 'United States of America'}]",1994-09-14,45284974,110.0,"[{'iso_639_1': 'en', 'name': 'English'}]",Released,"If you want a job done well, hire a professional.",Leon: The Professional
False,,32,"[{'id': 35, 'name': 'Comedy'}, {'id': 18, 'name': 'Drama'}, {'id': 10749, 'name': 'Romance'}]",,36614,tt0111309,en,The Sum of Us,"\"\"\"The Sum of Us\"\" is an Aussie story about a father and a son both searching for love and sharing an unconventional bond. Harry",the father,"is the caring and open-minded \"\"mate\"\" that borders on annoyance. His son Jeff unsuccessfully searches for love","with the unwanted guidance of his father.\"",1.407427,/rAQAUf6HHUyoT2Ii6jUmzMu5Ppf.jpg,"[{'name': 'Samuel Goldwyn Company', 'id': 798}]","[{'iso_3166_1': 'AU', 'name': 'Australia'}]",1994-07-12,0,100.0,"[{'iso_639_1': 'en', 'name': 'English'}]",Released,We're all just . . . The Sum of Us.,The Sum of Us
False,"{'id': 37139, 'name': 'Naked Gun Collection', 'poster_path': '/qTJ2fbdU2Ru4OGZghQB8MYofkrN.jpg', 'backdrop_path': '/jxSnW02zjKtFnXFK2UzcLH8Ced2.jpg'}",30000000,"[{'id': 35, 'name': 'Comedy'}, {'id': 80, 'name': 'Crime'}]",,36593,tt0110622,en,The Naked Gun 33⅓: The Final Insult,"Frank Drebin is persuaded out of retirement to go undercover in a state prison. There he is to find out what top terrorist, Rocco, has planned for when he escapes. Frank's wife, Jane, is desperate for a baby.. this adds to Frank's problems. A host of celebrities at the Academy awards ceremony are humiliated by Frank as he blunders his way trying to foil Rocco.",10.587232,/k3F8N3jeqXOpm1qjY7mL8O6vdx.jpg,"[{'name': 'Paramount Pictures', 'id': 4}]","[{'iso_3166_1': 'US', 'name': 'United States of America'}]",1994-03-18,51132598,83.0,"[{'iso_639_1': 'en', 'name': 'English'}]",Released,"A Mad Bomber is on the Loose, and If Anyone Can Stop Him....So Can Frank!",The Naked Gun 33⅓: The Final Insult,False,6.4,535
False,,0,"[{'id': 35, 'name': 'Comedy'}, {'id': 18, 'name': 'Drama'}]",,52038,tt0110455,en,A Man of No Importance,"\"Alfie Byrne is a middle-aged bus conductor in Dublin in 1963. He would appear to live a life of quiet desperation: he's gay, but firmly closeted, and his sister is always trying to find him \"\"the right girl\"\". His passion is Oscar Wilde",his hobby is putting on amateur theatre productions in the local church hall. We follow him as he struggles with temptation,friendship,disapproval,"and the conservative yet oddly lyrical world of Ireland in the early 1960s.\"",0.406113,/l3APcL3lgn5KztIOe1BQ6mKQFKB.jpg,"[{'name': 'BBC Films', 'id': 288}, {'name': 'Majestic Films International', 'id': 2630}, {'name': 'Little Bird', 'id': 11358}]","[{'iso_3166_1': 'GB', 'name': 'United Kingdom'}, {'iso_3166_1': 'IE', 'name': 'Ireland'}]",1994-12-22,953,99.0,"[{'iso_639_1': 'en', 'name': 'English'}]",Released,An extraordinary tale of an ordinary hero.
False,,0,"[{'id': 18, 'name': 'Drama'}]",,39953,tt0112570,en,"Boys Life: Three Stories of Love, Lust, and Liberation","\"Each of the three short films in this collection presents a young gay man at the threshold of adulthood. In \"\"Pool Days","\"\" Justin is a 17-year old Bethesda lad",hired as the evening life guard at a fitness center. In the course of the summer,"he realizes and embraces that he's gay. In \"\"A Friend of Dorothy","\"\" Winston arrives from upstate for his freshman year at NYU. He has to figure out",with some help from Anne,a hometown friend,"how to build a social life as a young gay man in the city. In \"\"The Disco Years","\"\" Tom looks back on 1978","the year in high school that he came out of the closet after one joyful and several painful encounters\"",0.054148,/dyzCRoZCjb2Rafmiws8ySGMt56T.jpg,"[{'name': 'Strand Releasing', 'id': 3923}, {'name': 'Strand Home Video', 'id': 25583}]","[{'iso_3166_1': 'US', 'name': 'United States of America'}]",1994-09-30
False,,0,"[{'id': 18, 'name': 'Drama'}, {'id': 10749, 'name': 'Romance'}]",,18069,tt0109021,en,8 Seconds,"This film chronicles the life of Lane Frost, 1987 PRCA Bull Riding World Champion, his marriage and his friendships with Tuff Hedeman (three-time World Champion) and Cody Lambert.",1.888534,/dNkJp1oOZxiEYFSRyZfcEreGZNS.jpg,"[{'name': 'New Line Cinema', 'id': 12}]","[{'iso_3166_1': 'US', 'name': 'United States of America'}]",1994-02-25,0,105.0,"[{'iso_639_1': 'en', 'name': 'English'}, {'iso_639_1': 'fr', 'name': 'Français'}]",Released,Hang on for the ride of your life!,8 Seconds,False,7.2,22
False,"{'id': 252313, 'name': 'The Endless Summer Collection', 'poster_path': '/zhG3P4ALlXxoFi0CGfcVsR3qmDL.jpg', 'backdrop_path': '/rbeqwDmy0yPMxBqA2ELvu08okcn.jpg'}",0,"[{'id': 99, 'name': 'Documentary'}]",,24257,tt0109729,en,The Endless Summer 2,"Bruce Brown, king of surfing documentaries, returns after nearly thirty years to trace the steps of two young surfers to top surfing spots around the world. Along the way we see many of the people and locales Bruce visited during the filming of Endless Summer (1966).",0.408159,/uNWiRuJWa4yRd4DsjonnWn7gEQG.jpg,[],"[{'iso_3166_1': 'US', 'name': 'United States of America'}]",1994-06-03,0,109.0,"[{'iso_639_1': 'en', 'name': 'English'}]",Released,,The Endless Summer 2,False,7.1,12
