adult,belongs_to_collection,budget,genres,homepage,id,imdb_id,original_language,original_title,overview,popularity,poster_path,production_companies,production_countries,release_date,revenue,runtime,spoken_languages,status,tagline,title,video,vote_average,vote_count
False,,0,[],,200114,tt0084848,en,The Vals,"\"Sam, Trish, Beth, and Annie are four Valley Girls bored with shopping and frat parties. They come across kind Mr. Stanton, who is running a home for orphaned boys. Mr. Stanton and his charges are in danger of being evicted from their home if they don't come up with the rent money that is due, and one of the boys has taken to selling drugs for a couple of sleazy dealers. When Trish's prized \"\"TUBUL R\"\" Mercedes convertible is lost in a bet in which their Beverly Hills rivals have cheated",mayhem ensues as the Vals,with the help of their frat boy boyfriends,save Mr. Stanton and his boys from being evicted,give the drug dealers their just desserts,"and exact revenge on the Beverly Hills brats in a rematch.\"",0.292774,/qQKYnlNgOzsU0uXhpbYgD1xRiqG.jpg,[],[],1982-11-01,0,99.0,[],Released
False,,0,"[{'id': 18, 'name': 'Drama'}]",,180418,tt2368525,es,15 años y un día,"Jon is a troubled teenager who has been expelled from school. His mother decides to teach him a lesson sending him away with his grandfather Max, a retired military man who lives in a village by the seaside. But the time they will spend together won’t be that simple, Jon likes to flirt with danger and bad companies, and the veteran has now settled down into a comfortable life.",0.785439,/iv0XOJw364rd35L8JgChQecqKA3.jpg,"[{'name': 'Tornasol Films', 'id': 7680}, {'name': 'Castafiore Films', 'id': 9971}]","[{'iso_3166_1': 'ES', 'name': 'Spain'}]",2013-06-07,0,96.0,"[{'iso_639_1': 'es', 'name': 'Español'}]",Released,,15 Years and One Day,False,6.4,7
False,,0,"[{'id': 99, 'name': 'Documentary'}, {'id': 10769, 'name': 'Foreign'}]",http://www.5elefanten.ch/Intro,88744,tt1510726,en,Die Frau mit den 5 Elefanten,"Documentary about Svetlana Geier, a Ukranian who has translated the great works of Dostoyevsky into German. First her father ends up in one of Stalin's prison camps, then young Svetlana herself experiences the German invasion. In order to survive she learns German at home in Kiev. She is good and gets work as a translator before ending up in a German camp in 1943. Now, 65 years later, she is a renowned translator who in her twilight years has translated the great works of Dostoevsky. For the first time in all these years, she returns to Kiev together with her granddaughter.",0.511713,/vv08mQABB7tOvtxPrMsfObcxbjA.jpg,"[{'name': 'Schweizer Fernsehen', 'id': 1927}, {'name': 'Zweites Deutsches Fernsehen (ZDF)', 'id': 4606}, {'name': '3Sat', 'id': 8134}]","[{'iso_3166_1': 'CH', 'name': 'Switzerland'}]",2010-01-09,0,93.0,"[{'iso_639_1': 'de', 'name': 'Deutsch'}]",Released,,The Woman with the 5 Elephants,False,6.5,2
False,,0,"[{'id': 28, 'name': 'Action'}, {'id': 10769, 'name': 'Foreign'}]",,26569,tt0182666,zh,Hu bao long she ying,"An aged Kung Fu practitioner travels across China, challenging the best Grandmaster from each province to prove his mastery of martial arts. Meanwhile is a plot developing behind his back.",0.62682,/34yWwS9k89OpWC1kYmpDItLTNS.jpg,"[{'name': 'Hong Hwa Motion Picture Company', 'id': 4534}]","[{'iso_3166_1': 'TW', 'name': 'Taiwan'}]",1977-03-20,0,84.0,"[{'iso_639_1': 'zh', 'name': '普通话'}]",Released,,The 7 Grandmasters,False,6.7,9
False,"{'id': 328372, 'name': 'Mall Cop Collection', 'poster_path': '/dpI0Ms55QByARcgeMf0YK1z2x3D.jpg', 'backdrop_path': '/29gIFb0wzsl2ArW9HZ2S2ERdDp4.jpg'}",38000000,"[{'id': 28, 'name': 'Action'}, {'id': 35, 'name': 'Comedy'}, {'id': 10751, 'name': 'Family'}]",,256961,tt3450650,en,Paul Blart: Mall Cop 2,"Security guard Paul Blart is headed to Las Vegas to attend a Security Guard Expo with his teenage daughter Maya before she departs for college. While at the convention, he inadvertently discovers a heist - and it's up to Blart to apprehend the criminals.",17.02038,/618jhN1vEFHkA3MBrURuBZ7SuID.jpg,"[{'name': 'Columbia Pictures', 'id': 5}, {'name': 'Happy Madison Productions', 'id': 2608}, {'name': 'Sony Pictures Releasing', 'id': 3045}, {'name': 'Sony Pictures Entertainment (SPE)', 'id': 7431}, {'name': 'LStar Capital', 'id': 34034}, {'name': 'Hey Eddie', 'id': 46222}]","[{'iso_3166_1': 'US', 'name': 'United States of America'}]",2015-04-16,107597242,94.0,"[{'iso_639_1': 'en', 'name': 'English'}]",Released,Vegas has a new high roller.,Paul Blart: Mall Cop 2,False,5.0,576
False,,0,"[{'id': 53, 'name': 'Thriller'}, {'id': 80, 'name': 'Crime'}, {'id': 18, 'name': 'Drama'}]",,92389,tt0069761,en,Badge 373,"When his partner is killed, tough Irish detective Eddie Ryan (Robert Duvall) vows to avenge the death, whatever the cost. As he begins unraveling clues, his behavior becomes so outrageous that he's obliged to turn in his badge, but the experience only emboldens him. Ryan eventually learns that his partner was caught up in a Puerto Rican gun-running scheme masterminded by a crook named Sweet Willie (Henry Darrow), who wants to foment revolutionary war.",0.089257,/nCr7bPJRDNuhT73qYUC9IkrN2FO.jpg,"[{'name': 'Paramount Pictures', 'id': 4}]","[{'iso_3166_1': 'US', 'name': 'United States of America'}]",1973-07-25,0,116.0,"[{'iso_639_1': 'en', 'name': 'English'}]",Released,"A gun in his sock, a tire iron in his belt, and no badge. The story of Eddie. The best ex-cop in the business.",Badge 373,False,5.5,2
False,,0,"[{'id': 27, 'name': 'Horror'}, {'id': 878, 'name': 'Science Fiction'}]",,3164,tt0051630,en,Frankenstein 1970,The baron's grandson rents the family castle to a TV crew to fund his atomic revival of the family monster.,0.867198,/mKbvZDkIqY4rk67iITuLsH9lMK.jpg,"[{'name': 'Aubrey Schenck Productions', 'id': 1347}]","[{'iso_3166_1': 'US', 'name': 'United States of America'}]",1958-07-20,0,83.0,"[{'iso_639_1': 'en', 'name': 'English'}]",Released,The One...The Only KING OF MONSTERS as the new demon of the atomic age!,Frankenstein 1970,False,4.3,7
False,"{'id': 294226, 'name': 'The Dead Collection', 'poster_path': '/5ktVahJejSiHQFARdYDl7WfZTWp.jpg', 'backdrop_path': '/fi8rckkIPpR1jc9aLQn0x4h6Z8f.jpg'}",0,"[{'id': 27, 'name': 'Horror'}]",,214464,tt2917336,en,The Dead 2: India,The Sequel to the Ford brothers The Dead. The action moves to India.,0.957287,/ywi8BieG0cK9fKsOw1HwlTsyejl.jpg,[],"[{'iso_3166_1': 'GB', 'name': 'United Kingdom'}]",2013-08-22,0,90.0,[],Released,The Feeding Continues,The Dead 2: India,False,5.0,16
False,,0,"[{'id': 28, 'name': 'Action'}]",,330431,tt3742284,hi,NH10,"A woman, stacked against all odds, manages to not just stick it out but indeed give it back.",1.306922,/1PPUgbQE9UVrgPyMif8urLSIKWb.jpg,"[{'name': 'Eros International', 'id': 3653}, {'name': 'Phantom Films', 'id': 7435}]","[{'iso_3166_1': 'IN', 'name': 'India'}]",2015-03-13,0,115.0,"[{'iso_639_1': 'hi', 'name': 'हिन्दी'}]",Released,,NH10,False,6.7,26
False,,0,"[{'id': 27, 'name': 'Horror'}, {'id': 18, 'name': 'Drama'}, {'id': 9648, 'name': 'Mystery'}, {'id': 53, 'name': 'Thriller'}]",,19599,tt1169809,en,Book of Blood,"\"Based on the wraparound story penned by Clive Barker in the author's \"\"Books of Blood\"\" collection",the story centers on a paranormal expert who,while investigating a gruesome slaying,"finds a house that is at the intersection of \"\"highways\"\" transporting souls to the afterlife.\"",6.152506,/uikpmjGcBsMKc5fN4bqmUrNWIVO.jpg,"[{'name': 'Scottish Screen', 'id': 698}, {'name': 'Matador Pictures', 'id': 707}, {'name': 'uFilm', 'id': 8676}, {'name': 'Regent Capital', 'id': 12696}, {'name': 'Entertainment Motion Pictures', 'id': 18302}, {'name': 'Midnight Picture Show', 'id': 22056}, {'name': 'Le Tax Shelter du Gouvernement Fédéral de Belgique', 'id': 33960}, {'name': 'Plum Films', 'id': 43535}]","[{'iso_3166_1': 'GB', 'name': 'United Kingdom'}]",2009-03-07,0,96.0,"[{'iso_639_1': 'en', 'name': 'English'}]",Released,The dead will not be silenced.,Book of Blood
False,"{'id': 98435, 'name': 'Patlabor Collection', 'poster_path': '/nyvcnmR73RCDX45mhVyd7RjEpvL.jpg', 'backdrop_path': '/owvE3lxUTk37jnwDRPbfc0DvELN.jpg'}",0,"[{'id': 16, 'name': 'Animation'}, {'id': 878, 'name': 'Science Fiction'}, {'id': 28, 'name': 'Action'}]",,14572,tt0124770,ja,機動警察パトレイバー 2 the Movie,"A Japanese police unit who use giant anthropomorphic robots (called Labors) is caught up in a political struggle between the civilian authorities and the military when a terrorist act is blamed on an Air Force jet. With the aid of a government agent, the team gets close to a terrorist leader to stop things from going out of control when after the military is impelled to impose martial law.",1.605615,/uqXxPg1OLT1hj6bHHSnZqF4tso1.jpg,[],"[{'iso_3166_1': 'JP', 'name': 'Japan'}]",1993-08-07,0,107.0,"[{'iso_639_1': 'ja', 'name': '日本語'}]",Released,,Patlabor 2: The Movie,False,7.4,18
False,"{'id': 265865, 'name': 'Space Dogs', 'poster_path': None, 'backdrop_path': None}",6000000,"[{'id': 12, 'name': 'Adventure'}, {'id': 16, 'name': 'Animation'}, {'id': 35, 'name': 'Comedy'}, {'id': 10751, 'name': 'Family'}]",,260310,tt3600950,ru,Белка и Стрелка: Лунные приключения,"Get ready to blast off to an out-of-this-world adventure with canine teenage astronaut, Pushok, who is determined to find his missing astronaut father. Against all odds, Pushok stows away on a US rocket ship to the moon but soon finds he is not alone, as he is reunited with his mom and encounters a macho monkey and a baby alien. Together, the furry heroes learn the true meaning of teamwork as they join the search for Pushok's dad.",0.622825,/8yR2CtjBD8TGzYj3P9YOr8m0tUX.jpg,"[{'name': 'KinoAtis', 'id': 21384}]","[{'iso_3166_1': 'RU', 'name': 'Russia'}]",2014-02-06,0,90.0,"[{'iso_639_1': 'ru', 'name': 'Pусский'}]",Released,,Space Dogs 2,False,4.2,3
False,,0,"[{'id': 16, 'name': 'Animation'}, {'id': 28, 'name': 'Action'}, {'id': 18, 'name': 'Drama'}, {'id': 878, 'name': 'Science Fiction'}]",http://exaella.cyberpunk-anime.com,94205,tt2160163,en,Exaella,"\"It all happened in one of the safest Somniupolis of the planet, inside one of the best-equipped and reliable mega-complexes - \"\"Xonasu Area.\"\" As in the very beginning",and in the last few decades,all the systems had operated in nominal mode until the satellite network transferred an array of unclassified data to the central analytical cluster. According to the guidelines,the data were immediately isolated and sent to be re-evaluated in order to classify the registered events and to develop further options for protective and preventive efforts. A few days later,"the tranquility of the sleeping \"\"Xonasu\"\" was torn apart by sharp","blazing fragments of multiple meteors. The area around the \"\"Xonasu\"\" faltered - a wave of interruptions and failures rapidly swept through the heart of its systems ... and one of the errors launched the sequence to awake the Supreme Operator of Xonasu. A little later - all was quiet and still.\"",0.083703,/bVWXq7xY4ydXrA0au3iSMEw2wtz.jpg,[],[],2011-12-22,0,90.0,"[{'iso_639_1': 'ja', 'name': '日本語'}]",Released
False,"{'id': 279715, 'name': 'Beck Collection', 'poster_path': '/8Kzrc2bsGt0RUyTN6vHvh4yu0QO.jpg', 'backdrop_path': None}",0,"[{'id': 53, 'name': 'Thriller'}, {'id': 80, 'name': 'Crime'}, {'id': 9648, 'name': 'Mystery'}]",,315367,tt4186548,sv,Beck 30 - Sjukhusmorden,An elderly woman dies in a hospital in Stockholm and it turns out that she suffered from an incurable disease. Her son refuses to believe that it was the disease that was the primary cause of her death.,0.649984,/zOyqeDSdBp5rE4mhfzPtXcFoBAP.jpg,"[{'name': 'Nordisk Film', 'id': 235}, {'name': 'TV4 Sweden AB', 'id': 8267}, {'name': 'TV2 Norge', 'id': 11682}]","[{'iso_3166_1': 'SE', 'name': 'Sweden'}]",2015-03-28,0,84.0,"[{'iso_639_1': 'sv', 'name': 'svenska'}]",Released,,Beck 30 - Sjukhusmorden,False,4.7,3
False,,0,"[{'id': 53, 'name': 'Thriller'}, {'id': 80, 'name': 'Crime'}]",,35852,tt0041460,en,Obsession,"\"Dr. Clive Riordan's beautiful-but-flirty wife, \"\"Storm\"\"",comes home one night in the company of an American diplomat,Bill Kronin. Riordan,obsessed with jealousy,determines to murder his most recent rival and plans,as only a psychiatrist would,to not only kill bill,"but to commit the perfect crime in the process.\"",0.686758,/nUTHTKPVIUvehKJ5R51rmczNHJK.jpg,"[{'name': 'Independent Sovereign Films', 'id': 5577}]","[{'iso_3166_1': 'GB', 'name': 'United Kingdom'}]",1949-08-03,0,96.0
False,,0,"[{'id': 35, 'name': 'Comedy'}, {'id': 53, 'name': 'Thriller'}]",,46808,tt0106671,en,Tallinn pimeduses,"\"In August, 1991, Estonia reclaims its independence from the USSR and brings to its national bank nearly $1 billion in gold bullion hidden in Paris for 50 years. Russian mobsters have a bold plan to hijack the gold after shutting down the capital's power at midnight. For this they need Toivo, an electrical technician. His wife is pregnant and she urges him to take the job (\"\"$5000 buys lots of baby food\"\"). After Toivo leaves for the plant",his wife goes into labor. Birth and blackout happen simultaneously; the baby needs an incubator,but there's no power. Jealousies within the Mob undercut the plan's smooth operation,"and soon the Mob has Toivo to deal with as well.\"",0.156614,/ejlt1wrNARwPq2835tNHWTPwGlm.jpg,"[{'name': 'Upstream Pictures', 'id': 68293}, {'name': 'Filmzolfo', 'id': 73019}]","[{'iso_3166_1': 'SE', 'name': 'Sweden'}, {'iso_3166_1': 'EE', 'name': 'Estonia'}, {'iso_3166_1': 'FI', 'name': 'Finland'}, {'iso_3166_1': 'US', 'name': 'United States of America'}]",1993-06-06,0,99.0,"[{'iso_639_1': 'et', 'name': 'Eesti'}]",Released,,Darkness in Tallinn
False,,0,"[{'id': 12, 'name': 'Adventure'}]",,37932,tt1381767,en,Flicka 2,"Carrie is a big-city teenager whose life is turned upside down when she moves to a horse ranch in Wyoming to live with her father. But everything changes when Carrie meets Flicka, a wild, jet-black mustang who's just as free-spirited and strong-willed as Carrie. The two form a special bond and Carrie opens her heart to her father and a handsome, local boy, but when a jealous rival puts Flicka's life in jeopardy, Carrie must do whatever it takes to save her best friend.",1.669915,/vEnJYxcNlfMUueBgaKmTJ67xjv9.jpg,"[{'name': '20th Century Fox Film Corporation', 'id': 22573}]","[{'iso_3166_1': 'US', 'name': 'United States of America'}]",2010-05-04,0,96.0,"[{'iso_639_1': 'en', 'name': 'English'}]",Released,Sometimes you have to break free to find yourself.,Flicka 2,False,6.1,20
False,,10000000,"[{'id': 35, 'name': 'Comedy'}, {'id': 18, 'name': 'Drama'}]",https://twitter.com/50to1_Movie,197583,tt1777595,en,50 to 1,"A misfit group of New Mexico cowboys find themselves on the journey of a lifetime when they learn their crooked-footed racehorse qualifies to run in the Kentucky Derby. Based on the true story of Mine That Bird, the cowboys must overcome impossible odds even before they reach Churchill Downs and the land of Kentucky's blue bloods.",2.691651,/dMapJmPm8aVxFFfEQ5yC0YmXJAV.jpg,"[{'name': 'Ten Furlongs', 'id': 48401}]","[{'iso_3166_1': 'US', 'name': 'United States of America'}]",2014-03-21,1064454,110.0,"[{'iso_639_1': 'en', 'name': 'English'}, {'iso_639_1': 'fr', 'name': 'Français'}]",Released,,50 to 1,False,5.7,19
False,,0,"[{'id': 99, 'name': 'Documentary'}]",,250745,tt2171902,en,Happy Valley,"\"The children of \"\"Happy Valley\"\" were victimized for years",by a key member of the legendary Penn State college football program. But were Jerry Sandusky’s crimes an open secret? With rare access,director Amir Bar-Lev delves beneath the headlines to tell a modern American parable of guilt,redemption,"and identity.\"",1.436689,/mgUyQNgZaDoPCOHVE65UrZLl266.jpg,[],[],2014-11-14,0,98.0,"[{'iso_639_1': 'en', 'name': 'English'}]",Released,
False,,0,"[{'id': 18, 'name': 'Drama'}]",,108309,tt1538988,es,Retratos en un mar de mentiras,"\"A young woman experiences the worst life has to over in this depressing but worthwhile Colombian drama tinged with a hint of magical realism. Paola Baldion plays Marina, a withdrawn teenager whose abusive grand-dad houses her in a dilapidated shed. When the old fart pops his clogs, Marina passes into the care of cousin Jairo (Julian Roman), a cheesecake photographer who \"\"hires\"\" her to help him with his gear",and the two end up taking an episodic road trip as they travel to reclaim grandpa's legacy. Unpleasant flashbacks to Marina's tragic childhood ensue. Yep,the good times never end in this one! Known in English as Portraits in a Sea of Lies,"this meditation on the 50-year long Colombian civil war - as seen through the grueling experiences of our heroine - won the Jury Award for Best Narrative Feature at the 14th Cine Las Americas International Film Festival.\"",0.058236,/godyLpoSErgL5NjqW7R4wgqZGl.jpg,[],[],2010-05-21,0,90.0,"[{'iso_639_1': 'es', 'name': 'Español'}]",Rumored,,Portraits in a Sea of Lies
False,,0,"[{'id': 99, 'name': 'Documentary'}]",,290304,tt3657420,en,21 Years: Richard Linklater,"Documentary that takes a behind the scenes tour of groundbreaking director Richard Linklater's last 21 years creating his iconic legacy of films from the unconventional breakout 'Slacker' to the innovative 'Boyhood'. Features candid conversations with actors Ethan Hawke, Julie Delpy, Matthew McConaughey and others.",1.287567,/hlgWdZlnQcA6cpYwdGvFdIHsCaV.jpg,"[{'name': 'Wood Entertainment', 'id': 82620}]","[{'iso_3166_1': 'US', 'name': 'United States of America'}]",2014-11-07,0,78.0,"[{'iso_639_1': 'en', 'name': 'English'}]",Released,Eighteen Films. One Legend.,21 Years: Richard Linklater,False,6.3,8
False,,3,"[{'id': 18, 'name': 'Drama'}, {'id': 10749, 'name': 'Romance'}]",,70026,tt0104225,en,Falling From Grace,"\"Rock singer John Mellencamp makes his screen and directorial debut in this story by \"\"Lonesome Dove\"\" author",Larry McMurtry. The story,not too separated from Mellencamp's real life,finds him as a country music star whose meanderings and philandering has thrown his life into turmoil. Returning to his native Indiana to try to reestablish a normal life. Instead he takes up with an old lover (Lenz),ignoring his loving wife (Hemingway),"and duplicating the lifestyle of his womanizing father (Akins).\"",1e-06,/sZPCqZNhj3KzYr942c6ARhfvaRB.jpg,[],[],1992-02-21,232,100.0,[],Released
False,,0,"[{'id': 28, 'name': 'Action'}, {'id': 53, 'name': 'Thriller'}]",,86768,tt0050087,en,5 Steps to Danger,Can a couple keep important secrets from Communist spies?,0.904551,/89BPRnvtZvKa7W12SEFNvpbdrua.jpg,"[{'name': 'United Artists', 'id': 60}, {'name': 'Henry S. Kesler Productions', 'id': 37648}]","[{'iso_3166_1': 'US', 'name': 'United States of America'}]",1957-01-30,0,81.0,"[{'iso_639_1': 'en', 'name': 'English'}]",Released,LASHED TOGETHER BY THE SAME SIN AND THE SAME SECRET!,5 Steps to Danger,False,5.8,4
False,,0,"[{'id': 12, 'name': 'Adventure'}, {'id': 18, 'name': 'Drama'}]",,134608,tt0056646,es,El valle de las espadas,"\"Also released as Valley of the Swords, this lugubrious US/Spanish co-production features the usual mid-1960s \"\"tax shelter\"\" international cast. Broderick Crawford plays a despotic 10th century Spanish king who",in cahoots with the invading Moors,has banished handsome Castilian nobleman Spartaco Santoni. With the surreptitious aid of Crawford's daughter Teresa Velasquez,"Santoni assembles an army to march against the Moors. In keeping with the 13th century epic poem from which this film was derived (\"\"El Poema de Fernan Gonzales\"\") Santoni's path is smoothed by the celestial intervention of patron saints Milan and Santiago. Among the big names picking up a few tax-free dollars in The Castilian are Cesar Romero",Linda Darnell,"Alida Valli and Fernando Rey.\"",0.089389,/oT4Bd4bNLLFNB4qSC57Ywd3iTWt.jpg,"[{'name': 'Cinemagic Inc.', 'id': 13757}, {'name': 'M.D. Producciones Cinematográficas', 'id': 40780}]","[{'iso_3166_1': 'ES', 'name': 'Spain'}, {'iso_3166_1': 'US', 'name': 'United States of America'}]",1963-04-13,0,128.0,"[{'iso_639_1': 'en', 'name': 'English'}, {'iso_639_1': 'es', 'name': 'Español'}]",Rumored
False,,0,"[{'id': 99, 'name': 'Documentary'}]",,259180,tt0378936,en,Den umulige time,"\"The Impossible Hour is a concentrated study of Ole Ritter's attempt in Mexico City in 1974 to set a new record for the hour - described in the film as \"\"the noblest","most difficult record that can be set on a bicycle\"\". A brief retrospective in black and white sets the historical framework",with shots of Ritter and Eddy Merckx' successful record attempts in 1968 and 1972 respectively,and a few words about former record holders such as Fausto Coppi.The film follows Ritter's three record attempts chronologically,which,accompanied by a Mexican marching band on the bandstand,"all fail.\"",4.9e-05,/6vxM3Shr1iR6CirwR8p9GqQTWoI.jpg,[],"[{'iso_3166_1': 'DK', 'name': 'Denmark'}, {'iso_3166_1': 'MX', 'name': 'Mexico'}]",1974-03-08,0,45.0,"[{'iso_639_1': 'en', 'name': 'English'}]"
False,,0,"[{'id': 99, 'name': 'Documentary'}]",http://oc87.com/OC87.html,105972,tt1550557,en,"OC87: The Obsessive Compulsive, Major Depression, Bipolar, Asperger's Movie",Director Bud Clayman documents his struggle with OCD and Asperger's Syndrome and how it derailed his plan to become a filmmaker.,0.225695,/lXNJU2ge8nBZ4FtyPzmNLnuuk3s.jpg,[],"[{'iso_3166_1': 'US', 'name': 'United States of America'}]",2012-05-25,0,100.0,"[{'iso_639_1': 'en', 'name': 'English'}]",Released,,"OC87: The Obsessive Compulsive, Major Depression, Bipolar, Asperger's Movie",False,7.0,3
False,"{'id': 334356, 'name': 'The Man with the Iron Fists Collection', 'poster_path': '/3ag7T0qwL3yAMrocJERu4z3eMYW.jpg', 'backdrop_path': '/1gTLyR2zGYhbeJ9rfsJBu8MJQ3o.jpg'}",0,"[{'id': 28, 'name': 'Action'}]",http://www.universalstudiosentertainment.com/man-with-the-iron-fists-the/,321494,tt3625152,en,The Man with the Iron Fists 2,"When a stranger, Thaddeus, is found badly wounded near the village, miner Li Kung and his wife Ah Ni offer him refuge. As he heals, he becomes entrenched in a conflict that pits the townsfolk against the evil Master Ho, his nefarious Beetle Clan and the terrifying Lord Pi.",3.98978,/njPa0RO0KKmwBCGHcEOTbxljftF.jpg,"[{'name': 'Living Films', 'id': 2877}, {'name': 'Arcade Pictures', 'id': 11112}, {'name': 'Iron Fists', 'id': 11113}]","[{'iso_3166_1': 'US', 'name': 'United States of America'}]",2015-03-10,0,90.0,"[{'iso_639_1': 'ja', 'name': '日本語'}, {'iso_639_1': 'en', 'name': 'English'}]",Released,,The Man with the Iron Fists 2,False,4.6,63
False,"{'id': 39438, 'name': 'Emmanuelle Collection', 'poster_path': '/a9USKXesKJB9X4TM4c38L6kix13.jpg', 'backdrop_path': '/4oce1WhKi5OmfV1v1LA8SoPRbLO.jpg'}",0,"[{'id': 18, 'name': 'Drama'}]",,39412,tt0077497,fr,Goodbye Emmanuelle,Emmanuelle and her architect husband continue their amoral lifestyle in the Seychelles. But when a casual dilliance between her and a film director starts to turn serious her husband shows very traditional signs of jealousy.,2.224085,/678mqsTS8FarTmk0FlchYgvsXmz.jpg,"[{'name': 'New World-Mutual', 'id': 5768}]","[{'iso_3166_1': 'FR', 'name': 'France'}]",1977-12-15,0,100.0,"[{'iso_639_1': 'fr', 'name': 'Français'}]",Released,The ecstasy continues,Emmanuelle 3,False,4.5,10
False,"{'id': 39438, 'name': 'Emmanuelle Collection', 'poster_path': '/a9USKXesKJB9X4TM4c38L6kix13.jpg', 'backdrop_path': '/4oce1WhKi5OmfV1v1LA8SoPRbLO.jpg'}",0,"[{'id': 18, 'name': 'Drama'}]",,40978,tt0085486,fr,Emmanuelle 4,"In order to escape from her former lover Marc, Sylvia goes to Brazil where Dr. Santamo transforms her into the beautiful Emmanuelle...",2.704921,/bUUJWW0coGFReebnEC6CW7yCXUn.jpg,"[{'name': 'Sara Films', 'id': 876}, {'name': 'AS Productions', 'id': 6060}]","[{'iso_3166_1': 'FR', 'name': 'France'}]",1984-02-15,0,89.0,"[{'iso_639_1': 'fr', 'name': 'Français'}]",Released,,Emmanuelle 4,False,5.0,12
False,"{'id': 39438, 'name': 'Emmanuelle Collection', 'poster_path': '/a9USKXesKJB9X4TM4c38L6kix13.jpg', 'backdrop_path': '/4oce1WhKi5OmfV1v1LA8SoPRbLO.jpg'}",0,"[{'id': 28, 'name': 'Action'}, {'id': 18, 'name': 'Drama'}]",,146047,tt0092962,en,Emmanuelle 5,"Emmanuelle, the sexiest woman in the world, endures a streak of bad luck that begins when she's stripped by a mob of adoring fans at an international film festival. Emmanuelle's lousy luck continues when she's abducted from her yacht off the South of France and forced to submit to the erotic desires of an Arab sheik.",1.366642,/dI2ujXZxomaKvR5Gzj1ebHEzR3Z.jpg,"[{'name': 'AS Productions', 'id': 6060}, {'name': 'New Horizon Picture Corp.', 'id': 6086}]","[{'iso_3166_1': 'FR', 'name': 'France'}]",1987-01-07,0,85.0,"[{'iso_639_1': 'en', 'name': 'English'}, {'iso_639_1': 'fr', 'name': 'Français'}]",Released,,Emmanuelle 5,False,4.7,3
False,"{'id': 39438, 'name': 'Emmanuelle Collection', 'poster_path': '/a9USKXesKJB9X4TM4c38L6kix13.jpg', 'backdrop_path': '/4oce1WhKi5OmfV1v1LA8SoPRbLO.jpg'}",0,"[{'id': 18, 'name': 'Drama'}, {'id': 10749, 'name': 'Romance'}]",,61108,tt0095094,fr,Emmanuelle 6,Journey with Emmanuelle and the world's most excuisite models deep into the Amazon jungle to the heart of paradise. Beauty can be dangerous and the women soon find themselves captive to a powerful drug lord. Now they must escape from a land of darkness,2.834832,/tng9jKMfNFJj47ZBm9LIpXPncj0.jpg,"[{'name': 'AS Productions', 'id': 6060}, {'name': 'Société Générale de Gestion Cinématographique (SGGC)', 'id': 27139}]","[{'iso_3166_1': 'FR', 'name': 'France'}]",1988-07-06,0,80.0,"[{'iso_639_1': 'fr', 'name': 'Français'}]",Released,Never before -- Never again!,Emmanuelle 6,False,4.3,8
