adult,belongs_to_collection,budget,genres,homepage,id,imdb_id,original_language,original_title,overview,popularity,poster_path,production_companies,production_countries,release_date,revenue,runtime,spoken_languages,status,tagline,title,video,vote_average,vote_count
False,,15000000,"[{'id': 35, 'name': 'Comedy'}, {'id': 80, 'name': 'Crime'}]",http://www.biglebowskibluray.com/splash.php,115,tt0118715,en,The Big Lebowski,"\"Jeffrey \"\"The Dude\"\" Lebowski",a Los Angeles slacker who only wants to bowl and drink white Russians,is mistaken for another Jeffrey Lebowski,a wheelchair-bound millionaire,and finds himself dragged into a strange series of events involving nihilists,adult film producers,ferrets,errant toes,"and large sums of money.\"",15.952524,/qiE3ovg9TPylHReZjizQ40LsKZV.jpg,"[{'name': 'Gramercy Pictures', 'id': 37}, {'name': 'PolyGram Filmed Entertainment', 'id': 1382}, {'name': 'Working Title Films', 'id': 10163}]","[{'iso_3166_1': 'GB', 'name': 'United Kingdom'}, {'iso_3166_1': 'US', 'name': 'United States of America'}]",1998-03-06,46189568
False,"{'id': 71458, 'name': '3 Ninjas Collection', 'poster_path': '/cApZ5GwwzMsA991J6uAOb52Js0s.jpg', 'backdrop_path': None}",0,"[{'id': 28, 'name': 'Action'}, {'id': 35, 'name': 'Comedy'}, {'id': 10751, 'name': 'Family'}]",,32302,tt0118539,en,3 Ninjas: High Noon at Mega Mountain,"Three young boys, Rocky, Colt and Tum Tum together with their neighbor girl, computer whiz Amanda are visiting Mega Mountain amusement park when it is invaded by an army of ninjas led by evil Medusa, who wants to take over the park and hold the owners for ransom. Kids and retired TV star Dave Dragon, who made his farewell appearance at the park at the time the ninjas appeared, have to break Medusa's vicious plans.",3.014082,/qTavfpV1XWblnrfkASOxBnrdO0M.jpg,"[{'name': 'TriStar Pictures', 'id': 559}, {'name': 'Leeds/Ben-Ami Productions', 'id': 27084}, {'name': 'Sheen Productions', 'id': 27085}]","[{'iso_3166_1': 'US', 'name': 'United States of America'}]",1998-04-10,0,93.0,"[{'iso_639_1': 'en', 'name': 'English'}, {'iso_639_1': 'fr', 'name': 'Français'}, {'iso_639_1': 'de', 'name': 'Deutsch'}]",Released,Saving the day the ninja way!,3 Ninjas: High Noon at Mega Mountain,False,3.9,38
False,,70000000,"[{'id': 53, 'name': 'Thriller'}]",,11258,tt0120696,en,Hard Rain,"\"Get swept up in the action as an armored car driver (Christian Slater) tries to elude a gang of thieves (led by Morgan Freeman) while a flood ravages the countryside. Hard Rain is \"\"a wild",thrilling,"chilling action ride\"\" filled with close calls","uncertain loyalties and heart-stopping heroics.\"",6.363405,/sERY2UzVUAgJfnuePKJOiIY8MpS.jpg,"[{'name': 'Paramount Pictures', 'id': 4}, {'name': 'Toho-Towa', 'id': 657}, {'name': 'Mutual Film Company', 'id': 762}, {'name': 'PolyGram Filmed Entertainment', 'id': 1382}, {'name': 'Marubeni', 'id': 4650}, {'name': 'Tele München Fernseh Produktionsgesellschaft (TMG)', 'id': 7237}, {'name': 'UGC PH', 'id': 23932}, {'name': 'British Broadcasting Corporation (BBC) Television', 'id': 48136}, {'name': 'Stargate Studios', 'id': 55474}]","[{'iso_3166_1': 'DK', 'name': 'Denmark'}, {'iso_3166_1': 'FR', 'name': 'France'}, {'iso_3166_1': 'NZ', 'name': 'New Zealand'}, {'iso_3166_1': 'GB', 'name': 'United Kingdom'}, {'iso_3166_1': 'US', 'name': 'United States of America'}]",1998-01-16,19870567,97.0,"[{'iso_639_1': 'en', 'name': 'English'}]",Released,"In the worst storm in living memory, one guard stands between five men and three million dollars.",Hard Rain
False,,0,"[{'id': 18, 'name': 'Drama'}, {'id': 80, 'name': 'Crime'}, {'id': 9648, 'name': 'Mystery'}]",,43911,tt0119521,en,A Letter from Death Row,"\"A psychological thriller that takes you through the mind of convicted killer, Michael Raine, and his experiences on death row. Was he guilty of killing his girlfriend or was he a victim of a conspiracy to frame him for a crime he didn't commit? As the story unfolds Jessica Foster, an assistant to the Governor of Tennessee begins to interview Raine while on death row, claiming that she's writing a book about the inmates. Through various circumstances, Raine puts two and two together and builds a case that he believes can prove his innocence...or does he? Ms. Foster is the only one on the 'outside\"\" who can give Raine a voice",but is she working for those who framed him? As time draws near to the date of his execution,in his most desperate hour Raine finds the missing pieces to the puzzle to prove his innocence,but is it too late...? Was this story told from Raine's point of view or from the book writers or from yours,"the viewer - you decide.\"",0.152449,/2HXM7ZbgdosN1Xxx2etMfhjXZpM.jpg,[],[],1998-11-17,0,89.0,"[{'iso_639_1': 'en', 'name': 'English'}]",Released,There Is No Lie More Terrifying Than The Truth.
False,,0,"[{'id': 10749, 'name': 'Romance'}, {'id': 80, 'name': 'Crime'}, {'id': 18, 'name': 'Drama'}]",,2923,tt0120594,en,B. Monkey,"\"When wistful introvert Alan Furnace meets quick-witted bombshell Beatrice, he has no idea of her secret life as \"\"B. Monkey\"\" -- the top thief-for-hire in London's criminal underworld. Charmed by Furnace's innocent and chivalrous ways",Beatrice resolves to reform. But to cash in on her first chance at real love,she must escape her former partner in crime,"the ruthless Paul Neville -- and a dark past that seems to haunt her every step.\"",2.399824,/owKZAo5QxyulBwMvHqKn4a2abNc.jpg,"[{'name': 'Miramax Films', 'id': 14}, {'name': 'Synchronistic Pictures', 'id': 1260}, {'name': 'Scala Productions', 'id': 1261}]","[{'iso_3166_1': 'GB', 'name': 'United Kingdom'}, {'iso_3166_1': 'US', 'name': 'United States of America'}]",1998-11-07,0,94.0,"[{'iso_639_1': 'fr', 'name': 'Français'}, {'iso_639_1': 'en', 'name': 'English'}, {'iso_639_1': 'it', 'name': 'Italiano'}]",Released,Trouble never looked so good.,B. Monkey
False,,1000000,"[{'id': 9648, 'name': 'Mystery'}, {'id': 27, 'name': 'Horror'}, {'id': 14, 'name': 'Fantasy'}]",,12238,tt0119784,en,The Night Flier,"\"Two investigative reporters for a tabloid magazine track down across country \"\"The Night Flier\"\"",a serial killer who travels by private plane stalking victims in rural airports. One of the reporters,Richard Dees,"begins to suspect that \"\"the Night Flier could perhaps be a vampire\"\"\"",7.146514,/8YSBQNxJPj1ZScau9nStzDgASUU.jpg,"[{'name': 'New Amsterdam Entertainment', 'id': 572}, {'name': 'Medusa Film', 'id': 6246}, {'name': 'Stardust International', 'id': 22269}]","[{'iso_3166_1': 'IT', 'name': 'Italy'}, {'iso_3166_1': 'US', 'name': 'United States of America'}]",1997-04-30,91549,93.0,"[{'iso_639_1': 'en', 'name': 'English'}]",Released,Never believe what you publish...Never publish what you believe.,The Night Flier
False,"{'id': 112636, 'name': 'The Blues Brothers Collection', 'poster_path': '/pQf9LzCokihzlLmgQlPG7yBpZ1o.jpg', 'backdrop_path': '/i4Jai1IlkbOWd8eNFM0S1lupyLt.jpg'}",28000000,"[{'id': 10402, 'name': 'Music'}, {'id': 28, 'name': 'Action'}, {'id': 35, 'name': 'Comedy'}, {'id': 80, 'name': 'Crime'}]",,11568,tt0118747,en,Blues Brothers 2000,"\"Elwood, the now lone \"\"Blues Brother\"\" finally released from prison",is once again enlisted by Sister Mary Stigmata in her latest crusade to raise funds for a children's hospital. Once again hitting the road to re-unite the band and win the big prize at the New Orleans Battle of the Bands,Elwood is pursued cross-country by the cops,"led by Cabel the Curtis' son\"",13.162168,/87FRtfvpH6nGhGRIDymcNGn6duK.jpg,"[{'name': 'Universal Pictures', 'id': 33}]","[{'iso_3166_1': 'US', 'name': 'United States of America'}]",1998-02-05,14051384,123.0,"[{'iso_639_1': 'ru', 'name': 'Pусский'}, {'iso_639_1': 'en', 'name': 'English'}]",Released,,Blues Brothers 2000
False,,0,"[{'id': 18, 'name': 'Drama'}, {'id': 10749, 'name': 'Romance'}]",,53092,tt0119780,en,"Niagara, Niagara","\"\"\"Niagra","Niagra\"\" begins quietly in a drugstore in Poughkeepsie",where Marcie,the film's disarming heroine,likes to shoplift. She literally crashes into Seth,a quiet outsider,also on a shoplifting spree. Marcie invites Seth to accompany her to Canada to find a black hairstyling head. They set off in Seth's beat-up station wagon,destined for a toy store in Toronto. While on the road,Marcie confides to Seth that she has Tourette's syndrome,"necessitating a series of detours to liquor stories and pharmacies along the roads of upstate New York.\"",0.782772,/vfqXUxEpS24cXE5KqtpFS0RREC2.jpg,"[{'name': 'Shooting Gallery', 'id': 1596}]","[{'iso_3166_1': 'CA', 'name': 'Canada'}, {'iso_3166_1': 'US', 'name': 'United States of America'}]",1997-08-30
False,,29000000,"[{'id': 12, 'name': 'Adventure'}, {'id': 14, 'name': 'Fantasy'}, {'id': 28, 'name': 'Action'}, {'id': 35, 'name': 'Comedy'}, {'id': 10751, 'name': 'Family'}]",,9449,tt0118755,en,The Borrowers,"\"The four-inch-tall Clock family secretly share a house with the normal-sized Lender family, \"\"borrowing\"\" such items as thread",safety pins,batteries and scraps of food. However,their peaceful co-existence is disturbed when evil lawyer Ocious P. Potter steals the will granting title to the house,which he plans to demolish in order to build apartments. The Lenders are forced to move,"and the Clocks face the risk of being exposed to the normal-sized world.\"",14.924667,/wJIabF2Y4tzFtMslS1NtKB1dflt.jpg,"[{'name': 'Working Title Films', 'id': 10163}, {'name': 'Polygram Filmed Entertainment', 'id': 31080}]","[{'iso_3166_1': 'GB', 'name': 'United Kingdom'}, {'iso_3166_1': 'US', 'name': 'United States of America'}]",1997-12-05,0,86.0,"[{'iso_639_1': 'en', 'name': 'English'}]",Released
False,,0,"[{'id': 35, 'name': 'Comedy'}, {'id': 18, 'name': 'Drama'}, {'id': 10751, 'name': 'Family'}]",,78373,tt0118925,en,"Dancer, Texas Pop. 81","\"Four guys, best friends, have grown up together in DANCER, TEXAS POP. 81, a tiny town in West Texas. Years ago, they made a solemn vow to leave town together as soon as they graduate. Now, it's that weekend and the time has come to \"\"put up or shut up.\"\" The clock is ticking and as all 81 people in the town watch",comment,offer advice and place bets,"these four very different boys with unique backgrounds struggle with the biggest decision of their lives... whether to stay or leave home.\"",0.567444,/khV9zPcvgOjrqwlk3dI1lGojZib.jpg,"[{'name': 'HSX Films', 'id': 4714}, {'name': 'Chase Productions', 'id': 16517}]","[{'iso_3166_1': 'US', 'name': 'United States of America'}]",1998-05-01,565592,97.0,"[{'iso_639_1': 'en', 'name': 'English'}]",Released,in the middle of nowhere they had everything,"Dancer, Texas Pop. 81"
False,,1500000,"[{'id': 10749, 'name': 'Romance'}, {'id': 35, 'name': 'Comedy'}, {'id': 80, 'name': 'Crime'}, {'id': 18, 'name': 'Drama'}]",,9464,tt0118789,en,Buffalo '66,"Billy is released after five years in prison. In the next moment, he kidnaps teenage student Layla and visits his parents with her, pretending she is his girlfriend and they will soon marry.",9.167761,/taVFuUhUWoX9YE7bb2bWkSPjC9P.jpg,[],"[{'iso_3166_1': 'US', 'name': 'United States of America'}]",1998-01-20,2375097,110.0,"[{'iso_639_1': 'en', 'name': 'English'}]",Released,Billy Brown just got out of jail. Now he's going to serve some real time. He's going home.,Buffalo '66,False,7.2,172
False,"{'id': 945, 'name': 'Lethal Weapon Collection', 'poster_path': '/5zg6QLY0tdDLVHLwn28oowG3m8H.jpg', 'backdrop_path': '/bSLbqUqs5FzBOb1aO9v7qz71R0U.jpg'}",140000000,"[{'id': 28, 'name': 'Action'}, {'id': 12, 'name': 'Adventure'}, {'id': 35, 'name': 'Comedy'}, {'id': 80, 'name': 'Crime'}, {'id': 53, 'name': 'Thriller'}]",,944,tt0122151,en,Lethal Weapon 4,"In the combustible action franchise's final installment, maverick detectives Martin Riggs and Roger Murtaugh square off against Asian mobster Wah Sing Ku, who's up to his neck in slave trading and counterfeit currency. With help from gumshoe Leo Getz and smart-aleck rookie cop Lee Butters, Riggs and Murtaugh aim to take down Ku and his gang.",14.470551,/kpC9Y0jhwTqtRlcetxbgn3crnlU.jpg,"[{'name': 'Silver Pictures', 'id': 1885}, {'name': 'Donner/Shuler-Donner Productions', 'id': 5739}, {'name': 'Warner Bros.', 'id': 6194}]","[{'iso_3166_1': 'US', 'name': 'United States of America'}]",1998-07-10,285444603,127.0,"[{'iso_639_1': 'en', 'name': 'English'}, {'iso_639_1': 'cn', 'name': '广州话 / 廣州話'}, {'iso_639_1': 'zh', 'name': '普通话'}]",Released,The faces you love. The action you expect.,Lethal Weapon 4,False,6.3,782
False,,60000,"[{'id': 878, 'name': 'Science Fiction'}, {'id': 27, 'name': 'Horror'}]",,10513,tt0052077,en,Plan 9 from Outer Space,"\"In California, an old man (Bela Lugosi) grieves the loss of his wife (Vampira) and on the next day he also dies. However, the space soldier Eros and her mate Tanna use an electric device to resurrect them both and the strong Inspector Clay (Tor Johnson) that was murdered by the couple. Their intention is not to conquest Earth but to stop mankind from developing the powerful bomb \"\"Solobonite\"\" that would threaten the universe. When the population of Hollywood and Washington DC sees flying saucers on the sky",a colonel,a police lieutenant,a commercial pilot,"his wife and a policeman try to stop the aliens.\"",8.084953,/tBkJps1poCnVqWbqNfVLgAbb8br.jpg,"[{'name': 'Reynolds Pictures', 'id': 74116}]","[{'iso_3166_1': 'US', 'name': 'United States of America'}]",1959-07-22,0,79.0,"[{'iso_639_1': 'en', 'name': 'English'}]",Released,Unspeakable Horrors From Outer Space Paralyze The Living And Resurrect The Dead!
False,"{'id': 155474, 'name': 'French Connection Collection', 'poster_path': '/zheN2WhCSS1M8rkjObQGr0dZdvZ.jpg', 'backdrop_path': '/islbdTICsxPE1c3YEFzEc9Wb46p.jpg'}",1800000,"[{'id': 28, 'name': 'Action'}, {'id': 80, 'name': 'Crime'}, {'id': 53, 'name': 'Thriller'}]",,1051,tt0067116,en,The French Connection,Tough narcotics detective 'Popeye' Doyle is in hot pursuit of a suave French drug dealer who may be the key to a huge heroin-smuggling operation.,6.694959,/xwDi4wF0I1L5bSW08Y8GocDGjJP.jpg,"\"[{'name': 'Twentieth Century Fox Film Corporation', 'id': 306}, {'name': \"\"D'Antoni Productions\"\"",'id': 646},{'name': 'Schine-Moore Productions',"'id': 73950}]\"","[{'iso_3166_1': 'US', 'name': 'United States of America'}]",1971-10-09,41158757,104.0,"[{'iso_639_1': 'en', 'name': 'English'}, {'iso_639_1': 'fr', 'name': 'Français'}]",Released,There are no rules and no holds barred when Popeye cuts loose!,The French Connection
False,"{'id': 8581, 'name': 'A Nightmare on Elm Street Collection', 'poster_path': '/BcgmrOz69AUBRukw5LLGeYsOgo.jpg', 'backdrop_path': '/xDScJToK3YDTZmxNqQ0hFTObeXq.jpg'}",3000000,"[{'id': 27, 'name': 'Horror'}]",,10014,tt0089686,en,A Nightmare on Elm Street Part 2: Freddy's Revenge,"A new family moves into the house on Elm Street, and before long, the kids are again having nightmares about deceased child murderer Freddy Krueger. This time, Freddy attempts to possess a teenage boy to cause havoc in the real world, and can only be overcome if the boy's sweetheart can master her fear.",8.668146,/seEMZxo6bhHWbWPNcBQfsMAk39F.jpg,"[{'name': 'New Line Cinema', 'id': 12}, {'name': 'Smart Egg Pictures', 'id': 1531}]","[{'iso_3166_1': 'US', 'name': 'United States of America'}]",1985-10-31,29999213,87.0,"[{'iso_639_1': 'en', 'name': 'English'}]",Released,Someone is coming back to Elm Street!,A Nightmare on Elm Street Part 2: Freddy's Revenge,False,5.7,367
False,"{'id': 8581, 'name': 'A Nightmare on Elm Street Collection', 'poster_path': '/BcgmrOz69AUBRukw5LLGeYsOgo.jpg', 'backdrop_path': '/xDScJToK3YDTZmxNqQ0hFTObeXq.jpg'}",5000000,"[{'id': 27, 'name': 'Horror'}, {'id': 53, 'name': 'Thriller'}]",,10072,tt0093629,en,A Nightmare on Elm Street 3: Dream Warriors,"It's been many years since Freddy Krueger's first victim, Nancy, came face-to-face with Freddy and his sadistic, evil ways. Now, Nancy's all grown up; she's put her frightening nightmares behind her and is helping teens cope with their dreams. Too bad Freddy's decided to herald his return by invading the kids' dreams and scaring them into committing suicide.",10.035081,/4aMSIhvShIkDrhOsa0WL6KFwnpD.jpg,"[{'name': 'New Line Cinema', 'id': 12}, {'name': 'Smart Egg Pictures', 'id': 1531}]","[{'iso_3166_1': 'US', 'name': 'United States of America'}]",1987-02-27,44793222,96.0,"[{'iso_639_1': 'en', 'name': 'English'}]",Released,"If you think you're ready for Freddy, think again!",A Nightmare on Elm Street 3: Dream Warriors,False,6.5,363
False,"{'id': 8581, 'name': 'A Nightmare on Elm Street Collection', 'poster_path': '/BcgmrOz69AUBRukw5LLGeYsOgo.jpg', 'backdrop_path': '/xDScJToK3YDTZmxNqQ0hFTObeXq.jpg'}",7000000,"[{'id': 27, 'name': 'Horror'}, {'id': 53, 'name': 'Thriller'}]",,10131,tt0095742,en,A Nightmare on Elm Street 4: The Dream Master,"Dream demon Freddy Krueger is resurrected from his apparent demise, and rapidly tracks down and kills the remainder of the Elm Street kids. However, Kristen, who can draw others into her dreams, wills her special ability to her friend Alice. Alice soon realizes that Freddy is taking advantage of that unknown power to pull a new group of children into his foul domain.",8.120317,/qmng7zSdklgLv7WECZVK1JPMnIn.jpg,"[{'name': 'New Line Cinema', 'id': 12}]","[{'iso_3166_1': 'US', 'name': 'United States of America'}]",1988-08-19,72500000,99.0,"[{'iso_639_1': 'en', 'name': 'English'}]",Released,Terror beyond your wildest dreams.,A Nightmare on Elm Street 4: The Dream Master,False,5.8,287
False,"{'id': 9735, 'name': 'Friday the 13th Collection', 'poster_path': '/uobgqpLQff9WvxGKE2OSvXv1RHm.jpg', 'backdrop_path': '/c7pMKwv5NzIN6N3KM4L8fYMTtPw.jpg'}",550000,"[{'id': 27, 'name': 'Horror'}]",,4488,tt0080761,en,Friday the 13th,Camp counselors are stalked and murdered by an unknown assailant while trying to reopen a summer camp that was the site of a child's drowning.,12.146747,/mGJlh8oMyTDhfudvs20kFpYz0Yc.jpg,"[{'name': 'Paramount Pictures', 'id': 4}, {'name': 'Georgetown Productions Inc.', 'id': 16779}, {'name': 'Sean S. Cunningham Films', 'id': 17611}]","[{'iso_3166_1': 'US', 'name': 'United States of America'}]",1980-05-09,59754601,95.0,"[{'iso_639_1': 'en', 'name': 'English'}]",Released,"They were warned...They are doomed...And on Friday the 13th, nothing will save them.",Friday the 13th,False,6.4,622
False,"{'id': 9735, 'name': 'Friday the 13th Collection', 'poster_path': '/uobgqpLQff9WvxGKE2OSvXv1RHm.jpg', 'backdrop_path': '/c7pMKwv5NzIN6N3KM4L8fYMTtPw.jpg'}",1250000,"[{'id': 27, 'name': 'Horror'}, {'id': 53, 'name': 'Thriller'}]",,9725,tt0082418,en,Friday the 13th Part 2,"Five years after the horrible bloodbath at Camp Crystal Lake, it seems Jason Voorhees and his demented mother are in the past. Paul opens up a new camp close to the infamous site, ignoring warnings to stay away, and a sexually-charged group of counselors follow -- including child psychologist major Ginny. But Jason has been hiding out all this time, and now he's ready for revenge.",8.710824,/3c6uMXqFXO9G5RVdiPB76IK3FYM.jpg,"[{'name': 'Paramount Pictures', 'id': 4}, {'name': 'Georgetown Productions, Inc.', 'id': 7512}]","[{'iso_3166_1': 'US', 'name': 'United States of America'}]",1981-05-01,21722776,87.0,"[{'iso_639_1': 'en', 'name': 'English'}]",Released,The body count continues...,Friday the 13th Part 2,False,6.0,321
False,"{'id': 9735, 'name': 'Friday the 13th Collection', 'poster_path': '/uobgqpLQff9WvxGKE2OSvXv1RHm.jpg', 'backdrop_path': '/c7pMKwv5NzIN6N3KM4L8fYMTtPw.jpg'}",4000000,"[{'id': 27, 'name': 'Horror'}, {'id': 53, 'name': 'Thriller'}]",,9728,tt0083972,en,Friday the 13th Part III,"An idyllic summer turns into a nightmare of unspeakable terror for yet another group of naive counselors. Ignoring Camp Crystal Lake's bloody legacy, one by one they fall victim to the maniacal Jason who stalks them at every turn.",7.99229,/5wg2NZyIhcMbIBAahBODXHyJ54S.jpg,"[{'name': 'Paramount Pictures', 'id': 4}, {'name': 'Jason Productions', 'id': 7513}]","[{'iso_3166_1': 'US', 'name': 'United States of America'}]",1982-08-13,36690067,95.0,"[{'iso_639_1': 'en', 'name': 'English'}]",Released,There's nowhere to hide. We dare you to try.,Friday the 13th Part III,False,5.7,257
False,"{'id': 9735, 'name': 'Friday the 13th Collection', 'poster_path': '/uobgqpLQff9WvxGKE2OSvXv1RHm.jpg', 'backdrop_path': '/c7pMKwv5NzIN6N3KM4L8fYMTtPw.jpg'}",2600000,"[{'id': 27, 'name': 'Horror'}, {'id': 53, 'name': 'Thriller'}]",,9730,tt0087298,en,Friday the 13th: The Final Chapter,"After the Crystal Lake Massacres, Jason is pronounced dead and taken to the hospital morgue, where he is mysteriously revived, allowing his diabolical killing spree to continue at the camp where the gruesome slaughtering began. But this time, in addition to terrified teenagers, he meets a young boy named Tommy who has a special talent for horror masks and make up, leading up to a horrifying, bloody battle! Has Jason finally met his match?",10.175913,/p5wiO9KgZH78Kvo1L6dPz8uECJ9.jpg,"[{'name': 'Paramount Pictures', 'id': 4}, {'name': 'Friday Four, Inc.', 'id': 93280}]","[{'iso_3166_1': 'US', 'name': 'United States of America'}]",1984-04-13,32980880,91.0,"[{'iso_639_1': 'en', 'name': 'English'}, {'iso_639_1': 'es', 'name': 'Español'}]",Released,"Jason's Back, and this is the one you've been screaming for.",Friday the 13th: The Final Chapter,False,5.9,241
False,"{'id': 9735, 'name': 'Friday the 13th Collection', 'poster_path': '/uobgqpLQff9WvxGKE2OSvXv1RHm.jpg', 'backdrop_path': '/c7pMKwv5NzIN6N3KM4L8fYMTtPw.jpg'}",2200000,"[{'id': 27, 'name': 'Horror'}, {'id': 53, 'name': 'Thriller'}]",,9731,tt0089173,en,Friday the 13th: A New Beginning,"Homicidal maniac Jason returns from the grave to cause more bloody mayhem. Young Tommy may have escaped from Crystal Lake, but he’s still haunted by the gruesome events that happened there. When gory murders start happening at the secluded halfway house for troubled teens where he now lives, it seems like his nightmarish nemesis, Jason, is back for more sadistic slaughters. But as things spiral out of control and the body count rises, Tommy begins to wonder if he’s become the killer he fears most.",9.094477,/aoc6F4Oif0JskHKO1tzZOaopYbF.jpg,"[{'name': 'Paramount Pictures', 'id': 4}, {'name': 'Georgetown Productions Inc.', 'id': 16779}]","[{'iso_3166_1': 'US', 'name': 'United States of America'}]",1985-03-22,21930418,92.0,"[{'iso_639_1': 'en', 'name': 'English'}]",Released,A New Beginning to the first step in terror.,Friday the 13th: A New Beginning,False,5.1,200
False,"{'id': 9735, 'name': 'Friday the 13th Collection', 'poster_path': '/uobgqpLQff9WvxGKE2OSvXv1RHm.jpg', 'backdrop_path': '/c7pMKwv5NzIN6N3KM4L8fYMTtPw.jpg'}",3000000,"[{'id': 27, 'name': 'Horror'}, {'id': 9648, 'name': 'Mystery'}, {'id': 53, 'name': 'Thriller'}]",,10225,tt0091080,en,Friday the 13th Part VI: Jason Lives,"As a child, Tommy killed mass-murderer Jason. But now, years later, he is tormented by the fear that maybe Jason isn’t really dead. Determined to finish off the infamous killer once and for all, Tommy and a friend dig up Jason’s corpse in order to cremate him. Unfortunately, things go seriously awry, and Jason is instead resurrected, sparking a new chain of ruthlessly brutal murders. Now it’s up to Tommy to stop the dark, devious and demented deaths that he unwittingly brought about.",8.122042,/le636yjPeWkC74nPDIZiQBH1CVt.jpg,"[{'name': 'Paramount Pictures', 'id': 4}]","[{'iso_3166_1': 'US', 'name': 'United States of America'}]",1986-08-01,19472057,86.0,"[{'iso_639_1': 'en', 'name': 'English'}]",Released,Kill or be killed!,Friday the 13th Part VI: Jason Lives,False,5.7,219
False,"{'id': 9735, 'name': 'Friday the 13th Collection', 'poster_path': '/uobgqpLQff9WvxGKE2OSvXv1RHm.jpg', 'backdrop_path': '/c7pMKwv5NzIN6N3KM4L8fYMTtPw.jpg'}",2800000,"[{'id': 27, 'name': 'Horror'}, {'id': 53, 'name': 'Thriller'}]",,10281,tt0095179,en,Friday the 13th Part VII: The New Blood,"Tina possesses the gift of telekinesis, allowing her to move things and see the future, using the power of her mind. But when a devious doctor tries to exploit her ability, the gift becomes a hellish curse. Tina unwittingly unchains the merciless bloodthirsty Jason Voorhees from his watery grave, igniting a bloodbath that ends in the ultimate showdown in strength of mind versus pure evil matter.",7.909022,/mt5ijxnTC5a0sS1oPD58Gt9UT5N.jpg,"[{'name': 'Paramount Pictures', 'id': 4}]","[{'iso_3166_1': 'US', 'name': 'United States of America'}]",1988-05-13,19170001,88.0,"[{'iso_639_1': 'en', 'name': 'English'}]",Released,"Jason is back, but this time someone's waiting!",Friday the 13th Part VII: The New Blood,False,5.3,196
False,"{'id': 91361, 'name': 'Halloween Collection', 'poster_path': '/2uqHV6YcD9jEL2WuJYjXiiuRDqd.jpg', 'backdrop_path': '/mmxf1sOe2T1sma0tH0TgTdcit1p.jpg'}",5000000,"[{'id': 27, 'name': 'Horror'}, {'id': 53, 'name': 'Thriller'}]",,11357,tt0095271,en,Halloween 4: The Return of Michael Myers,"The legend of that creepy masked-man, Michael Myers, comes to life once again in this fourth installment of the successful horror franchise. This time, it's Michael's niece, Jamie, who can't seem to escape her crazy uncle. With Michael on the loose, Jamie enlists the help of good old Dr. Loomis to stop the murderer. This time, though, there seems to be no end to Michael's madness.",6.199806,/oudmrV1WljSJMpgwq6K4VzbIMMK.jpg,"[{'name': 'Dimension Films', 'id': 7405}]","[{'iso_3166_1': 'US', 'name': 'United States of America'}]",1988-10-21,17768757,88.0,"[{'iso_639_1': 'en', 'name': 'English'}]",Released,Horror has returned to Haddonfield.,Halloween 4: The Return of Michael Myers,False,5.9,212
