adult,belongs_to_collection,budget,genres,homepage,id,imdb_id,original_language,original_title,overview,popularity,poster_path,production_companies,production_countries,release_date,revenue,runtime,spoken_languages,status,tagline,title,video,vote_average,vote_count
False,,0,"[{'id': 18, 'name': 'Drama'}, {'id': 53, 'name': 'Thriller'}]",,27978,tt0041495,en,The Woman on Pier 13,Communists blackmail a shipping executive into spying for them.,0.768195,/yQCTEk0kzoS9dyhnKbmv33XlVCc.jpg,"[{'name': 'RKO Radio Pictures', 'id': 6}]","[{'iso_3166_1': 'US', 'name': 'United States of America'}]",1949-10-08,0,73.0,"[{'iso_639_1': 'en', 'name': 'English'}]",Released,Her beauty served a mob of terror whose one mission is to destroy!,The Woman on Pier 13,False,5.0,5
False,"{'id': 114993, 'name': 'Unstable Fables Collection', 'poster_path': None, 'backdrop_path': None}",0,"[{'id': 10751, 'name': 'Family'}, {'id': 16, 'name': 'Animation'}]",,15898,tt1086797,en,Unstable Fables: 3 Pigs & a Baby,"When the three pigs find a tiny wolf cub on their doorstep, they decide to raise him as their own, unaware that they've played right into the plan of a special-ops team of wolves. As the newest addition to their family, Lucky grows into his teens not knowing his history, his role in the wolves' plan or the difficult choice he will have to make about the family that raised him.",1.798472,/AfoYTdNMhfEyc2fkDk1rLIa4GAN.jpg,[],"[{'iso_3166_1': 'US', 'name': 'United States of America'}]",2008-01-01,0,78.0,"[{'iso_639_1': 'en', 'name': 'English'}]",Released,,Unstable Fables: 3 Pigs & a Baby,False,5.4,8
False,,0,"[{'id': 10752, 'name': 'War'}, {'id': 18, 'name': 'Drama'}, {'id': 53, 'name': 'Thriller'}]",,82181,tt0050500,en,Hellcats of the Navy,"\"Future \"\"first couple\"\" Ronald Reagan and Nancy Davis made their only joint film appearance in Hellcats of the Navy. Ronnie plays Casey Abbott",commander of a WW2 submarine,while Nancy portrays navy nurse Helen Blair,Abbott's off-and-on girlfriend. During a delicate mission in which his sub is ordered to retrieve a revolutionary new Japanese mine,"Abbott is forced to leave frogman Wes Barton (Harry Lauter) behind to save the rest of his crew. But Abbott's second-in-command Don Landon (Eduard Franz) is convincing that Abbott's sacrifice of Barton was due to the fact that the dead man had been amorously pursuing Helen.\"",0.864578,/YTGzdpU3U2kfCAcjStP5vRPRUc.jpg,"[{'name': 'Columbia Pictures', 'id': 5}, {'name': 'Morningside Productions', 'id': 5040}]","[{'iso_3166_1': 'US', 'name': 'United States of America'}]",1957-05-01,0,82.0,"[{'iso_639_1': 'en', 'name': 'English'}]",Released,Down . . . Down . . . Down . . . into enemy waters with the fightin' hellcats of the U.S. sub pack !
False,,0,"[{'id': 28, 'name': 'Action'}, {'id': 18, 'name': 'Drama'}, {'id': 10749, 'name': 'Romance'}]",,38556,tt0086461,en,Tough Enough,"\"An aspiring country/western singer, whose money is disappearing faster than his career opportunities, enters a \"\"Tough Man\"\" amateur boxing contest to earn some cash to pay his bills. Amazingly enough",he wins it,and is picked to go onto the national finals. He's torn between his first love,music,and the glitz,"glamor and money of the \"\"Tough Man\"\" world.\"",0.413716,/iDbwIZMjh9bmfTI36yb7VZH29dX.jpg,"[{'name': 'American Cinema Productions', 'id': 4112}]","[{'iso_3166_1': 'US', 'name': 'United States of America'}]",1983-05-20,0,106.0,"[{'iso_639_1': 'en', 'name': 'English'}]",Released
False,,0,"[{'id': 18, 'name': 'Drama'}, {'id': 35, 'name': 'Comedy'}, {'id': 10749, 'name': 'Romance'}, {'id': 10769, 'name': 'Foreign'}]",,44989,tt1178654,es,Los Paranoicos,"\"Luciano works in birthday parties and writes his first feature when friend Manuel returns from Spain to repeat his TV show, \"\"The Paranoids\"\"",together with his girl Sofia. Manuel is everything he is not and his trying to be helpful in his career and with women,only worsens the conflict. When Manuel leaves Sofia with Luciano for two days,she is seduced by the qualities Manuel rejects in his friend as weaknesses. Sofia changes. Luciano also,"but only at the last moment he can overcome the fears he has been cultivating his whole life.\"",0.151925,/zJlRyF5Y4tFMjaj3Wr3o6BBtSXj.jpg,[],"[{'iso_3166_1': 'AR', 'name': 'Argentina'}]",2008-10-23,0,98.0,"[{'iso_639_1': 'es', 'name': 'Español'}]",Released,
False,,0,"[{'id': 10749, 'name': 'Romance'}, {'id': 35, 'name': 'Comedy'}]",,46869,tt0384037,en,Love on the Side,"\"Small town waitress Eve Stuckley is stuck. She has spent years pining for testosterone saturate local hunk Jeff Sweeney and yearns to escape from the Hog-Chow Diner she runs. Just when Eve finally decides to pursue her man, drop dead gorgeous Linda Avery blows into town on the hottest day of the year. The heat wave is nothing in comparison with the heat that's on as Jeff and Eve's dimwitted brother Chuck decide to face off for Linda's affections. It's a priceless contest: Linda wants Eve. Eve's confidante Alma Kerns is a sex expert trained by mortician beau Red Bishop. She encourages Eve to use Linda's interest in her to win Jeff's affection but the situation becomes even more complicated when Linda advises Jeff she prefers Eve. Now determined to \"\"save\"\" Eve",the narcissistically injured Jeff elicits Chuck's aid but Chuck,thinking it's part of the game,refuses to believe him. Ultimately,"Jeff and Linda square off over Eve's future...\"",0.607125,/sS2ceJT9ImxkwRqv6YCaUsWjcUI.jpg,[],"[{'iso_3166_1': 'US', 'name': 'United States of America'}, {'iso_3166_1': 'CA', 'name': 'Canada'}]",2004-09-30,0,102.0,"[{'iso_639_1': 'en', 'name': 'English'}]",Rumored,A small-town waitress vies with a sassy city slicker for the attention of the town's most eligible bachelor.
False,,0,"[{'id': 35, 'name': 'Comedy'}]",,44023,tt0054049,en,Make Mine Mink,"\"In a mansion block in Knightsbridge, a gang of middle-aged biddies decide to brighten up \"\"the dullness of the tea time of life\"\" by staging a series of robberies on furriers",then donating the proceeds to charitable concerns. Terry Thomas as a retired army officer leads the gang,which includes Athene Seyler and Hattie Jacques,on a series of capers that nearly go awry when their maid,Billie Whitelaw,an ex-con and also a resident of the block,"falls for a police officer.\"",0.555422,/sEkbKbiCZHdAbkUATAmk76096hY.jpg,"[{'name': 'The Rank Organisation', 'id': 364}]","[{'iso_3166_1': 'GB', 'name': 'United Kingdom'}]",1960-08-09,0,101.0,"[{'iso_639_1': 'en', 'name': 'English'}]"
False,,1000000,"[{'id': 27, 'name': 'Horror'}, {'id': 9648, 'name': 'Mystery'}, {'id': 53, 'name': 'Thriller'}]",,60965,tt1190074,en,The Legend of Bloody Mary,"\"Ryan has been plagued with nightmares since the night his sister Amy went missing 8 years earlier after playing the game \"\"Bloody Mary.\"\" Amy had stumbled onto a website on the Internet (www.marked4mary.com) about a witch called Bloody Mary and a game to summon her evil spirit. Now a senior in college",Ryan is reaching a mental breaking point from the years of stress and guilt from his sisters disappearance. His girlfriend Rachel frustrated herself at Ryan's emotional distance and self pity,calls for help to a former professor of Ryan's,Father O'Neal. Father O'Neal is both a priest and a archaeologist who decides to help Ryan end his tormenting grief by using his detective skills and wit to figure out what exactly happened to Ryan's sister,"and uncover the truth to the Legend of Bloody Mary\"",1.076888,/x1kIVaqFOZkTV9zlHIUYsVnqzn8.jpg,"[{'name': 'Lionsgate', 'id': 1632}, {'name': 'mk4 productions', 'id': 6872}, {'name': 'vision one pictures', 'id': 6873}, {'name': 'grindstone', 'id': 6874}, {'name': 'leomark studios', 'id': 6875}, {'name': 'red cam studios', 'id': 6876}]",[],2008-12-09,0,93.0,"[{'iso_639_1': 'en', 'name': 'English'}]",Released,Her vision... will be your last
False,,0,"[{'id': 18, 'name': 'Drama'}]",,23525,tt0050283,en,The D.I.,"\"Gunnery Sergeant Jim Moore is one of the toughest Drill Instructors on Parris Island. But he's got a thorn in his side: Pvt. Owens, who always seems to foul up when the pressure's on. Convinced that \"\"there's a man underneath that baby powder","\"\" Sgt. Moore drives Owens to the point of desertion. Making things worse",Capt. Anderson has given Moore three days to make the scared private into Marine material,"\"\"or I'll personally cut the lace off his panties and ship him out!\"\" Adding to the pressure","Moore also juggles a budding romance with a shop girl.\"",0.765507,/oDethjrKIiwysFavZG6uqYoS4O2.jpg,"[{'name': 'Mark VII Ltd.', 'id': 13700}]","[{'iso_3166_1': 'US', 'name': 'United States of America'}]",1957-05-30,0,106.0,"[{'iso_639_1': 'en', 'name': 'English'}]",Released,Give him 12 weeks. He'll give you a Few Good Men.
False,"{'id': 261526, 'name': 'Slap Shot Collection', 'poster_path': '/kFZUWeX5oRJ0qSwj8fUlC7sWOxK.jpg', 'backdrop_path': '/Abqfc8k2Pzf2TVEiDbu5SECqUUJ.jpg'}",4500000,"[{'id': 28, 'name': 'Action'}, {'id': 12, 'name': 'Adventure'}, {'id': 35, 'name': 'Comedy'}]",,14053,tt1245734,en,Slap Shot 3: The Junior League,Get ready for a rough-and-tumble comedy that knows how to kick some serious puck!,1.158017,/ot55HcXeI9vvTJ73JuqxRk3VMTN.jpg,"[{'name': 'Universal Studios Home Entertainment Family Productions', 'id': 3436}]","[{'iso_3166_1': 'CA', 'name': 'Canada'}]",2008-12-17,0,90.0,"[{'iso_639_1': 'en', 'name': 'English'}]",Released,,Slap Shot 3: The Junior League,False,4.2,7
False,,0,"[{'id': 10769, 'name': 'Foreign'}, {'id': 18, 'name': 'Drama'}, {'id': 35, 'name': 'Comedy'}]",,127614,tt2131541,en,Kohta 18,"Almost 18 is a charming and unaffected film about five 17-year-old guys from Helsinki in 2010. Karri, Peter, André, Akseli and Joni dream, party, love and boast like only teenage males can.",0.845036,/dWEBjMLmfGBUSByC3ev5jp194z7.jpg,"[{'name': 'Huh huh -Filmi Oy', 'id': 18444}]","[{'iso_3166_1': 'FI', 'name': 'Finland'}]",2012-03-09,0,112.0,"[{'iso_639_1': 'fi', 'name': 'suomi'}, {'iso_639_1': 'sv', 'name': 'svenska'}]",Released,,Almost 18,False,7.2,6
False,,0,"[{'id': 28, 'name': 'Action'}, {'id': 80, 'name': 'Crime'}, {'id': 18, 'name': 'Drama'}]",,281298,tt3419894,ko,신의 한 수,"\"Professional baduk (go) player Tae-seok loses a high-stakes game to infamous underground gambler Sal-soo, and ends up framed for the murder of his own brother and locked up in prison. He vows revenge and trains ferociously. After serving his seven-year sentence, he gets in touch with his brother's former associate \"\"Tricks","\"\" hermit and blind master player \"\"The Lord","\"\" and skillful junkyard owner Mok-su; together",they begin formulating a plan to get back at Sal-soo and his men. Tae-seok slowly penetrates Sal-soo's inner circle and his gambling joint,"and eliminates Sal-soo's men one by one. But Sal-soo discovers Tae-seok's true identity and engages him in one final game that will seal the fates of the two men involved.\"",1.71351,/w61fUYAVjm4ipHQvXJEEmza7w6N.jpg,[],"[{'iso_3166_1': 'KR', 'name': 'South Korea'}]",2014-07-03,0,118.0,"[{'iso_639_1': 'ko', 'name': '한국어/조선말'}]",Released,
False,,0,[],,171908,tt0062117,en,The Perils of Pauline,"\"This version of the Perils of Pauline (recognizable from the others by it's song \"\"Where are you my pretty Pauline...I love you my pretty Pauline) follows the story of Pauline from her being found on the doorstep of the orphanage to being a tutor to a crazy 12 year old prince in India who wants to make her the start of his harem",on to being frozen in a block of ice,traveling through the jungle where both a gorilla and a big game hunter fall in love with her,almost getting married,various other hijinks,and finally at the end in a boat with the love of her life. Throughout it all she is constantly in peril from one thing or another,crocodiles,hippos,car accidents,drowning,"you name it. Even at the very end the crazed big game hunter is in a scuba suit sneaking up under the boat and drilling a hole in its hull.\"",0.462405,/rdpy2zwAmAnZvO79biVNWY8Ysuq.jpg,[],[]
False,,0,"[{'id': 10749, 'name': 'Romance'}, {'id': 18, 'name': 'Drama'}]",,48798,tt1686782,en,Love and Distrust,"\"This collection of five short films artfully portrays desire's ability to both empower and destroy those who encounter it. In \"\"The Summer House","\"\" sultry teen Jane (Talulah Riley) is courted by a former beau",Richard (Robert Pattinson),during the chaotic summer of 1969. Other tales revolve around a waitress (Amy Adams) desperate to rescue her young daughter,"and a techie (James Franco) who uses gadgets to keep emotions at bay.\"",1.213417,/it22C6LNuwd4ktP8oDJECdJxxS3.jpg,[],[],2010-08-16,0,93.0,"[{'iso_639_1': 'en', 'name': 'English'}]",Released,
False,,0,"[{'id': 37, 'name': 'Western'}, {'id': 35, 'name': 'Comedy'}]",,104638,tt0115563,es,"Aquí llega Condemor, el pecador de la pradera","\"The film follows the adventures of a French aristocrat, the \"\"Condemor\"\"and Lucas",his faithful Mexican servant,lost in the desert of Far West,looking for ways to return to Paris. Following an unintentional demonstration of courage,"\"\"Condemor\"\" is appointed sheriff very much against his will and forced to chase the \"\"One- Eyed\"\" and solve the mystery of the whereabouts of Chico's father and also the location of the legendary El Dorado",the fabulous gold mine. The plot thickens when Condemor platonic love,"the \"\"Bella Jolly\"\" saloon singer","is also kidnapped by the evil ...\"",0.374,/5iIuCFjvqX49tj6lM0WlmK2hHpL.jpg,"[{'name': 'Producciones A.S.H. Films S.A.', 'id': 8011}, {'name': 'Canal+ Espana', 'id': 12625}, {'name': 'Antena 3 Televisión', 'id': 31125}]","[{'iso_3166_1': 'ES', 'name': 'Spain'}]",1996-06-27,1705030,90.0
False,,0,"[{'id': 35, 'name': 'Comedy'}]",,135696,tt0425758,es,El asombroso mundo de Borjamari y Pocholo,"\"In the 80's, Pocholo and Borjamari are kings in the disco \"\"Aguacates\"\". Twenty years later",nothing has changed. Only now,"the two brothers are nothing in \"\"Aguacates\"\" disco. Now they are object of derision and mockery. His cousin Pelayo",who used to laugh and abuse in adolescence,"reappears in their lives and come to the old cruelties and Pocholo Borjamari announcing that Mecano will meet in a surprise concert...\"",0.793589,/2sCTBqQ3krHnKSSt6KSBJj0Jl9.jpg,"[{'name': 'Telecinco', 'id': 1182}, {'name': 'Estudios Picasso', 'id': 2029}, {'name': 'Amiguetes Entertainment', 'id': 7864}, {'name': 'Canal+ España', 'id': 9335}, {'name': 'Instituto de la Cinematografía y de las Artes Audiovisuales (ICAA)', 'id': 9974}, {'name': 'Apache Films', 'id': 62340}]","[{'iso_3166_1': 'ES', 'name': 'Spain'}]",2004-12-03,3367646,90.0,"[{'iso_639_1': 'es', 'name': 'Español'}]",Released,
False,,0,"[{'id': 28, 'name': 'Action'}, {'id': 12, 'name': 'Adventure'}, {'id': 878, 'name': 'Science Fiction'}]",,59722,tt1846444,en,2012: Ice Age,Tells the story of a man trying to get his family to safety after a glacier causes havoc in New York.,7.504259,/o1qvsFNVMfzPvfzCUCOeaGiQhOo.jpg,[],"[{'iso_3166_1': 'US', 'name': 'United States of America'}]",2011-06-27,0,91.0,"[{'iso_639_1': 'en', 'name': 'English'}]",Released,A World Frozen Over ... A Family Torn Apart.,2012: Ice Age,False,3.8,84
False,,0,"[{'id': 18, 'name': 'Drama'}, {'id': 35, 'name': 'Comedy'}, {'id': 10749, 'name': 'Romance'}]",,194407,tt0026919,en,Red Salute,"\"The rebellious daughter of an army general gets involved with a Communist agitator, mainly to annoy her father. He arranges to have her kidnapped and taken to Mexico--hoping that she will forget her \"\"Red\"\" boyfriend--by a young",handsome soldier named Jeff who,while somewhat of a goof-up,"the general believes is still better for her.\"",0.98586,/2BCsYgyTwpvOgMzt9ogZJX5W98h.jpg,"[{'name': 'Edward Small Productions', 'id': 13479}, {'name': 'Reliance Pictures', 'id': 72613}]","[{'iso_3166_1': 'US', 'name': 'United States of America'}]",1935-09-12,0,80.0,"[{'iso_639_1': 'en', 'name': 'English'}]",Released,True! Timely! Terrific! See the effect RED teachings have on the youth of today!,Red Salute
False,,0,"[{'id': 99, 'name': 'Documentary'}]",,154622,tt0179624,en,100 Years at the Movies,Commemorates the centennial of American movies with a montage of clips and music scores from the most important movies of the century.,0.384209,/nNPlHZmT5cmErOyuBpfLziANDQm.jpg,"[{'name': 'Turner Classic Movies (TCM)', 'id': 10915}]","[{'iso_3166_1': 'US', 'name': 'United States of America'}]",1994-12-31,0,9.0,[],Released,,100 Years at the Movies,False,8.0,6
False,,0,"[{'id': 9648, 'name': 'Mystery'}, {'id': 35, 'name': 'Comedy'}, {'id': 80, 'name': 'Crime'}]",,52035,tt0007108,en,The Mystery of the Leaping Fish,"\"Coke Ennyday, the scientific detective, divides his own time in periods for \"\"Sleep\"\"","\"\"Eat\"\"","\"\"Dope\"\" and \"\"Drink\"\". In fact he's used to overcome every situation with drugs: consuming it to increase his energies or injecting it in his opponents to KO them. To help the police he discovers a contraband of opium (which he eagerly tastes) transported with \"\"Leaping Fishes\"\"","and the blackmail of a mysterious man who wants to marry the \"\"fish blower\"\" girl. Will Coke be able to free the girl ?\"",0.436214,/pwhfQ6fRPLpmLWUsEnp48zcIUgN.jpg,"[{'name': 'Triangle Film Corporation', 'id': 1307}]","[{'iso_3166_1': 'US', 'name': 'United States of America'}]",1916-06-11,0,25.0,"[{'iso_639_1': 'xx', 'name': 'No Language'}]",Released,,The Mystery of the Leaping Fish
False,,0,[],,162864,tt2061818,en,The 3 Rs,"One-minute short film, used as a trailer for the Vienna International Film Festival.",1.557542,/dD8CKimUOL6SqMRPcPDpzORnndU.jpg,"[{'name': 'Viennale', 'id': 62009}]","[{'iso_3166_1': 'US', 'name': 'United States of America'}, {'iso_3166_1': 'AT', 'name': 'Austria'}]",2011-09-21,0,1.0,"[{'iso_639_1': 'en', 'name': 'English'}]",Released,,The 3 Rs,False,5.8,13
False,,0,"[{'id': 16, 'name': 'Animation'}, {'id': 18, 'name': 'Drama'}]",,73714,tt1118665,ja,カフカ 田舎医者,"\"A hapless country doctor describes with breathless urgency a night-time summons to attend a young patient. Events soon take on a surreal aspect as \"\"unearthly horses\"\" transport him instantaneously to the bedside. The doctor",preoccupied with personal distractions and grievances against those he is employed to care for,fails to find what is revealed to be a vile,fatal wound. He is humiliated by the villagers,"who are \"\"always expecting the impossible from the doctor","\"\" and doomed to an endless return trip","losing everything.\"",1.705657,/kEXBgNGFU7lW4myBqdQPqEu8g9P.jpg,[],"[{'iso_3166_1': 'JP', 'name': 'Japan'}]",2007-11-17,0,21.0,"[{'iso_639_1': 'ja', 'name': '日本語'}]"
False,,0,"[{'id': 35, 'name': 'Comedy'}]",,60233,tt2009538,en,Norm MacDonald: Me Doing Standup,"\"\"\"Norm Macdonald: Me Doing Standup” stand-up special is produced by Irwin Entertainment and executive produced by John Irwin",Norm Macdonald and Marc Gurvitz. Lori Jo Hoekstra serves as producer. Jonas Larsen is the executive in charge of production for COMEDY CENTRAL. A staple in the comedy world,"Macdonald is best known for his offbeat delivery of the news as a Weekend Update anchor on \"\"Saturday Night Live.\"\" Macdonald joined the cast of \"\"SNL\"\" in 1993 and remained on the show for five seasons where his impressions of Larry King",Burt Reynolds,David Letterman and Bob Dole,among others,"are still talked about today.\"",0.298558,/cnhWmcfhsqWJLQCmgEKVZHnBHpf.jpg,[],"[{'iso_3166_1': 'US', 'name': 'United States of America'}]",2011-03-01,0,61.0,"[{'iso_639_1': 'en', 'name': 'English'}]"
False,,0,"[{'id': 35, 'name': 'Comedy'}]",,45221,tt0116069,en,"Delphine 1, Yvan 0","C'est une histoire d'amour banale présentée comme un match de foot ordinaire. Ce sont donc Thierry Roland et Jean-Michel Larqué qui commentent, avec leurs mots (d'amour) et leurs noms (d'oiseaux), la première année de vie en couple de Delphine et Yvan, filmés pas à pas, dans leurs ébats et leurs éclats.",0.349689,/urhExTHFeQCE5bEd3yZfbGfxXtV.jpg,[],[],1996-06-19,0,91.0,[],Released,,"Delphine 1, Yvan 0",False,6.0,6
False,"{'id': 260586, 'name': 'Le Cœur des Hommes', 'poster_path': '/1VCxR0XUU4mhKUxLWzTaYxPMDR4.jpg', 'backdrop_path': '/fNWH0gUaSKQ4ONsFfZTArR14KXc.jpg'}",0,"[{'id': 35, 'name': 'Comedy'}, {'id': 10749, 'name': 'Romance'}]",,13734,tt0887887,fr,Le cœur des hommes 2,"Alex, Antoine, Jeff and Manu. Four friends, four years later. Their relationships, friendship, shared secrets, feelings of guilt and their desire to change and improve.",1.440118,/7sHc4MsgZBqbov5wLU9Oo7lZldo.jpg,[],"[{'iso_3166_1': 'FR', 'name': 'France'}]",2007-10-24,0,111.0,"[{'iso_639_1': 'fr', 'name': 'Français'}]",Released,,Frenchmen 2,False,6.1,24
False,,0,"[{'id': 18, 'name': 'Drama'}]",,269714,tt3136752,fr,Le Dernier diamant,"\"Simon, a burglar on probation, agreed to go on the biggest shot of his life: The flight of the \"\"Florentine\"\"",a mythical diamond set auction by its owners. To succeed,he must approach Julia,expert diamond for sale which is a considerable personal and family issue. Beyond a jigsaw particularly daring,"Julia Simon will lead to a destiny she could not imagine.\"",1.732667,/nT9JFpsCEGSkJzu677iuiaEEqWj.jpg,"[{'name': 'Canal+', 'id': 5358}, {'name': 'Belgacom', 'id': 8009}, {'name': 'Ciné+', 'id': 10611}, {'name': 'Scope Pictures', 'id': 11199}, {'name': 'Film Fund Luxembourg', 'id': 11776}, {'name': 'Bidibul Productions', 'id': 20338}, {'name': 'Vertigo', 'id': 23084}, {'name': 'Backup Media', 'id': 26590}, {'name': 'B MediaExport', 'id': 26594}, {'name': 'CN3 Productions', 'id': 32667}, {'name': 'Indéfilms 2', 'id': 32668}]","[{'iso_3166_1': 'BE', 'name': 'Belgium'}, {'iso_3166_1': 'FR', 'name': 'France'}, {'iso_3166_1': 'LU', 'name': 'Luxembourg'}]",2014-04-30,0,108.0,"[{'iso_639_1': 'fr', 'name': 'Français'}]",Released,
False,,0,"[{'id': 14, 'name': 'Fantasy'}, {'id': 35, 'name': 'Comedy'}, {'id': 12, 'name': 'Adventure'}]",,20220,tt0098961,fr,Les 1001 nuits,"Sheherazade (Catherine Zeta-Jones) has been married to a ruler (Thierry Lhermitte) who wants many wives, but only one at a time. Consequently, as soon as he has bedded them, he has them put to death. In most retellings, the girl staves off this unfortunate conclusion by putting off the connubial event for a thousand and one nights, telling irresistable stories instead. In this one, she gets hold of a magic lamp.",1.22292,/oKQG8sYdRgHybEDjMeBHMG0KlZ3.jpg,"[{'name': 'Telepool', 'id': 823}, {'name': 'Cinémax', 'id': 20576}, {'name': 'Club Investissement Média', 'id': 22494}, {'name': 'Rai 2', 'id': 23119}, {'name': 'Télémax', 'id': 25826}, {'name': 'Antenne-2 France', 'id': 25827}]","[{'iso_3166_1': 'DE', 'name': 'Germany'}, {'iso_3166_1': 'FR', 'name': 'France'}, {'iso_3166_1': 'IT', 'name': 'Italy'}]",1990-04-11,0,98.0,"[{'iso_639_1': 'fr', 'name': 'Français'}]",Released,Scheherazade's story will be told once again.,1001 Nights,False,4.9,7
False,,0,"[{'id': 18, 'name': 'Drama'}]",,269070,tt0058719,en,Verspätung in Marienborn,"Roaring across the danger zone of europe...A sealed international express, with a human cargo that can explode a continent!",0.016498,/9GvSIFDhuoYyfKqgobdUTvBfqX.jpg,[],"[{'iso_3166_1': 'FR', 'name': 'France'}, {'iso_3166_1': 'DE', 'name': 'Germany'}, {'iso_3166_1': 'IT', 'name': 'Italy'}]",1963-06-26,0,0.0,"[{'iso_639_1': 'en', 'name': 'English'}, {'iso_639_1': 'de', 'name': 'Deutsch'}, {'iso_639_1': 'ru', 'name': 'Pусский'}]",Released,,Stop Train 349,False,0.0,0
False,,0,[],,74208,tt0028806,en,Double Or Nothing,"\"In this lively musical, an eccentric philanthropist's will dictates that four people receive $5,000 with the stipulation that the first one who can double the amount-- without dishonesty-- will win a cool million. Hindering the four are the avaricious relatives of the late millionaire. Songs include: \"\"It's On",It's Off,"\"\" \"\"Double or Nothing","\"\" \"\"Listen My Children","\"\" \"\"Smarty","\"\" \"\"The Moon Got in My Eyes\"\" and \"\"After You.\"\"\"",0.06509,/xkaotbRgiF6UBxSR5QWGuSYv9bI.jpg,[],[],1937-09-17,0,91.0,[],Released
False,,0,"[{'id': 878, 'name': 'Science Fiction'}, {'id': 28, 'name': 'Action'}]",,83288,tt0113220,en,Virtual Combat,"\"This lively low-budget action movie is packed with martial arts, sexy sirens, and a sci-fi plot involving computers and virtual reality images that become real. The tale centers on two Nevada border officers, Dave Quarry (Don \"\"The Dragon\"\" Wilson) and John (Ken McLeod)",who amuse themselves off duty by honing their kick-boxing skills via virtual reality combat. Elsewhere,a computer tycoon prepares to market his company's latest invention,"a combination of DNA and virtual reality that creates beings and creatures who look and feel real.\"",0.326423,/9mVinifa5kidXEj3TukAftxzNfl.jpg,"[{'name': 'Amritraj / Stevens Entertainment', 'id': 40644}]",[],1995-07-11,0,97.0,"[{'iso_639_1': 'en', 'name': 'English'}]",Released,,Virtual Combat
False,,0,"[{'id': 10770, 'name': 'TV Movie'}, {'id': 18, 'name': 'Drama'}, {'id': 878, 'name': 'Science Fiction'}]",,321130,tt1808482,ru,Солярис,"\"Kris Kelvin joins the space station orbiting the planet Solaris, only to find its two crew members plagued by \"\"phantoms","\"\" creations of Solaris. Kelvin is soon confronted with his own phantom","taking the shape of his dead wife Hari.\"",0.250398,/rgl8NcT3ikRc3P63JtOCjNh2cG6.jpg,"\"[{'name': 'Studio \"\"Orlenok\"\"",Central Television USSR','id': 56270},{'name': 'Iz Sobraniya Gosteleradio',"'id': 56271}]\"","[{'iso_3166_1': 'RU', 'name': 'Russia'}]",1968-10-08,0,142.0,"[{'iso_639_1': 'ru', 'name': 'Pусский'}]"
