adult,belongs_to_collection,budget,genres,homepage,id,imdb_id,original_language,original_title,overview,popularity,poster_path,production_companies,production_countries,release_date,revenue,runtime,spoken_languages,status,tagline,title,video,vote_average,vote_count
False,,0,"[{'id': 10751, 'name': 'Family'}, {'id': 14, 'name': 'Fantasy'}, {'id': 10402, 'name': 'Music'}]",,33743,tt0045464,en,"The 5,000 Fingers of Dr. T.","Young Bart Collins lives with his widowed mother Heloise. The major blight on Bart's existence is the hated piano lessons he is forced to endure under the tutelage of the autocratic Dr. Terwilliker. Bart feels that his mother has fallen under Terwilliker's sinister influence, and gripes to visiting plumber August Zabladowski, without much result. While grimly hammering away at his lessons, Bart dozes off and enters a fantastical musical dream.",3.52006,/4aR0BbmSzN1RtdeSvXR26EAdByE.jpg,"[{'name': 'Columbia Pictures Corporation', 'id': 441}, {'name': 'Stanley Kramer Productions', 'id': 893}]","[{'iso_3166_1': 'US', 'name': 'United States of America'}]",1953-07-01,0,89.0,"[{'iso_639_1': 'en', 'name': 'English'}]",Released,The Wonder Musical of the Future!,"The 5,000 Fingers of Dr. T.",False,6.7,12
False,,0,"[{'id': 99, 'name': 'Documentary'}, {'id': 10402, 'name': 'Music'}, {'id': 10769, 'name': 'Foreign'}]",,115810,tt0260775,en,Calle 54,A film featuring performances of several stars of the Latin Jazz music scene.,0.50905,/xXgDXQLulUGxmjPPAS5MnpIppcx.jpg,[],"[{'iso_3166_1': 'ES', 'name': 'Spain'}, {'iso_3166_1': 'IT', 'name': 'Italy'}, {'iso_3166_1': 'FR', 'name': 'France'}, {'iso_3166_1': 'MX', 'name': 'Mexico'}, {'iso_3166_1': 'BE', 'name': 'Belgium'}]",2000-10-06,0,105.0,"[{'iso_639_1': 'es', 'name': 'Español'}, {'iso_639_1': 'fr', 'name': 'Français'}, {'iso_639_1': 'en', 'name': 'English'}]",Released,,Calle 54,False,6.0,6
False,,0,"[{'id': 35, 'name': 'Comedy'}]",http://www.sordidlives-themovie.com/,19094,tt0204640,en,Sordid Lives,"\"\"\"Sordid Lives\"\" is about a family in a small Texas town preparing for the funeral of the mother. Among the characters are the grandson trying to find his identity in West Hollywood",the son who has spent the past twenty-three years dressed as Tammy Wynette,the sister and her best friend (who live in delightfully kitschy homes),"and the two daughters (one strait-laced and one quite a bit looser).\"",1.650666,/nClQ1ZH0Tdj7XutwrdHhasdg7do.jpg,"[{'name': 'Daly-Harris Productions', 'id': 7069}, {'name': 'Davis Entertainment Classics', 'id': 7070}, {'name': 'Sordid Lives LLC', 'id': 7071}]","[{'iso_3166_1': 'US', 'name': 'United States of America'}]",2001-05-11,1079726,111.0,"[{'iso_639_1': 'en', 'name': 'English'}]",Released,A black comedy about white trash.,Sordid Lives
False,,0,"[{'id': 35, 'name': 'Comedy'}, {'id': 10749, 'name': 'Romance'}]",,49453,tt0206742,en,Fast Food Fast Women,"\"How important is the truth when falling in love? Bella is a Manhattan café waitress, about to turn 35, stuck in a long-term affair going nowhere. Paul is a widower, facing old age alone. Bella's mother sets her up with Bruno, a novelist/cabbie who likes to bed-hop and whose ex-wife expects their two children to stay with him for awhile. While Bruno learns some maturity from his young daughter, Paul answers a personals ad placed by a \"\"widow","60.\"\" The two couples - along with one of Paul's older pals and a Jungian stripper - sort out how to initiate a relationship these days",what to do when someone you like disappoints you,"and when to tell the truth.\"",1.166622,/o1ISZvJJeNUKNwhUC4Y58D8zAWq.jpg,[],"[{'iso_3166_1': 'FR', 'name': 'France'}, {'iso_3166_1': 'IT', 'name': 'Italy'}, {'iso_3166_1': 'US', 'name': 'United States of America'}]",2000-05-15,0,95.0,"[{'iso_639_1': 'en', 'name': 'English'}]",Rumored,,Fast Food Fast Women
False,,0,"[{'id': 35, 'name': 'Comedy'}, {'id': 10749, 'name': 'Romance'}]",,26255,tt0102343,en,Love Potion No. 9,"Unlucky in love, chemist Paul Matthews visits gypsy Madame Rosa for help. Quickly realizing he is a hopeless nerd, she gifts him with Love Potion No. 8, which makes anyone who wears it irresistible to the opposite sex for four hours. Paul and animal psychologist coworker Diane Farrow decide to test it on themselves. The awkward pair suddenly find themselves alluring to anyone they approach, but soon realize they are most attracted to each other.",8.358541,/vSj6zbuzAptIIMvoD1Saqgn9J31.jpg,"[{'name': 'Twentieth Century Fox Film Corporation', 'id': 306}, {'name': 'Penta Pictures', 'id': 11018}]","[{'iso_3166_1': 'US', 'name': 'United States of America'}]",1992-11-13,754935,97.0,"[{'iso_639_1': 'en', 'name': 'English'}]",Released,Imagine if sex appeal came in a bottle.,Love Potion No. 9,False,5.4,67
False,,80000000,"[{'id': 28, 'name': 'Action'}, {'id': 35, 'name': 'Comedy'}, {'id': 878, 'name': 'Science Fiction'}]",,9397,tt0251075,en,Evolution,"\"A comedy that follows the chaos that ensues when a meteor hits the Earth carrying alien life forms that give new meaning to the term \"\"survival of the fittest.\"\" David Duchovny",Orlando Jones,Seann William Scott,"and Julianne Moore are the only people standing between the aliens and world domination... which could be bad news for the Earth.\"",5.395127,/zGwNEPgfCXthetspyTHwvTEbfJG.jpg,"[{'name': 'DreamWorks SKG', 'id': 27}, {'name': 'Columbia Pictures Corporation', 'id': 441}, {'name': 'Montecito Picture Company, The', 'id': 4607}]","[{'iso_3166_1': 'US', 'name': 'United States of America'}]",2001-06-08,98376292,101.0,"[{'iso_639_1': 'en', 'name': 'English'}]",Released,Coming to wipe that silly smile off your planet.,Evolution
False,,18000000,"[{'id': 10752, 'name': 'War'}, {'id': 35, 'name': 'Comedy'}, {'id': 18, 'name': 'Drama'}]",,10364,tt0065528,en,Catch-22,"\"A bombardier in World War II tries desperately to escape the insanity of the war. However, sometimes insanity is the only sane way to cope with a crazy situation. Catch-22 is a parody of a \"\"military mentality\"\" and of a bureaucratic society in general.\"",4.984905,/tIg28QBu0vmOexZiVOv2vfrhHmk.jpg,"[{'name': 'Paramount Pictures', 'id': 4}, {'name': 'Filmways Productions', 'id': 73862}]","[{'iso_3166_1': 'US', 'name': 'United States of America'}]",1970-06-24,24911670,121.0,"[{'iso_639_1': 'en', 'name': 'English'}, {'iso_639_1': 'fr', 'name': 'Français'}, {'iso_639_1': 'it', 'name': 'Italiano'}]",Released,,Catch-22,False,6.7,73
False,,0,[],,126881,tt0120374,de,Das Trio,"\"Zobel and Karl are a long time gay couple who live together in a trailer home with Lizzie, Zobel's spunky daughter from a heterosexual misadventure. Together these three form a team of thieves who eke out an existence as pickpockets. After a botched job, Karl becomes unable to work, forcing Zobel and Lizzie to seek out a new partner. Lizzie recruits Rudolf, the boyishly charming town misfit. Reluctantly, Zobel allows Rudolf to join them but warns him to never break the golden rule: \"\"No exchanging of bodily fluids within the team.\"\" This dictum becomes increasingly difficult to live by as Lizzie's cravings and Zobel's own passions toward Rudolf intensify. Eventually",the golden rule is broken by Lizzie...and then again by Zobel (unbeknownst to Lizzie,of course). An intricate love triangle soon develops amongst the three that is shaped by deception,desire,"and betrayal.\"",0.180645,/oPZofzcDukLHqn7n1jsMigDy1FU.jpg,"[{'name': 'TLA Releasing', 'id': 328}]","[{'iso_3166_1': 'DE', 'name': 'Germany'}]",1998-01-29,0,0.0,"[{'iso_639_1': 'de', 'name': 'Deutsch'}]",Released,
False,"{'id': 3169, 'name': 'Dr. Dolittle Collection', 'poster_path': '/gCY8N724wNeAfegWCAkTjUSMr34.jpg', 'backdrop_path': '/dtz0ju3dikZaiSJ9HmVoMs9imT8.jpg'}",70000000,"[{'id': 35, 'name': 'Comedy'}, {'id': 10751, 'name': 'Family'}, {'id': 10749, 'name': 'Romance'}, {'id': 14, 'name': 'Fantasy'}]",,10808,tt0240462,en,Dr. Dolittle 2,"Dr. John Dolittle the beloved doctor is back, but this time around he plays cupid to bumbling circus bear Archie as he's so smitten by a Pacific Western bear female, Ava. Dr. Dolittle must help a group of forest creatures to save their forest. But with the aid of his mangy, madcap animal friends, Dr. Dolittle must teach Archie the ways of true romance in time to save his species and his home before their habit is gone. So John held a meeting for every animal in the forest to not give up without a fight no matter what kind of animal expression they have and everyone agrees to do it and save their home.",7.906683,/aecUc1LobMV56Doj99ZvJR2dXgG.jpg,"[{'name': 'Twentieth Century Fox Film Corporation', 'id': 306}, {'name': 'Joseph M. Singer Entertainment', 'id': 1301}, {'name': 'Davis Entertainment', 'id': 1302}]","[{'iso_3166_1': 'US', 'name': 'United States of America'}]",2001-06-22,176104344,87.0,"[{'iso_639_1': 'en', 'name': 'English'}]",Released,The doctor is in again.,Dr. Dolittle 2,False,4.9,422
False,,0,"[{'id': 878, 'name': 'Science Fiction'}]",,42780,tt0059878,en,Village of the Giants,"\"\"\"Genius\"\" accidentally invents \"\"goo\"\" which causes living things to rapidly grow to an enormous size. Seeing an opportunity to get rich","some delinquent teenagers steal the \"\"goo\"\" and",as a result of a sophomoric dare,"consume it themselves and become thirty feet tall. They then take over control of the town by kidnapping the sheriff's daughter and dancing suggestively.\"",0.6148,/b77SRC0CMatdNNOiCXE1Wzoxunh.jpg,"[{'name': 'Joseph E. Levine Productions', 'id': 11503}, {'name': 'Embassy Productions', 'id': 15013}, {'name': 'Berkeley Productions', 'id': 20834}]","[{'iso_3166_1': 'US', 'name': 'United States of America'}]",1965-10-20,0,81.0,"[{'iso_639_1': 'en', 'name': 'English'}]",Released,All the kids grow 10 feet tall... and TAKE OVER!,Village of the Giants
False,,0,"[{'id': 35, 'name': 'Comedy'}, {'id': 18, 'name': 'Drama'}, {'id': 878, 'name': 'Science Fiction'}, {'id': 53, 'name': 'Thriller'}]",,65632,tt0059095,it,La decima vittima,"In the near future, big wars are avoided by giving individuals with violent tendencies a chance to kill in the Big Hunt. The Hunt is the most popular form of entertainment in the world and also attracts participants who are looking for fame and fortune. It includes ten rounds for each competitor, five as the hunter and five as the victim.",1.188717,/ivIYq9nKqK1tWD27RSYZv0HhaMG.jpg,"[{'name': 'Les Films Concordia', 'id': 1714}, {'name': 'Compagnia Cinematografica Champion', 'id': 10000}]","[{'iso_3166_1': 'IT', 'name': 'Italy'}, {'iso_3166_1': 'FR', 'name': 'France'}]",1965-12-01,0,92.0,"[{'iso_639_1': 'it', 'name': 'Italiano'}]",Released,It's the 21st century and they have a licence to kill.,The 10th Victim,False,6.0,20
False,,0,"[{'id': 18, 'name': 'Drama'}, {'id': 28, 'name': 'Action'}, {'id': 53, 'name': 'Thriller'}, {'id': 80, 'name': 'Crime'}]",,13333,tt0077594,cn,死亡遊戲,"\"Billy Lo is a Hong Kong-based movie actor, who is a box office draw. His girlfriend, Ann Morris, is a singer who is also climbing to the top. Now it seems the syndicate wants Billy and Ann to join their \"\"management firm\"\". But Billy knows that they will be treated like property","so he refuses and tells her to do the same. So they try to \"\"encourage\"\" him to join but he still refuses. He would be advised that they will not stop",so he must stop them,permanently. He is even more hesitant to do that but when an attempt on his life is made,he fakes his death and alters his appearance,"and decides to go after the syndicate; taking them out one at a time.\"",9.592019,/xXZHuTg6qtxWbbXAbTZsEqhpL3.jpg,"[{'name': 'Golden Harvest Company', 'id': 2521}, {'name': 'Concord Productions Inc.', 'id': 3526}]","[{'iso_3166_1': 'HK', 'name': 'Hong Kong'}, {'iso_3166_1': 'US', 'name': 'United States of America'}]",1978-03-22,0,94.0,"[{'iso_639_1': 'cn', 'name': '广州话 / 廣州話'}, {'iso_639_1': 'en', 'name': 'English'}]",Released
False,,0,"[{'id': 18, 'name': 'Drama'}, {'id': 10769, 'name': 'Foreign'}]",,78248,tt0262210,fr,Adanggaman,"In West Africa during the late 17th century, King Adanggaman leads a war against his neighboring tribes, ordering his soldiers to torch enemy villages, kill the elderly and capture the healthy tribesmen to sell to the European slave traders. When his village falls prey to one of Adanggaman's attacks, Ossei manages to escape, but his family is murdered except for his captured mother. Chasing after the soldiers in an effort to free her, Ossei is befriended by a fierce warrior named Naka.",0.071765,/kmn1qBiCC5R9jPHOKgfJhYLKqUi.jpg,"[{'name': 'Canal+ Horizons', 'id': 23331}, {'name': 'Fabrica', 'id': 54378}, {'name': 'Amka Films Productions', 'id': 71818}, {'name': 'Direction de la Cinematographie Nationale', 'id': 75511}, {'name': 'Renardes Productions', 'id': 88331}, {'name': 'IMTM Films', 'id': 88332}, {'name': 'Abyssa Films', 'id': 88333}, {'name': 'Televisione Svizzera Italiana', 'id': 88334}]","\"[{'iso_3166_1': 'CI', 'name': \"\"Cote D'Ivoire\"\"}",{'iso_3166_1': 'BF','name': 'Burkina Faso'},{'iso_3166_1': 'FR','name': 'France'},{'iso_3166_1': 'IT','name': 'Italy'},{'iso_3166_1': 'CH',"'name': 'Switzerland'}]\"",2000-08-31,28
False,,0,"[{'id': 99, 'name': 'Documentary'}]",,13795,tt0130445,en,Alaska: Spirit of the Wild,"\"Alaska... Here, in this vast and spectacularly beautiful land teeming with abundant wildlife, discover the \"\"Spirit of the Wild.\"\" Experience it in the explosive calving of glaciers",the celestial fires of the Aurora Borealis. Witness it in the thundering stampede of caribou,the beauty of the polar bear and the stealthful,"deadly hunt of the wolf pack.\"",1.246035,/bVvmVUDs2rJgJ46j7Ja66CDQD5j.jpg,"[{'name': 'Graphic Films', 'id': 7506}, {'name': 'Houston Museum of Natural Science', 'id': 19130}, {'name': 'Alaska Film Partners Ltd.', 'id': 48942}]","[{'iso_3166_1': 'US', 'name': 'United States of America'}]",1998-09-03,0,40.0,"[{'iso_639_1': 'en', 'name': 'English'}]",Released,,Alaska: Spirit of the Wild
False,,0,"[{'id': 14, 'name': 'Fantasy'}, {'id': 35, 'name': 'Comedy'}]",,38965,tt0094593,en,18 Again!,"18 Again! is a 1988 comedy film starring George Burns and Charlie Schlatter. The plot involves a grandson switching souls with his grandfather by means of an accident. This was one of a series of unrelated films, including Like Father, Like Son and Vice Versa, produced in the late 1980s involving a similar plotline.",1.555163,/v1q2fNb87xpmo1O71Jt7VfC3Jqg.jpg,"[{'name': 'Anchor Bay', 'id': 8135}, {'name': 'New World Pictures Ltd.', 'id': 43838}, {'name': 'New World Entertainment Films', 'id': 54851}]","[{'iso_3166_1': 'US', 'name': 'United States of America'}]",1988-04-08,0,93.0,"[{'iso_639_1': 'en', 'name': 'English'}]",Released,"His mind was 81. His body was 18. When Jack Watson found his fountain of youth, it overflowed with comedy.",18 Again!,False,5.7,27
False,,0,"[{'id': 18, 'name': 'Drama'}, {'id': 10752, 'name': 'War'}]",,47817,tt0094594,en,1969,"Two rebellious youths, Ralph and Scott, find themselves struggling with adulthood as the Vietnam War rages. Feeling trapped in their small town, Scott battles with his conservative veteran father, Cliff, and Ralph deals with his desperately sexual mother, Ev. When tragic news arrives from overseas, the entire town, inspired by Ralph and Scott's antiwar efforts, reevaluates its attitude toward the war.",2.238458,/baRBC4jqRayL3SxSvkrKIbAtIIb.jpg,"[{'name': 'Atlantic Entertainment Group', 'id': 3267}, {'name': 'Atlantic Productions', 'id': 8172}]","[{'iso_3166_1': 'US', 'name': 'United States of America'}]",1988-08-18,5979011,95.0,"[{'iso_639_1': 'en', 'name': 'English'}]",Released,The year the country split apart and a generation came together.,1969,False,5.5,21
False,"{'id': 170754, 'name': 'Arthur Collection', 'poster_path': '/bdRCMpvyTX1zPR28GHcFjjA3LHt.jpg', 'backdrop_path': '/c0XFWONQ39hfOCJIg3FUuRoGgH0.jpg'}",0,"[{'id': 35, 'name': 'Comedy'}, {'id': 10749, 'name': 'Romance'}]",,26044,tt0094678,en,Arthur 2: On the Rocks,"Arthur (Dudley Moore), that irrepressible drunk, tries to sober up -- and get a job -- in this sequel to the 1981 smash hit. Meanwhile, the father of the girl Arthur stood up at the altar in the first film is conniving to trick the hapless boozer into marrying his daughter so he can gain entrée to Arthur's $750 million fortune.",3.611453,/m4dYKx8NBxI4cw0WE1ofkELsc5R.jpg,"[{'name': 'Warner Bros.', 'id': 6194}]","[{'iso_3166_1': 'US', 'name': 'United States of America'}]",1988-07-08,14681192,113.0,"[{'iso_639_1': 'en', 'name': 'English'}]",Released,No Money. Still Funny.,Arthur 2: On the Rocks,False,4.5,43
False,,4000000,"[{'id': 27, 'name': 'Horror'}, {'id': 53, 'name': 'Thriller'}]",,59797,tt0094701,en,Bad Dreams,"\"Unity Field, a \"\"free love\"\" cult from the '70s",is mostly remembered for its notorious mass suicide led by Harris,its charismatic leader. While all members are supposed to burn in a fire together,young Cynthia is spared by chance. Years later,the nightmare of Unity Field remains buried in her mind. But when those around Cynthia start killing themselves,and she begins having visions of Harris,"she may be forced to confront the past -- before it confronts her.\"",5.296777,/16wxKRGegbX47KJUnO4Z1qw23YQ.jpg,"[{'name': 'No Frills Film Production', 'id': 3851}]","[{'iso_3166_1': 'US', 'name': 'United States of America'}]",1988-04-08,9797098,86.0,"[{'iso_639_1': 'en', 'name': 'English'}]"
False,,3512454,"[{'id': 18, 'name': 'Drama'}]",,110428,tt2018086,fr,Camille Claudel 1915,"Winter, 1915. Confined by her family to an asylum in the South of France - where she will never sculpt again - the chronicle of Camille Claudel's reclusive life, as she waits for a visit from her brother, Paul Claudel.",0.134014,/sGMPDg6je1zKi0TiX9b4pP6yN02.jpg,"[{'name': 'Canal+', 'id': 5358}, {'name': 'Arte France Cinéma', 'id': 6916}, {'name': '3B Productions', 'id': 7184}, {'name': 'C.R.R.A.V. Nord Pas de Calais', 'id': 11433}, {'name': 'Region PACA', 'id': 78987}]","[{'iso_3166_1': 'FR', 'name': 'France'}]",2013-03-13,115860,95.0,"[{'iso_639_1': 'fr', 'name': 'Français'}]",Released,,Camille Claudel 1915,False,7.0,20
False,"{'id': 10893, 'name': 'Critters Collection', 'poster_path': '/rWZytVHeFsADHeuoPCIf4c7Qepb.jpg', 'backdrop_path': '/9K0ycQWRv4vSL1oM8y7dOXwFpy6.jpg'}",4500000,"[{'id': 35, 'name': 'Comedy'}, {'id': 27, 'name': 'Horror'}, {'id': 878, 'name': 'Science Fiction'}, {'id': 53, 'name': 'Thriller'}]",,10127,tt0094919,en,Critters 2,"A batch of unhatched critter eggs are mistaken for Easter eggs by the country-folk inhabitants of Grover's Bend and, before long, the ferocious furballs are on the rampage again.",9.97523,/8aEf1xiAemsZIMpAL6pHQeJvOw2.jpg,"[{'name': 'New Line Cinema', 'id': 12}, {'name': 'Sho Films', 'id': 1532}]","[{'iso_3166_1': 'US', 'name': 'United States of America'}]",1988-04-29,3813293,86.0,"[{'iso_639_1': 'en', 'name': 'English'}]",Released,Get Ready for Seconds... They're Back,Critters 2,False,5.0,91
False,"{'id': 10893, 'name': 'Critters Collection', 'poster_path': '/rWZytVHeFsADHeuoPCIf4c7Qepb.jpg', 'backdrop_path': '/9K0ycQWRv4vSL1oM8y7dOXwFpy6.jpg'}",0,"[{'id': 35, 'name': 'Comedy'}, {'id': 27, 'name': 'Horror'}, {'id': 878, 'name': 'Science Fiction'}, {'id': 53, 'name': 'Thriller'}]",,12702,tt0101627,en,Critters 3,"In what appears to be a cross between Critters and The Towering Inferno, the residents of a shoddy L.A. apartment block are chased up to the roof by hoards of the eponymous hairy horrors.",5.163739,/m9XgzAJk6b9ei4F21IcH1lAzUZX.jpg,"[{'name': 'New Line Cinema', 'id': 12}, {'name': 'OH Films', 'id': 66755}]","[{'iso_3166_1': 'US', 'name': 'United States of America'}]",1991-12-11,0,86.0,"[{'iso_639_1': 'en', 'name': 'English'}]",Released,First they destroyed a farm. Then they terrorised a town. Now they're ready to do some real damage!,Critters 3,False,4.5,70
False,,0,"[{'id': 18, 'name': 'Drama'}, {'id': 28, 'name': 'Action'}, {'id': 53, 'name': 'Thriller'}]",,12505,tt0095532,en,Little Nikita,"\"Roy Parmenter is an FBI agent in San Diego; 20 years ago his partner was killed by a Soviet spy, nicknamed Scuba, still at large. Scuba is now trying to extort the Soviets; to prove he's serious, he's killing their agents one by one, including \"\"sleepers","\"\" agents under deep cover awaiting orders. Roy interviews a high school lad",Jeff Grant,an applicant to the Air Force Academy. In a routine background check,Roy discovers that Jeff's parents are sleepers. He must see if Jeff is also a spy,confront the parents yet protect them,and catch his nemesis. Meanwhile,the Soviets have sent their own spy-catcher,the loner Karpov,"to reel in Scuba. Alliances shift; it's cat and mouse.\"",2.097317,/tWL8kUcdz5MBE7dlm8YbxeNTUsq.jpg,"[{'name': 'Columbia Pictures Corporation', 'id': 441}]","[{'iso_3166_1': 'US', 'name': 'United States of America'}]",1988-03-17
False,,0,"[{'id': 35, 'name': 'Comedy'}, {'id': 18, 'name': 'Drama'}]",,70842,tt0096029,en,Salome's Last Dance,"\"Oscar Wilde watches an outrageous staging of his banned play \"\"Salome\"\" at a London brothel",with parts played by prostitutes,Wilde's host,his lover Bosey,"and Lady Alice.\"",0.654549,/pTa4OElppiowGDDIoLJePGIDZ4k.jpg,"[{'name': 'Vestron Pictures', 'id': 12360}, {'name': 'Jolly Russell Productions', 'id': 14310}, {'name': 'Vestron UK', 'id': 14311}]","[{'iso_3166_1': 'GB', 'name': 'United Kingdom'}, {'iso_3166_1': 'US', 'name': 'United States of America'}]",1988-05-06,331000,89.0,"[{'iso_639_1': 'en', 'name': 'English'}]",Released,"NOTORIOUS, SCANDALOUS, WILDE!"
False,"{'id': 86347, 'name': 'Short Circuit Collection', 'poster_path': '/AZFGrT6LotCm69uNgVnTkUYBGh.jpg', 'backdrop_path': '/o3C0qlKyg7Haot9ZVqtRtsrKwWc.jpg'}",0,"[{'id': 35, 'name': 'Comedy'}, {'id': 10751, 'name': 'Family'}, {'id': 878, 'name': 'Science Fiction'}, {'id': 18, 'name': 'Drama'}]",,11966,tt0096101,en,Short Circuit 2,Robot Johnny Five comes to the city and gets manipulated by criminals who want him for their own purposes.,7.34677,/18yjQQMK6mtB3L3os1kmT7MwXdf.jpg,"[{'name': 'David Foster Productions', 'id': 496}, {'name': 'TriStar Pictures', 'id': 559}]","[{'iso_3166_1': 'US', 'name': 'United States of America'}]",1988-07-06,21630088,110.0,"[{'iso_639_1': 'en', 'name': 'English'}]",Released,The adventures of America's most electric leading man continue.,Short Circuit 2,False,5.5,168
False,,5000000,"[{'id': 18, 'name': 'Drama'}, {'id': 9648, 'name': 'Mystery'}]",,41974,tt0096294,en,Track 29,"Years after a desperate teenage Linda gives up her baby for adoption, she finds herself face-to-face with Martin, a young man claiming to be her long-lost son. Linda embraces Martin and in him finds a welcome reprieve from her unhappy marriage to the neglectful Henry. But soon Martin grows violent and becomes obsessed with Henry -- a philandering man whose only offspring is an expansive model train set that devours his waking hours.",1.129645,/3V9PpZyxg9vzs6VW1vTrZ6x5Rvi.jpg,"[{'name': 'HandMade Films', 'id': 20076}]","[{'iso_3166_1': 'GB', 'name': 'United Kingdom'}, {'iso_3166_1': 'US', 'name': 'United States of America'}]",1988-05-15,0,86.0,"[{'iso_639_1': 'en', 'name': 'English'}]",Released,Was he her dream or obsession? Was she his mother or his lover?,Track 29,False,6.2,6
False,"{'id': 153948, 'name': 'Best of the Best Collection', 'poster_path': '/lRzylBJXIPsFxiTztxLNYhiZ4GK.jpg', 'backdrop_path': '/orC5lXKZTsitJguQFVxJcEhcTc.jpg'}",0,"[{'id': 28, 'name': 'Action'}, {'id': 53, 'name': 'Thriller'}]",,32049,tt0106393,en,Best of the Best 2,"In an underground fight club, blackbelt Travis Brickley is killed after losing to the evil martial arts master Brakus. Travis' death is witnessed by Walter Grady, the son of his best friend Alex Grady. Alex and his partner, Tommy Lee, vow to avenge their friend's death by defeating Brakus and shutting down the fight club.",13.053072,/tu7xa8yzywtOjuffN5jEakqIp5N.jpg,"[{'name': 'The Movie Group', 'id': 44962}, {'name': 'Picture Securities', 'id': 91380}]","[{'iso_3166_1': 'US', 'name': 'United States of America'}]",1993-01-01,6500000,101.0,"[{'iso_639_1': 'en', 'name': 'English'}]",Released,Get ready for the ultimate challenge!,Best of the Best 2,False,6.1,30
False,"\"{'id': 91746, 'name': \"\"Bill & Ted's Most Excellent Collection\"\"",'poster_path': '/e8ytcWY0r32q3RdNJDnv5KRh9hC.jpg',"'backdrop_path': '/m7KWyG7VwXoPbwr3DgeDqed8qU0.jpg'}\"",10000000,"[{'id': 12, 'name': 'Adventure'}, {'id': 35, 'name': 'Comedy'}, {'id': 878, 'name': 'Science Fiction'}]",http://www.billandted.org/,1648,tt0096928,en,Bill & Ted's Excellent Adventure,"\"In the small town of San Dimas, a few miles away from Los Angeles, there are two nearly brain dead teenage boys going by the names of Bill S, Preston ESQ. and Ted Theodore Logan, they have a dream together of starting their own rock and roll band called the \"\"Wyld Stallyns\"\". Unfortunately",they are still in high school and on the verge of failing out of their school as well,and if they do not pass their upcoming history report,they will be separated as a result of Ted's father sending him to military school. But,what Bill and Ted do not know is that they must stay together to save the future. So,a man from the future named Rufus came to help them pass their report. So,"both Bill and Ted decided to gather up historical figures which they need for their report. They are hoping that this will help them pass their report so they can stay together.\"",15.109261,/b2yKJ1STPklVSRtso2Tg4TPXK7u.jpg,"[{'name': 'Orion Pictures', 'id': 41}]","[{'iso_3166_1': 'US', 'name': 'United States of America'}]",1989-02-17,40485039
